soluzione,definizione
BA,Le iniziali del cantante Bryan Adams
BA,Le iniziali del secondo uomo sulla Luna
BA,Le iniziali dell'attore Ben Affleck
BA,Sigla automobilistica del capoluogo pugliese di San Nicola
BAAL,Antica divinità cananea
BABA,"Alì..., dei quaranta ladroni"
BABA,Dolce napoletano imbevuto di rum
BABBANO,Il non mago nel mondo di Harry Potter
BABBO,Il padre detto con affetto
BABBO,Quello Natale porta doni
BABBUINO,Scimmia dal muso canino
BABBUINO,Scimmia dal muso lungo e severo
BABELE,La gran confusione di voci e di lingue
BABELE,La torre biblica della confusione delle lingue
BABELE,Confusione in cui nessuno riesce a capirsi
BABILONESI,Popolo dell'antica Mesopotamia
BABILONIA,Antica città mesopotamica dei giardini pensili
BABILONIA,Una gran...: confusione e caos
BABILONIA,"Caos di lingue, persone e rumori"
BABY,"Bambino molto piccolo, nel linguaggio internazionale"
BABY,"Bambino molto piccolo, anche in inglese"
BABYSITTER,Si prende cura dei bambini in assenza dei genitori
BACCA,Piccolo frutto carnoso contenente uno o più semi
BACCALA,Il merluzzo conservato sotto sale
BACCALA,Restare come un...: impalato e imbambolato
BACCALA,Chi resta impalato e senza parole
BACCANALE,Festa sfrenata con memoria dionisiaca
BACCANO,Rumore più disordinato che forte
BACCANO,Chiasso disordinato
BACCANO,Lo fanno più persone parlando tutte insieme
BACCANTI,Seguaci del dio romano del vino
BACCARAT,Gioco di carte dei casinò
BACCHETTA,La tiene il direttore d'orchestra
BACCHETTA,Può dirigere un'orchestra o colpire un tamburo
BACCHETTA,Un mago la agita prima dell'incantesimo
BACCO,Il dio romano del vino
BACERA,Toccherà con le labbra
BACH,"Compose fughe, cantate e passioni"
BACH,Contrappunto in quattro lettere
BACH,"Johann Sebastian, autore dei Concerti brandeburghesi"
BACHECA,Espone avvisi dietro un vetro
BACHECA,Vetrina per avvisi e trofei
BACHECA,"Espone comunicazioni, fotografie o avvisi"
BACIA,Tocca con le labbra
BACIARE,Toccare con le labbra
BACIATO,Toccato con le labbra
BACILE,Catino largo per acqua e panni
BACILE,Recipiente largo e basso
BACILLO,Batterio a forma di bastoncino
BACINETTO,Elmo medievale appuntito
BACINO,La conca che raccoglie le acque
BACINO,La parte del corpo tra ventre e gambe
BACINO,Parte del corpo o conca d'acqua
BACINO,Conca naturale o parte dello scheletro
BACIO,Gesto d'affetto con le labbra
BACIO,Il cioccolatino di Perugia col bigliettino
BACIO,Quello di Giuda è traditore
BACIO,Tocco con le labbra
BACKGAMMON,Gioco da tavolo con dadi e pedine
BACKGROUND,Esperienze e conoscenze accumulate nel tempo
BACKGROUND,Ciò che sta dietro una storia o una persona
BACKSTAGE,Il dietro le quinte di uno spettacolo
BACKUP,Copia di sicurezza dei dati
BACO,Il verme della seta
BACO,L'errore nascosto nel programma del computer
BACO,Larva da seta
BACO,Difetto che rode dall'interno
BACON,"Francis, pittore dei papi e dei volti deformati"
BACON,La pancetta affumicata della colazione inglese
BACON,Pittore inglese dei volti deformati
BACONE,Il filosofo inglese del metodo induttivo
BAD,"Cattivo, in inglese"
BAD,Il Bunny portoricano del reggaeton
BADA,Fa attenzione
BADA,Tenere a...: tenere a distanza
BADAI,Feci attenzione
BADARE,Fare attenzione
BADARE,Occuparsi con cura di qualcosa
BADARE,Pensare a ciò che si sta facendo
BADATO,Prestato attenzione
BADIA,L'abbazia retta dall'abate
BADIA,Complesso religioso retto da un abate
BADIA,"Ha chiostro, celle e una comunità monastica"
BADILE,Attrezzo per scavare
BADILE,Pala da cantiere o da orto
BADILI,Servono a scavare nella terra
BADO,Faccio attenzione
BADOGLIO,"Pietro, maresciallo d'Italia e capo del governo nel 1943"
BAFFI,Leccarsi i... per un manicaretto
BAFFI,Peli sopra il labbro
BAFFO,Pelo sopra il labbro
BAFFO,Piccolo segno che rompe la regolarità di una superficie
BAGAGLIAIO,Vano dell'auto dove spariscono le valigie
BAGAGLIAIO,Vano posteriore destinato alle valigie
BAGAGLIAIO,Si apre per caricare valigie nell'auto
BAGAGLIO,Peso che il viaggiatore dichiara o nasconde
BAGAGLIO,Valigia o insieme di valigie
BAGAGLIO,Insieme di esperienze e conoscenze possedute
BAGATELLA,"Cosa da poco, ma con nome elegante"
BAGEL,Il panino americano a ciambella
BAGGIO,Il Roberto Divin Codino
BAGHDAD,Capitale irachena sul Tigri
BAGLIONI,Il Claudio di Questo piccolo grande amore
BAGLIORE,Luce improvvisa nel buio
BAGLIORI,Lampi improvvisi nel buio
BAGNA,"La...cauda, intingolo piemontese"
BAGNA,Rende umido
BAGNA,È piemontese quella cauda
BAGNACAUDA,La salsa calda piemontese di aglio e acciughe
BAGNAI,Inumidii con acqua
BAGNAIA,"Francesco, pilota italiano campione della MotoGP"
BAGNARE,Rendere umido
BAGNARE,Inzuppare o rendere umido
BAGNATO,Reso umido
BAGNATO,Coperto d'acqua o di umidità
BAGNINO,Sorveglia chi nuota al lido
BAGNO,Il...Maria della cottura delicata
BAGNO,"Stanza, immersione o folla compatta"
BAGNO,Ha sanitari e spesso una doccia
BAGOLARO,Albero ornamentale dei viali
BAGUETTE,Il filoncino di pane francese
BAHAMAS,Arcipelago caraibico di Nassau
BAHRAIN,Arcipelago del Golfo Persico
BAHREIN,Regno insulare del Golfo Persico
BAHT,La valuta della Thailandia
BAIA,"La...dei Porci, a Cuba"
BAIA,Riparo marino che invita all'ancora
BAIA,Prendersi gioco di qualcuno: mettere in...
BAIKAL,Il lago più profondo della Terra
BAILAMME,Il gran chiasso confuso
BAIO,Cavallo di mantello rossiccio
BAITA,Rifugio di montagna in legno o pietra
BAKU,Capitale azera sul Caspio
BALALAIKA,Strumento russo a cassa triangolare
BALATON,Il maggiore lago dell'Ungheria
BALAUSTRA,Il parapetto a colonnine
BALAUSTRA,Parapetto formato da una fila di colonnine
BALAUSTRATA,Lunga struttura sporgente lungo una facciata
BALAUSTRO,Colonnina che fa ringhiera
BALBETTO,Parlo con la lingua impacciata
BALBO,L'Italo trasvolatore e gerarca
BALCANI,Penisola del sud-est europeo
BALCONATA,Lunga struttura sporgente lungo una facciata
BALCONE,Il terrazzino sporgente dalla facciata
BALCONE,Sporge dalla facciata di casa
BALCONE,Sporge dalla facciata per prendere aria
BALCONE,Sporgenza con ringhiera
BALCONI,Sporgono dalle facciate
BALDACCHINO,"Copertura ornamentale sopra un altare, un trono o un letto"
BALDANZA,Sicurezza un po' spavalda
BALDASSARRE,Il re del banchetto della scritta sul muro
BALEARI,Isole spagnole di Maiorca e Ibiza
BALENA,Il più grande animale dei mari
BALENA,Il più grande mammifero del mare
BALENCIAGA,La maison di origine spagnola
BALENE,Giganti del mare che soffiano
BALENOTTERA,Gigante marino che filtra il plancton
BALESTRA,Arma che scaglia dardi con uno scatto
BALESTRUCCIO,Uccello migratore parente della rondine
BALI,Isola indonesiana di templi e risaie
BALIA,In...di: alla mercé di qualcosa
BALIA,Nutrice di un neonato o condizione di dipendenza
BALIA,Essere in... significa dipendere da altri
BALISTA,Antica macchina lanciatrice di dardi
BALLA,Il Giacomo pittore futurista
BALLA,"La frottola, la grossa bugia"
BALLA,"Mucchio compresso di fieno, carta o tessuto"
BALLAI,Mi mossi a ritmo
BALLARE,Muoversi a ritmo
BALLARE,Muovere il corpo seguendo un ritmo
BALLATA,Racconto in versi con ritmo da canto
BALLATO,Eseguito seguendo il ritmo
BALLATOIO,Il corridoio esterno che dà sulle stanze
BALLERINA,La scarpa bassa da donna
BALLERINA,Sta sulle punte per mestiere
BALLERINA,Danza sulle punte o in scena
BALLERINO,Interpreta passi e coreografie
BALLO,Lo si apre con le danze
BALLO,Tirare in...: chiamare in causa
BALLO,Danza organizzata o festa danzante
BALOTELLI,"Mario, calciatore soprannominato Super Mario"
BALSAMO,Lenisce la pelle o profuma i capelli
BALSAMO,Sostanza lenitiva
BALSAMO,"Dà sollievo a pelle, capelli o ferite"
BALTICO,Mare freddo del Nord Europa
BALTICO,Mare quasi chiuso dell'Europa settentrionale
BALTIMORA,La città americana del Maryland
BALUARDO,Difesa estrema di mura o idee
BALUARDO,"Difesa solida, anche figurata"
BALUARDO,Difesa avanzata di mura o ideali
BALZA,Salto o fascia d'abito
BALZA,Parete rocciosa ripida e sporgente
BALZAC,Autore della Commedia umana
BALZAC,Scrittore della Commedia umana
BALZO,Cogliere la palla al...
BALZO,Passaggio improvviso da uno stato a un altro
BALZO,Salto netto o sporgenza rocciosa
BAMAKO,Capitale del Mali
BAMAKO,Capitale maliana sul Niger
BAMBAGIA,"Cotone soffice, proverbiale per delicatezza"
BAMBI,Il cerbiatto protagonista del classico Disney
BAMBINA,Persona di sesso femminile in età infantile
BAMBINA,Piccola protagonista di una fiaba o di un gioco
BAMBINO,Essere umano nei primi anni di vita
BAMBINO,Gesù...: la natività
BAMBINO,"Figlio, alunno o piccolo paziente"
BAMBOLA,Giocattolo con sembianze umane
BAMBOLA,"La bella ragazza, in gergo affettuoso"
BAMBOLA,Compagna di gioco con sembianze umane
BAMBOLE,Compagne di gioco in miniatura
BAMBU,Canna orientale che cresce in fretta
BANALE,"Scontato, privo di originalità"
BANALE,Privo di originalità e prevedibile
BANALE,Così è una frase già sentita troppe volte
BANALITA,Osservazione ovvia e priva di originalità
BANALITA,Cosa scontata che non aggiunge nulla
BANANA,Frutto curvo da buccia scivolosa
BANANA,Il tiro a...: la traiettoria curva del pallone
BANANA,La buccia su cui si scivola nelle gag
BANCA,"La...dati, l'archivio di informazioni"
BANCA,Saltare il...: vincere tutto al gioco
BANCA,Vi si depositano i risparmi
BANCA,Vi si riscuote un assegno
BANCALE,Pedana per trasportare merci
BANCAROTTA,Crollo economico di chi non paga più
BANCAROTTA,Il fallimento rovinoso di un'impresa
BANCAROTTA,Insolvenza che porta al fallimento
BANCHETTO,Tavolo da mercato o piccolo convito
BANCHINA,Marciapiede di stazione o molo
BANCHINA,Margine del porto o della strada
BANCHINA,Si aspetta lì il treno o il battello
BANCHINA,Zona rialzata dove si attende un mezzo
BANCHINE,Dove si attende il treno o si ormeggia
BANCO,Chi tiene la cassa al gioco
BANCO,Tavolo da scuola o da vendita
BANCO,Piano di lavoro o tavolo di vendita
BANCOMAT,Lo sportello automatico per prelevare contanti
BANCOMAT,Sportello automatico da cui si può prelevare denaro
BANCOMAT,La carta usata anche per ottenere contante
BANCONOTA,Carta di valore emessa dall'istituto centrale
BANDA,Fascia diagonale dello stemma
BANDA,Il complesso di strumenti a fiato
BANDA,La gang di malviventi
BANDA,"Gruppo organizzato, musicale o criminale"
BANDANA,Fazzoletto colorato legato sul capo
BANDERUOLA,Gira sul tetto indicando il vento
BANDIERA,"Bianca, chiede la resa"
BANDIERA,Identità che sventola
BANDIERA,Il giocatore...simbolo della squadra
BANDIERA,Si alza sul pennone
BANDIERE,Sventolano sui pennoni
BANDIRE,Proclamare pubblicamente o escludere per decreto
BANDIRE,Annunciare con un proclama
BANDITA,Zona in cui una pratica è vietata
BANDITO,Fuori legge o annunciato pubblicamente
BANDITO,"Il fuorilegge, il rapinatore"
BANDITO,Esiliato o dichiarato fuorilegge
BANDITO,Fuorilegge che vive ai margini della legge
BANDO,Annuncio pubblico di un'autorità
BANDO,Può convocare un concorso o imporre un divieto
BANDOLO,Il capo per districare la matassa
BANDONE,Lamiera che chiude botteghe e garage
BANDONEON,Strumento a mantice del tango
BANDUNG,Città dell'isola di Giava
BANG,Rumore secco da fumetto
BANG,Esplosione scritta in tre lettere
BANGKOK,Capitale thailandese dei templi dorati
BANGUI,La capitale del Centrafrica
BANJO,Strumento a corde della musica country
BANJUL,La capitale del Gambia
BANKSY,Il misterioso street artist britannico
BANNER,"Bruce..., l'alter ego di Hulk"
BANNER,Lo striscione pubblicitario sul web
BANSHEE,Spirito femminile irlandese che annuncia la morte
BANTU,Gruppo di lingue dell'Africa subsahariana
BAOBAB,L'albero africano dal tronco enorme
BAR,"Ha banco, ma non sempre carte"
BAR,L'unità di misura della pressione
BAR,Locale con bancone per caffè e bevande
BARA,Cassa per l'ultimo viaggio
BARA,"Imbroglia al gioco, terza persona"
BARA,Ultimo contenitore di chi non viaggia più
BARABBA,Il prigioniero liberato al posto di Gesù
BARACCA,Il Francesco asso dell'aviazione
BARACCA,Mandare avanti la...: la famiglia o l'impresa
BARACCA,Riparo povero di assi e lamiere
BARACCA,Costruzione povera di assi o lamiera
BARAONDA,Confusione rumorosa da folla in movimento
BARATRO,L'abisso profondo e oscuro
BARATRO,La rovina: sull'orlo del...
BARATRO,"Precipizio, anche morale"
BARATRO,Vuoto che invita alla prudenza
BARATTO,Lo scambio di merci senza denaro
BARATTO,Scambio di beni senza denaro
BARATTOLI,Custodiscono marmellate e conserve
BARATTOLO,Contenitore cilindrico con coperchio
BARATTOLO,Recipiente per conserve
BARATTOLO,Custodisce conserve sotto un coperchio
BARBA,Che...!: che noia mortale
BARBA,Cresce sul mento dell'uomo
BARBA,Farla significa radersi
BARBA,Filamenti sottili che pendono da una radice
BARBABLU,Il marito crudele della fiaba
BARBADOS,Isola delle Piccole Antille
BARBAGIANNI,Rapace notturno dal volto a cuore
BARBAGLIO,Il bagliore che abbaglia
BARBARA,Il nome della conduttrice d'Urso
BARBARA,"Santa..., patrona degli artiglieri"
BARBARIE,Crudeltà priva di civiltà
BARBARO,"Rozzo, incivile o appartenente a popoli antichi"
BARBAROSSA,Imperatore svevo sconfitto a Legnano
BARBE,Crescono sui menti
BARBECUE,Cottura all'aperto sulla griglia
BARBIE,Il film di Greta Gerwig del 2023
BARBIE,La bambola bionda della Mattel
BARBIERE,Taglia capelli e rade il viso
BARBIERE,Professionista della rasatura e del taglio maschile
BARBIERE,"Usa rasoio, forbici e pettine"
BARBIERI,Lavorano tra rasoi e forbici
BARBIGLIO,Filamento da pesce o da spiga
BARBO,Pesce di fiume con i barbigli
BARBONCINO,La razza canina dal pelo riccio
BARBONE,Cane riccio o persona senza dimora
BARBONE,Il cane dal folto pelo riccio
BARBONE,"Il senzatetto, il clochard"
BARBONE,"Persona senza dimora, nel linguaggio comune"
BARBRA,Il nome della cantante Streisand
BARCA,Natante di piccole dimensioni
BARCA,Una gran quantità: una... di soldi
BARCA,"Una grande quantità, in un'espressione familiare"
BARCAAVELA,Natante spinto dal vento
BARCAROLA,Canto dal ritmo di gondola
BARCELLONA,Città catalana della Sagrada Familia
BARCELLONA,Il club catalano blaugrana
BARCHE,Scivolano sull'acqua
BARCONE,"Grande natante, spesso molto carico"
BARCONE,"Grande natante, spesso da trasporto"
BARDANA,Pianta con capolini che si attaccano ai vestiti
BARDEM,Il Javier di Non è un paese per vecchi
BARDO,Autore di versi celtico da nebbie antiche
BARDO,Il sommo poeta inglese: il...di Avon
BARDO,Poeta celtico da nebbie antiche
BARDO,Poeta e cantore delle tradizioni celtiche
BARELLA,Letto leggero per trasportare feriti
BARELLA,"Nicolò, centrocampista campione d'Europa nel 2021"
BARESI,"Franco, storico libero e capitano del Milan"
BARGNANI,Il cestista azzurro prima scelta NBA 2006
BARI,Città pugliese di San Nicola
BARI,I truffatori al tavolo da gioco
BARICENTRO,Punto di equilibrio di una figura
BARILE,L'unità di misura del petrolio
BARILE,Recipiente cilindrico
BARILE,Recipiente panciuto da cantina
BARILE,Recipiente panciuto per vino o altri liquidi
BARILLA,Storico pastificio italiano nato a Parma
BARIO,Metallo del solfato per radiografie
BARIONE,Particella composta da tre quark
BARISTA,"Serve caffè, cappuccini e conversazioni al banco"
BARISTA,Lavora dietro il banco di caffè e cappuccini
BARITE,Minerale di bario
BARITONO,Voce maschile tra tenore e basso
BARLUME,Il debole chiarore
BARLUME,Poca luce e poca speranza
BARLUME,"Un... di speranza, una flebile traccia"
BARLUME,Debole traccia di luce o di speranza
BARMAN,Chi prepara i cocktail al banco
BARMAN,Prepara cocktail e serve al bancone
BARNABA,Compagno di viaggio di san Paolo
BARNEY,Il nome del dinosauro viola per bambini
BARNEY,L'amico di Fred Flintstone
BAROCCA,Ricca e stravagante
BAROCCHE,Ricche e stravaganti
BAROCCHI,Ricchi e stravaganti
BAROCCO,Ricco e stravagante
BAROLO,Il pregiato vino rosso delle Langhe
BAROMETRO,Legge la pressione e annuncia cambi di tempo
BARONE,"Il...Rosso, il celebre aviatore"
BARONE,Titolo nobiliare sotto il visconte
BARONE,Titolo nobiliare inferiore a quello di visconte
BARRA,Chiude con una linea
BARRA,Quella del timone con cui si governa la nave
BARRA,"Asta rigida, leva o segno grafico"
BARRACUDA,Il predatore marino allungato dai denti aguzzi
BARRAI,Chiusi con una linea
BARRARE,Chiudere con una linea
BARRATO,Chiuso con una linea
BARRIERA,Ostacolo che chiude il passaggio
BARRIERA,Segna o chiude un confine
BARRIERA,Ostacolo fisico o figurato da superare
BARRIERE,Bloccano il passaggio a caselli o binari
BARRITO,Il verso dell'elefante
BARRO,Chiudo con una linea
BARRY,Il nome del cantautore White
BART,Il nome del maggiore dei Simpson
BART,"La metropolitana di San Francisco, in sigla"
BARTALI,Il Gino campione del ciclismo
BARTIZZANA,Torretta sporgente d'angolo
BARTOLOMEO,Apostolo martirizzato scorticato
BARYSHNIKOV,Il ballerino russo passato all'Occidente
BARZAGHI,"Giuseppe, filosofo e teologo domenicano"
BARZELLETTA,Storiella che cerca la risata
BARZELLETTA,Racconto breve costruito per far ridere
BASA,Fonda su un appoggio
BASAI,Fondai su un appoggio
BASALTO,Roccia vulcanica scura
BASAMENTO,Parte inferiore che sostiene una costruzione
BASAMENTO,Sostegno su cui poggiano statua o colonna
BASARE,Fondare su un appoggio
BASARE,Fondare una scelta su dati o ragioni
BASATO,Fondato su un appoggio
BASCO,Copricapo piatto o abitante dei Pirenei
BASCO,Copricapo piatto tipico dei Pirenei
BASE,Il contrario chimico dell'acido
BASE,L'accampamento militare
BASE,Sostegno o punto di partenza
BASE,Elemento essenziale o punto di partenza
BASILARE,"Fondamentale, non accessorio"
BASILARE,Sta alla radice di un ragionamento
BASILICA,Chiesa grande e forma romana antica
BASILICA,Grande chiesa a navate solenni
BASILICATA,La regione di Matera
BASILICATA,Regione tra Matera e il Pollino
BASILICO,Erba del pesto genovese
BASILICO,Profuma il pesto nel mortaio
BASILISCO,Mostro il cui sguardo uccide
BASKET,Ha tra le sue parti rimbalzo
BASKETBALL,Ha tra le sue parti rimbalzo
BASO,Fondo su un appoggio
BASQUIAT,L'artista newyorkese dei graffiti anni Ottanta
BASSA,La...marea che scopre la spiaggia
BASSA,Poco elevata
BASSANI,Autore del Giardino dei Finzi-Contini
BASSE,Poco elevate
BASSI,Poco elevati
BASSO,"Ivan, scalatore azzurro due volte al Giro"
BASSO,La voce maschile più grave
BASSO,Lo strumento a quattro corde del gruppo rock
BASSO,Poco elevato
BASSORILIEVO,Scultura che sporge appena dal fondo
BASSOTTI,Cani rasoterra dal passo buffo
BASSOTTO,Il cane dalle zampe corte e il corpo lungo
BASTA,La piega cucita per accorciare
BASTA,È sufficiente
BASTAI,Risultai sufficiente
BASTARE,Essere sufficiente
BASTATO,Risultato sufficiente
BASTET,La dea egizia dalla testa di gatto
BASTIONE,Sporgenza difensiva delle mura
BASTIONE,Opera difensiva sporgente dalle mura
BASTIONE,Protegge una cinta muraria dagli attacchi
BASTO,La sella da soma del mulo
BASTO,Sono sufficiente
BASTONCELLO,Cellula della retina per il buio
BASTONCINO,Quello di pesce è impanato
BASTONCINO,Uno dei due utensili orientali usati per mangiare
BASTONCINO,"Sottile pezzo diritto di legno, plastica o altro materiale"
BASTONE,Il seme delle carte napoletane
BASTONE,Quello del comando di chi guida
BASTONE,Sostegno da passeggio
BASTONE,Sostiene il passo e può finire tra le ruote
BASTONI,"Alessandro, difensore campione d'Europa nel 2021"
BATACCHIO,Fa risuonare la campana dall'interno
BATAVI,Antico popolo germanico dei Paesi Bassi
BATISTA,"Gabriel, bomber argentino della Fiorentina"
BATISTUTA,"Gabriel, bomber argentino della Fiorentina"
BATMAN,Il supereroe pipistrello di Gotham City
BATRACIO,Anfibio nominato da naturalisti
BATTAGLIA,Scontro armato o duro confronto
BATTAGLIA,"Duro confronto, anche figurato"
BATTE,"...la fiacca: poltrisce, fa il pigro"
BATTE,Colpisce ripetutamente
BATTELLI,Navigano su fiumi e laghi
BATTELLO,Piccola nave da fiume o lago
BATTELLO,Piccola nave da trasporto
BATTELLO,Piccolo mezzo per navigare
BATTELLO,"Piccola imbarcazione per fiumi, laghi o porti"
BATTENTE,Martelletto applicato a una porta
BATTENTE,Anta mobile di una porta
BATTENTE,Parte di porta che ruota sui cardini
BATTERE,Colpire ripetutamente
BATTERE,Colpire ripetutamente o superare un avversario
BATTERE,Vincere qualcuno in gara
BATTERIA,Dà energia o ritmo
BATTERIA,Ha poli positivo e negativo
BATTERIA,"Insieme coordinato di strumenti, pezzi o cannoni"
BATTERIOLOGIA,Scienza che studia i microrganismi procarioti
BATTERISTA,Tiene il ritmo tra piatti e tamburi
BATTERISTA,"Suona piatti, rullante e grancassa"
BATTERSI,Affrontarsi in una gara o in uno scontro
BATTIATO,Il cantautore siciliano della Cura
BATTICUORE,Accelera nel petto per paura o amore
BATTIPANNI,Bacchetta per spolverare tappeti
BATTIPANNI,Si usava per spolverare i tappeti
BATTISCOPA,Listello alla base del muro
BATTISTA,Il santo che immerse Gesù nel Giordano
BATTISTERO,Dove l'acqua entra nel rito
BATTISTI,L'autore di Emozioni con Mogol
BATTITO,Il colpo ritmico del cuore
BATTITO,Ritmo del cuore o d'ali
BATTITO,Pulsazione ritmica del cuore o delle ali
BATTO,Colpo ripetutamente
BATTUTA,Colpo che mette la palla in gioco
BATTUTA,Unità ritmica delimitata dalle stanghette in musica
BAUDELAIRE,Autore di versi dei Fiori del male
BAUDELAIRE,Poeta dei Fiori del male
BAUDO,"Il presentatore di Sanremo per antonomasia, Pippo"
BAUHAUS,La scuola tedesca di design del Novecento
BAULE,Cassa da viaggio
BAULE,Grosso contenitore da viaggio
BAULE,Il vano bagagli dell'auto
BAULE,Cassa da viaggio o vano posteriore dell'auto
BAULI,Custodiscono corredi e ricordi
BAVAGLINO,Protegge la pappa dei neonati
BAVAGLIO,Imporre il...: censurare
BAVAGLIO,Panno per il neonato a tavola
BAVAGLIO,Si mette ai bimbi mentre mangiano
BAVIERA,Regione tedesca di castelli e birra
BAZAR,Il mercato coperto orientale
BE,Iniziali del musicista Eno
BE,Iniziali della cantante Eilish
BE,"Sii, in inglese"
BE,Simbolo dell'elemento con numero atomico 4
BEA,Un comune diminutivo femminile
BEA,Rende felice in forma letteraria
BEAGLE,Il cane da seguita dalle orecchie lunghe
BEAGLE,Snoopy è un cane di questa razza
BEARZOT,Il ct campione del mondo nel 1982
BEATLES,Il quartetto di Liverpool di Yesterday
BEATO,Chi è un gradino sotto il santo
BEATO,"Felice in terra, ufficiale in cielo"
BEATRICE,La donna guida di Dante
BEBE,Neonato o bambino molto piccolo
BEBE,Bambino molto piccolo
BEBOP,Stile veloce e virtuoso del jazz
BECCA,Afferra col rostro
BECCACCIA,Uccello da caccia dal rostro lungo
BECCAFICO,Uccelletto e involtino siciliano
BECCARE,"Cogliere sul fatto, sorprendere"
BECCARE,Prendere con il rostro
BECCARE,Sorprendere qualcuno sul fatto
BECCARIA,Il Cesare di Dei delitti e delle pene
BECCATA,"Osservazione breve, spesso pungente"
BECCATA,Commento rapido che può lasciare il segno
BECCATO,Preso con il rostro
BECCHERA,Prenderà con il rostro
BECCHINO,Si occupa delle sepolture
BECCO,Estremità di un uccello o di una brocca
BECCO,La bocca degli uccelli
BECCO,Non avere il...di un quattrino
BECCO,Estremità sporgente da cui esce un fluido
BECKENBAUER,Il Franz Kaiser del calcio tedesco
BECKHAM,"David, inglese dei cross e delle punizioni"
BECQUEREL,L'unità di radioattività
BEDUINI,Nomadi del deserto arabo
BEETHOVEN,Musicista della Nona e del destino alla porta
BEETHOVEN,Sordo e titanico compositore
BEETLE,Il nome inglese del Maggiolino
BEFANA,Arriva di notte con calze e carbone
BEFANA,Arriva nella notte dell'Epifania
BEFANA,La vecchietta che porta i doni all'Epifania
BEFANA,La vecchina che porta la calza
BEFANE,Arrivano con la scopa e i dolci
BEFFA,Inganno con sorriso amaro
BEFFA,"Oltre al danno, la..."
BEFFA,Scherzo che lascia l'altro con l'amaro in bocca
BEFFARDO,Ride dove altri soffrono
BEGONIA,Pianta da vaso con foglie carnose
BEGONIA,Pianta ornamentale dai fiori carnosi
BEHEMOTH,Mostro biblico di immensa forza
BEI,Titolo di governatori e dignitari ottomani
BEIRUT,La capitale del Libano
BEIRUT,Porto libanese affacciato sul Mediterraneo
BELARE,Fare il verso della pecora
BELATO,Il verso della pecora
BELFAST,Capoluogo dell'Irlanda del Nord
BELGIO,Paese di Bruxelles e Bruges
BELGRADO,Capitale serba alla confluenza di Sava e Danubio
BELINELLI,Il cestista italiano campione NBA
BELIZE,Stato centroamericano sulla barriera corallina
BELL,Brevettò il telefono
BELL,"La campana, in inglese"
BELLA,La partita decisiva dello spareggio
BELLA,La...addormentata nel bosco
BELLA,Gradevole alla vista
BELLA,"Una donna avvenente, sostantivato"
BELLAGIO,Borgo elegante dove si divide il Lario
BELLE,Le...arti come pittura e scultura
BELLE,Piacevoli alla vista
BELLEROFONTE,Domò Pegaso e affrontò la Chimera
BELLETTO,Trucco da volto e da apparenza
BELLEZZA,Armonia capace di colpire lo sguardo
BELLI,Il poeta romanesco Giuseppe Gioachino...
BELLI,Gradevoli alla vista
BELLINI,Il Vincenzo della Norma
BELLINI,Il cocktail veneziano con prosecco e pesca
BELLINI,Musicista della Norma
BELLISSIMO,Capace di suscitare grande ammirazione
BELLISSIMO,Fa esclamare meraviglia
BELLO,Categoria estetica e complimento facile
BELLO,Sul più...: nel momento culminante
BELLO,Gradevole alla vista o ben riuscito
BELLUCCI,La Monica attrice umbra
BELMOPAN,La capitale del Belize
BELVA,Animale feroce e persona crudele
BELVA,"Animale feroce, anche in senso figurato"
BELVA,La persona crudele e furiosa
BELVE,Ruggiscono in modo feroce
BELVEDERE,Luogo fatto per guardare bene
BELVEDERE,Punto alto da cui si gode il panorama
BELZEBU,Principe dei demoni
BEMOLLE,Abbassa una nota senza far rumore
BEN,Avverbio positivo in forma tronca
BEN,Big...: la grande campana dell'orologio di Londra
BEN,Il nome dell'attore Affleck
BEN,"In grande quantità, davanti a un numero"
BENDA,La fascia che copre gli occhi o la ferita
BENDA,Nasconde una ferita o un occhio
BENDA,Fascia che copre una ferita o gli occhi
BENDAGGIO,Fascia una ferita dopo la medicazione
BENDAGGIO,Fasciatura di una ferita
BENDARE,Fasciare una ferita o coprire gli occhi
BENDATO,Con gli occhi coperti o una ferita fasciata
BENDO,Avvolgo con garze
BENE,Lo si oppone al male e lo si vuole
BENE,Star...: godere di buona salute
BENE,Nel modo giusto o con sufficiente forza
BENEDETTO,Il fondatore del monachesimo occidentale
BENEDETTO,Dichiarato santo o colmato di favore
BENEDETTO,Consacrato o oggetto di augurio
BENEDIZIONE,Augurio o gesto che invoca protezione
BENEDIZIONE,Viene impartita con un segno della croce
