soluzione,definizione
BA,Iniziali del cantante Adams
BA,Iniziali dell'astronauta Aldrin
BA,Iniziali dell'attore Affleck
BA,Sigla automobilistica di Bari
BAAL,Antica divinità cananea
BABA,"Alì..., dei quaranta ladroni"
BABA,Dolce napoletano imbevuto di rum
BABBANO,Il non mago nel mondo di Harry Potter
BABBUINO,Scimmia dal muso canino
BABBUINO,Scimmia dal muso lungo e severo
BABELE,La gran confusione di voci e di lingue
BABELE,La torre biblica della confusione delle lingue
BABILONESI,Popolo dell'antica Mesopotamia
BABILONIA,Antica città mesopotamica dei giardini pensili
BABILONIA,Una gran...: confusione e caos
BACCA,Piccolo frutto da bosco o botanico
BACCALA,Il merluzzo conservato sotto sale
BACCALA,Restare come un...: impalato e imbambolato
BACCANALE,Festa sfrenata con memoria dionisiaca
BACCANO,Rumore più disordinato che forte
BACCANTI,Le seguaci di Bacco
BACCARAT,Gioco di carte dei casinò
BACCHETTA,La tiene il direttore d’orchestra
BACCO,Il dio romano del vino
BACERA,Toccherà con le labbra
BACH,"Compose fughe, cantate e passioni"
BACH,Contrappunto in quattro lettere
BACH,Il maestro tedesco delle fughe e dei corali
BACHECA,Espone avvisi dietro un vetro
BACHECA,Vetrina per avvisi e trofei
BACIA,Tocca con le labbra
BACIARE,Toccare con le labbra
BACIATO,Toccato con le labbra
BACILE,Catino largo per acqua e panni
BACILE,Recipiente largo e basso
BACILLO,Batterio a forma di bastoncino
BACINETTO,Elmo medievale appuntito
BACINO,La conca che raccoglie le acque
BACINO,La parte del corpo tra ventre e gambe
BACINO,Parte del corpo o conca d'acqua
BACIO,Gesto d'affetto con le labbra
BACIO,Il cioccolatino di Perugia col bigliettino
BACIO,Quello di Giuda è traditore
BACIO,Tocco con le labbra
BACKGAMMON,Gioco da tavolo con dadi e pedine
BACKSTAGE,Il dietro le quinte di uno spettacolo
BACKUP,Copia di sicurezza dei dati
BACO,Il verme della seta
BACO,L'errore nascosto nel programma del computer
BACO,Larva da seta
BACON,Artista inglese dei volti deformati
BACON,La pancetta affumicata della colazione inglese
BACON,Pittore inglese dei volti deformati
BACONE,Il filosofo inglese del metodo induttivo
BAD,"Cattivo, in inglese"
BAD,Il Bunny portoricano del reggaeton
BADA,Fa attenzione
BADA,Tenere a...: tenere a distanza
BADAI,Passato remoto: Fare attenzione
BADARE,Fare attenzione
BADATO,Fatto attenzione
BADIA,L'abbazia retta dall'abate
BADILE,Attrezzo per scavare
BADILE,Pala da cantiere o da orto
BADILI,Servono a scavare nella terra
BADO,Faccio attenzione
BADOGLIO,Il Pietro maresciallo d'Italia
BAFFI,Leccarsi i...per un manicaretto
BAFFI,Peli sopra il labbro
BAFFO,Pelo sopra il labbro
BAGAGLIAIO,Vano dell’auto dove spariscono le valigie
BAGAGLIO,Peso che il viaggiatore dichiara o nasconde
BAGAGLIO,Valigia o insieme di valigie
BAGATELLA,"Cosa da poco, ma con nome elegante"
BAGEL,Il panino americano a ciambella
BAGGIO,Il Roberto Divin Codino
BAGHDAD,Capitale irachena sul Tigri
BAGLIONI,Il Claudio di Questo piccolo grande amore
BAGLIORE,Luce improvvisa nel buio
BAGLIORI,Lampi improvvisi nel buio
BAGNA,"La...cauda, intingolo piemontese"
BAGNA,Rende umido
BAGNACAUDA,La salsa calda piemontese di aglio e acciughe
BAGNAI,Resi umido
BAGNAIA,Il pilota azzurro iridato della MotoGP
BAGNARE,Rendere umido
BAGNATO,Reso umido
BAGNINO,Sorveglia chi nuota al lido
BAGNO,Il...Maria della cottura delicata
BAGNO,"Stanza, immersione o folla compatta"
BAGOLARO,Albero ornamentale dei viali
BAGUETTE,Il filoncino di pane francese
BAHAMAS,Arcipelago caraibico di Nassau
BAHRAIN,Arcipelago del Golfo Persico
BAHREIN,Regno insulare del Golfo Persico
BAHT,La valuta della Thailandia
BAIA,"La...dei Porci, a Cuba"
BAIA,Riparo marino che invita all'ancora
BAIKAL,Il più profondo lago del mondo
BAILAMME,Il gran chiasso confuso
BAIO,Cavallo di mantello rossiccio
BAKU,Capitale azera sul Caspio
BALALAIKA,Strumento russo a cassa triangolare
BALATON,Il maggiore lago dell'Ungheria
BALAUSTRA,Il parapetto a colonnine
BALAUSTRATA,Fila di colonnine da balcone o scala
BALAUSTRO,Colonnina che fa ringhiera
BALBETTO,Parlo con la lingua impacciata
BALBO,L'Italo trasvolatore e gerarca
BALCANI,Penisola del sud-est europeo
BALCONATA,Fila di posti rialzati in teatro o allo stadio
BALCONE,Il terrazzino sporgente dalla facciata
BALCONE,Sporge dalla facciata di casa
BALCONE,Sporge dalla facciata per prendere aria
BALCONE,Sporgenza con ringhiera
BALCONI,Sporgono dalle facciate
BALDACCHINO,Drappo sospeso sopra il trono
BALDANZA,Sicurezza un po' spavalda
BALDASSARRE,Il re del banchetto della scritta sul muro
BALEARI,Isole spagnole di Maiorca e Ibiza
BALENA,Il più grande animale dei mari
BALENA,Il più grande mammifero del mare
BALENCIAGA,La maison di origine spagnola
BALENE,Giganti del mare che soffiano
BALENOTTERA,Gigante marino che filtra il plancton
BALESTRA,Arma che scaglia dardi con uno scatto
BALESTRUCCIO,Uccello migratore parente della rondine
BALI,Isola indonesiana di templi e risaie
BALIA,In...di: alla mercé di qualcosa
BALIA,Nutrice e tutela temporanea
BALISTA,Antica macchina lanciatrice di dardi
BALLA,Il Giacomo pittore futurista
BALLA,"La frottola, la grossa bugia"
BALLAI,Mi mossi a ritmo
BALLARE,Muoversi a ritmo
BALLATA,Racconto in versi con ritmo da canto
BALLATO,Danzato
BALLATOIO,Il corridoio esterno che dà sulle stanze
BALLERINA,La scarpa bassa da donna
BALLERINA,Sta sulle punte per mestiere
BALLO,Lo si apre con le danze
BALLO,Tirare in...: chiamare in causa
BALOTELLI,"Mario, attaccante Super Mario"
BALSAMO,Lenisce la pelle o profuma i capelli
BALSAMO,Sostanza lenitiva
BALTICO,Mare freddo del Nord Europa
BALTICO,Mare quasi chiuso dell'Europa settentrionale
BALTIMORA,La città americana del Maryland
BALUARDO,Difesa estrema di mura o idee
BALUARDO,"Difesa solida, anche figurata"
BALZA,Salto o fascia d'abito
BALZAC,Autore della Commedia umana
BALZAC,Scrittore della Commedia umana
BALZO,Cogliere la palla al...
BAMAKO,Capitale del Mali
BAMAKO,Capitale maliana sul Niger
BAMBAGIA,"Cotone soffice, proverbiale per delicatezza"
BAMBI,Il cerbiatto protagonista del classico Disney
BAMBINO,Essere umano prima delle scuse adulte
BAMBINO,Gesù...: la natività
BAMBOLA,Giocattolo con sembianze umane
BAMBOLA,"La bella ragazza, in gergo affettuoso"
BAMBOLE,Compagne di gioco in miniatura
BAMBU,Canna orientale che cresce in fretta
BANALE,"Scontato, privo di originalità"
BANANA,Frutto curvo da buccia scivolosa
BANANA,Il tiro a...: la traiettoria curva del pallone
BANANA,La buccia su cui si scivola nelle gag
BANCA,"La...dati, l'archivio di informazioni"
BANCA,Saltare il...: vincere tutto al gioco
BANCA,Vi si depositano i risparmi
BANCALE,Pedana per trasportare merci
BANCAROTTA,Crollo economico di chi non paga più
BANCAROTTA,Il fallimento rovinoso di un'impresa
BANCHETTO,Tavolo da mercato o piccolo convito
BANCHINA,Marciapiede di stazione o molo
BANCHINA,Margine del porto o della strada
BANCHINA,Si aspetta lì il treno o il battello
BANCHINE,Dove si attende il treno o si ormeggia
BANCO,Chi tiene la cassa al gioco
BANCO,Tavolo da scuola o da vendita
BANCOMAT,Lo sportello automatico per prelevare contanti
BANDA,Fascia diagonale dello stemma
BANDA,Il complesso di strumenti a fiato
BANDA,La gang di malviventi
BANDANA,Fazzoletto colorato legato sul capo
BANDERUOLA,Gira sul tetto indicando il vento
BANDIERA,"Bianca, chiede la resa"
BANDIERA,Identità che sventola
BANDIERA,Il giocatore...simbolo della squadra
BANDIERA,Si alza sul pennone
BANDIERE,Sventolano sui pennoni
BANDITO,Fuori legge o annunciato pubblicamente
BANDITO,"Il fuorilegge, il rapinatore"
BANDITO,"Messo al bando, esiliato"
BANDOLO,Il capo per districare la matassa
BANDONE,Lamiera che chiude botteghe e garage
BANDONEON,Strumento a mantice del tango
BANDUNG,Città dell'isola di Giava
BANGKOK,Capitale thailandese dei templi dorati
BANGUI,La capitale del Centrafrica
BANJO,Strumento a corde della musica country
BANJUL,La capitale del Gambia
BANKSY,Il misterioso street artist britannico
BANNER,"Bruce..., l'alter ego di Hulk"
BANNER,Lo striscione pubblicitario sul web
BANSHEE,Spirito femminile irlandese che annuncia la morte
BANTU,Gruppo di lingue dell'Africa subsahariana
BAOBAB,L'albero africano dal tronco enorme
BAR,"Ha banco, ma non sempre carte"
BAR,L'unità di misura della pressione
BARA,Cassa per l'ultimo viaggio
BARA,"Imbroglia al gioco, terza persona"
BARA,Ultimo contenitore di chi non viaggia più
BARABBA,Il prigioniero liberato al posto di Gesù
BARACCA,Il Francesco asso dell'aviazione
BARACCA,Mandare avanti la...: la famiglia o l'impresa
BARACCA,Riparo povero di assi e lamiere
BARAONDA,Confusione rumorosa da folla in movimento
BARATRO,L'abisso profondo e oscuro
BARATRO,La rovina: sull'orlo del...
BARATRO,"Precipizio, anche morale"
BARATRO,Vuoto che invita alla prudenza
BARATTO,Lo scambio di merci senza denaro
BARATTOLI,Custodiscono marmellate e conserve
BARATTOLO,Contenitore cilindrico con coperchio
BARATTOLO,Recipiente per conserve
BARBA,Che...!: che noia mortale
BARBA,Cresce sul mento dell'uomo
BARBA,Farla significa radersi
BARBABLU,Il marito crudele della fiaba
BARBADOS,Isola delle Piccole Antille
BARBAGIANNI,Rapace notturno dal volto a cuore
BARBAGLIO,Il bagliore che abbaglia
BARBARA,Il nome della conduttrice d'Urso
BARBARA,"Santa..., patrona degli artiglieri"
BARBAROSSA,Imperatore svevo sconfitto a Legnano
BARBE,Crescono sui menti
BARBIE,Il film di Greta Gerwig del 2023
BARBIE,La bambola bionda della Mattel
BARBIERE,Taglia barba e capelli
BARBIERI,Lavorano tra rasoi e forbici
BARBIGLIO,Filamento da pesce o da spiga
BARBO,Pesce di fiume con i barbigli
BARBONCINO,La razza canina dal pelo riccio
BARBONE,Ha riccioli da cane o strada da senzatetto
BARBONE,Il cane dal folto pelo riccio
BARBONE,"Il senzatetto, il clochard"
BARBRA,Il nome della cantante Streisand
BARCA,Natante di piccole dimensioni
BARCA,Una gran quantità: una... di soldi
BARCAAVELA,Imbarcazione spinta dal vento
BARCAROLA,Canto dal ritmo di gondola
BARCELLONA,Città catalana della Sagrada Familia
BARCELLONA,Il club blaugrana di Messi
BARCHE,Scivolano sull'acqua
BARCONE,Imbarcazione grande e spesso carica
BARDANA,Pianta con capolini che si attaccano ai vestiti
BARDEM,Il Javier di Non è un paese per vecchi
BARDO,Autore di versi celtico da nebbie antiche
BARDO,Il sommo poeta inglese: il...di Avon
BARDO,Poeta celtico da nebbie antiche
BARELLA,Letto leggero per trasportare feriti
BARELLA,"Nicolò, mediano dell'Inter e dell'Italia"
BARESI,"Franco, storico libero e capitano del Milan"
BARGNANI,Il cestista azzurro prima scelta NBA 2006
BARI,Città pugliese di San Nicola
BARI,I truffatori al tavolo da gioco
BARICENTRO,Punto di equilibrio di una figura
BARILE,L'unità di misura del petrolio
BARILE,Recipiente cilindrico
BARILE,Recipiente panciuto da cantina
BARILLA,Il pastificio di Parla come mangi
BARIO,Metallo del solfato per radiografie
BARIONE,Particella composta da tre quark
BARISTA,"Serve caffè, cappuccini e chiacchiere al banco"
BARITE,Minerale di bario
BARITONO,Voce maschile tra tenore e basso
BARLUME,Il debole chiarore
BARLUME,Poca luce e poca speranza
BARLUME,"Un... di speranza, una flebile traccia"
BARMAN,Chi prepara i cocktail al banco
BARNABA,Compagno di viaggio di san Paolo
BARNEY,Il nome del dinosauro viola per bambini
BARNEY,L'amico di Fred Flintstone
BAROCCA,Può esserlo una cosa ricca e stravagante
BAROCCHE,Possono esserlo cose ricche e stravaganti
BAROCCHI,Possono esserlo oggetti ricchi e stravaganti
BAROCCO,Può esserlo un oggetto ricco e stravagante
BAROLO,Il pregiato vino rosso delle Langhe
BAROMETRO,Legge la pressione e annuncia cambi di tempo
BARONE,"Il...Rosso, il celebre aviatore"
BARONE,Titolo nobiliare sotto il visconte
BARRA,Chiude con una linea
BARRA,Quella del timone con cui si governa la nave
BARRACUDA,Il predatore marino allungato dai denti aguzzi
BARRAI,Chiusi con una linea
BARRARE,Chiudere con una linea
BARRATO,Chiuso con una linea
BARRIERA,Ostacolo che chiude il passaggio
BARRIERE,Bloccano il passaggio a caselli o binari
BARRITO,Il verso dell'elefante
BARRO,Chiudo con una linea
BARRY,Il nome del cantautore White
BART,Il nome del maggiore dei Simpson
BART,"La metropolitana di San Francisco, in sigla"
BARTALI,Il Gino campione del ciclismo
BARTIZZANA,Torretta sporgente d'angolo
BARTOLOMEO,Apostolo martirizzato scorticato
BARYSHNIKOV,Il ballerino russo passato all'Occidente
BARZAGHI,Un Andrea filosofo televisivo
BARZELLETTA,Storiella che cerca la risata
BASA,Fonda su un appoggio
BASAI,Fondai su un appoggio
BASALTO,Roccia vulcanica scura
BASARE,Fondare su un appoggio
BASATO,Fondato su un appoggio
BASCO,Copricapo piatto o abitante dei Pirenei
BASE,Il contrario chimico dell'acido
BASE,L'accampamento militare
BASE,Sostegno o punto di partenza
BASILICA,Chiesa grande e forma romana antica
BASILICA,Grande chiesa a navate solenni
BASILICATA,La regione di Matera
BASILICATA,Regione tra Matera e il Pollino
BASILICO,Erba del pesto genovese
BASILICO,Profuma il pesto nel mortaio
BASILISCO,Mostro il cui sguardo uccide
BASO,Fondo su un appoggio
BASQUIAT,L'artista newyorkese dei graffiti anni Ottanta
BASSA,La...marea che scopre la spiaggia
BASSA,Può esserlo una linea poco elevata
BASSANI,Autore del Giardino dei Finzi-Contini
BASSE,Possono esserlo linee poco elevate
BASSI,Possono esserlo profili poco elevati
BASSO,"Ivan, scalatore azzurro due volte al Giro"
BASSO,La voce maschile più grave
BASSO,Lo strumento a quattro corde del gruppo rock
BASSO,Può esserlo un profilo poco elevato
BASSORILIEVO,Scultura che sporge appena dal fondo
BASSOTTI,Cani rasoterra dal passo buffo
BASSOTTO,Il cane dalle zampe corte e il corpo lungo
BASTA,La piega cucita per accorciare
BASTA,È sufficiente
BASTAI,Fui sufficiente
BASTARE,Essere sufficiente
BASTATO,Risultato sufficiente
BASTET,La dea egizia dalla testa di gatto
BASTIONE,Sporgenza difensiva delle mura
BASTO,La sella da soma del mulo
BASTO,Sono sufficiente
BASTONCELLO,Cellula della retina per il buio
BASTONCINO,Quello di pesce è impanato
BASTONE,Il seme delle carte napoletane
BASTONE,Quello del comando di chi guida
BASTONE,Sostegno da passeggio
BASTONE,Sostiene il passo e può finire tra le ruote
BASTONI,"Alessandro, difensore dell'Inter e dell'Italia"
BATACCHIO,Fa risuonare la campana dall'interno
BATAVI,Antico popolo germanico dei Paesi Bassi
BATISTUTA,"Gabriel, Batigol bomber della Fiorentina"
BATMAN,Il supereroe pipistrello di Gotham City
BATRACIO,Anfibio nominato da naturalisti
BATTE,"...la fiacca: poltrisce, fa il pigro"
BATTE,Colpe ripetutamente
BATTELLI,Navigano su fiumi e laghi
BATTELLO,Piccola nave da fiume o lago
BATTELLO,Piccola nave da trasporto
BATTELLO,Piccolo mezzo per navigare
BATTENTE,Il battiporta a martelletto
BATTERE,Colpire ripetutamente
BATTERIA,Dà energia o ritmo
BATTERIOLOGIA,Lo studio dei batteri
BATTERISTA,Tiene il ritmo tra piatti e tamburi
BATTIATO,Il cantautore siciliano della Cura
BATTICUORE,Accelera nel petto per paura o amore
BATTIPANNI,Bacchetta per spolverare tappeti
BATTIPANNI,Si usava per spolverare i tappeti
BATTISCOPA,Listello alla base del muro
BATTISTERO,Dove l'acqua entra nel rito
BATTISTI,L'autore di Emozioni con Mogol
BATTITO,Il colpo ritmico del cuore
BATTITO,Ritmo del cuore o d'ali
BATTO,Colpo ripetutamente
BAUDELAIRE,Autore di versi dei Fiori del male
BAUDELAIRE,Poeta dei Fiori del male
BAUDO,"Il presentatore di Sanremo per antonomasia, Pippo"
BAUHAUS,La scuola tedesca di design del Novecento
BAULE,Cassa da viaggio
BAULE,Grosso contenitore da viaggio
BAULE,Il vano bagagli dell'auto
BAULI,Custodiscono corredi e ricordi
BAVAGLINO,Protegge la pappa dei neonati
BAVAGLIO,Imporre il...: censurare
BAVAGLIO,Panno per il neonato a tavola
BAVAGLIO,Si mette ai bimbi mentre mangiano
BAVIERA,Regione tedesca di castelli e birra
BAZAR,Il mercato coperto orientale
BE,Iniziali del musicista Eno
BE,Iniziali della cantante Eilish
BE,"Sii, in inglese"
BE,Simbolo chimico del berillio
BEA,Diminutivo di Beatrice
BEA,Rende felice in forma letteraria
BEAGLE,Il cane da seguita dalle orecchie lunghe
BEAGLE,Snoopy è un cane di questa razza
BEARZOT,Il ct campione del mondo nel 1982
BEATLES,Il quartetto di Liverpool di Yesterday
BEATO,Chi è un gradino sotto il santo
BEATO,"Felice in terra, ufficiale in cielo"
BEATRICE,La donna guida di Dante
BEBOP,Stile veloce e virtuoso del jazz
BECCA,Afferra col rostro
BECCACCIA,Uccello da caccia dal lungo becco
BECCAFICO,Uccelletto e involtino siciliano
BECCARE,"Cogliere sul fatto, sorprendere"
BECCARE,Prendere col becco
BECCARIA,Il Cesare di Dei delitti e delle pene
BECCATO,Preso col becco
BECCHERA,Prenderà col becco
BECCHINO,Si occupa delle sepolture
BECCO,"Il marito tradito, il cornuto"
BECCO,La bocca degli uccelli
BECCO,Non avere il...di un quattrino
BECKENBAUER,Il Franz Kaiser del calcio tedesco
BECKHAM,"David, inglese dei cross e delle punizioni"
BECQUEREL,L'unità di radioattività
BEDUINI,Nomadi del deserto arabo
BEETHOVEN,Musicista della Nona e del destino alla porta
BEETHOVEN,Sordo e titanico compositore
BEETLE,Il nome inglese del Maggiolino
BEFANA,Arriva di notte con calze e carbone
BEFANA,Arriva nella notte dell'Epifania
BEFANA,La vecchietta che porta i doni all'Epifania
BEFANA,La vecchina che porta la calza
BEFANE,Arrivano con la scopa e i dolci
BEFFA,Inganno con sorriso amaro
BEFFA,"Oltre al danno, la..."
BEFFARDO,Ride dove altri soffrono
BEGONIA,Pianta da vaso con foglie carnose
BEGONIA,Pianta ornamentale dai fiori carnosi
BEHEMOTH,Mostro biblico di immensa forza
BEIRUT,La capitale del Libano
BEIRUT,Porto libanese affacciato sul Mediterraneo
BELARE,Fare il verso della pecora
BELATO,Il verso della pecora
BELFAST,Capoluogo dell'Irlanda del Nord
BELGIO,Paese di Bruxelles e Bruges
BELGRADO,Capitale serba alla confluenza di Sava e Danubio
BELINELLI,Il cestista italiano campione NBA
BELIZE,Stato centroamericano sulla barriera corallina
BELL,Brevettò il telefono
BELL,"La campana, in inglese"
BELLA,La partita decisiva dello spareggio
BELLA,La...addormentata nel bosco
BELLA,Può esserlo una cosa gradevole alla vista
BELLAGIO,Borgo elegante dove si divide il Lario
BELLE,Le...arti come pittura e scultura
BELLE,Possono esserlo cose gradevoli alla vista
BELLEROFONTE,Domò Pegaso e affrontò la Chimera
BELLETTO,Trucco da volto e da apparenza
BELLI,Il poeta romanesco Giuseppe Gioachino...
BELLI,Possono esserlo oggetti gradevoli alla vista
BELLINI,Il Vincenzo della Norma
BELLINI,Il cocktail veneziano con prosecco e pesca
BELLINI,Musicista della Norma
BELLO,Categoria estetica e complimento facile
BELLO,Sul più...: nel momento culminante
BELLUCCI,La Monica attrice umbra
BELMOPAN,La capitale del Belize
BELVA,Animale feroce e persona crudele
BELVA,"Animale feroce, anche in senso figurato"
BELVA,La persona crudele e furiosa
BELVE,Ruggiscono in modo feroce
BELVEDERE,Luogo fatto per guardare bene
BELVEDERE,Punto alto da cui si gode il panorama
BELZEBU,Principe dei demoni
BEMOLLE,Abbassa una nota senza far rumore
BEN,"Bene, in forma tronca"
BEN,Big...: la grande campana dell'orologio di Londra
BEN,Il nome dell'attore Affleck
BENDA,La fascia che copre gli occhi o la ferita
BENDA,Nasconde una ferita o un occhio
BENDAGGIO,Fascia una ferita dopo la medicazione
BENDAGGIO,Fasciatura di una ferita
BENDARE,Fasciare con bende
BENDATO,Fasciato con bende
BENDO,Avvolgo con garze
BENE,Lo si oppone al male e lo si vuole
BENE,Star...: godere di buona salute
BENEDETTO,Il fondatore del monachesimo occidentale
BENETTON,Il marchio veneto dei colori uniti
BENFICA,Il club portoghese di Lisbona delle aquile
BENGALA,Fuoco del...: il razzo luminoso di segnalazione
BENGALA,Il gatto domestico dal manto maculato
BENGALESI,Popolo del Bengala
BENIGNI,Il Roberto de La vita è bella
BENIN,Stato africano affacciato sul golfo di Guinea
BENJAMIN,Il curioso caso di...Button
BENJAMIN,Il nome dello statista e inventore Franklin
BENJI,Il portiere dei cartoni amico di Holly
BENZEMA,"Karim, bomber francese del Real Madrid"
BENZINA,Carburante dell'auto
BEOZIA,Antica regione greca di Tebe
BEQUADRO,Segno che annulla diesis e bemolle
BERBERI,Popolo autoctono del Nordafrica
BERE,Darla a...: far credere una frottola
BERE,Disseta senza forchetta
BERE,Portare liquidi alla bocca
BERGAMO,Città lombarda con la Città Alta
BERGAMOTTO,Agrume calabrese usato in profumeria
BERGEN,Porto della Norvegia
BERGMAN,"Ingrid..., l'attrice di Casablanca"
BERGMAN,Regista svedese del Settimo sigillo
BERGOGLIO,Il cognome di papa Francesco
BERGOMI,"Beppe lo Zio, bandiera dell'Inter"
BERILLO,Pietra che cambia pregio con il colore
BERING,Mare e stretto tra Asia e America
BERLINO,Capitale tedesca della Porta di Brandeburgo
BERLINO,Città della Porta di Brandeburgo
BERLINO,Il muro di...caduto nel 1989
BERLUSCONI,Il Silvio imprenditore e leader politico
BERMUDA,Arcipelago atlantico del celebre triangolo
BERMUDA,I pantaloni corti fino al ginocchio
BERNA,Capitale federale svizzera
BERNABEU,Lo stadio del Real Madrid
BERNARD,Il nome del ciclista francese Hinault
BERNARDO,L'abate di Chiaravalle
BERNIE,Il nome del senatore americano Sanders
BERNINI,Il Gian Lorenzo del colonnato di San Pietro
BERNOCCOLO,Avere il...: la predisposizione naturale per qualcosa
BERNOCCOLO,Il gonfiore da una botta in testa
BERRETTI,Si calano sulla testa nei giorni freddi
BERRETTINI,"Matteo, tennista azzurro finalista a Wimbledon"
BERRETTO,Copricapo che ripara dal freddo
BERRETTO,Copricapo morbido
BERRETTO,Tiene caldo il capo d'inverno
BERSAGLIO,Lo cerca la freccia al centro del tiro
BERSAGLIO,Punto da colpire
BERT,Il nome dello spazzacamino di Mary Poppins
BERTA,La filatrice proverbiale d’altri tempi
BERTA,Uccello marino che plana sulle onde
BERTA,Uccello marino dal nome proverbiale
BERTE,"La cantante rock, Loredana"
BERTOLUCCI,Regista dell'Ultimo imperatore
BERTRAND,Il nome del filosofo Russell
BERTUCCIA,Piccola scimmia nordafricana
BESCIAMELLA,Salsa bianca per lasagne e gratin
BESTIARIO,Catalogo medievale di animali reali e fantastici
BETA,La versione di prova di un programma
BETA,Seconda lettera greca e versione provvisoria
BETELGEUSE,Gigante rossa di Orione
BETLEMME,Città della Natività
BETTA,Pesce combattente da acquario
BETTINI,"Paolo, il Grillo campione olimpico azzurro"
BETULLA,Albero dalla corteccia chiara
BEYONCE,La cantante americana ex Destiny's Child
BEZOS,Il fondatore di Amazon
BH,Iniziali del comico Hope
BH,Iniziali del rocker Haley
BHUTAN,Regno himalayano della felicità nazionale lorda
BI,Prefisso che indica il doppio
BI,Sigla automobilistica di Biella
BIAGGI,Il pilota motociclista azzurro l'Imperatore
BIAGIO,"...Antonacci, il cantante"
BIAGIO,Il santo protettore della gola
BIALETTI,La marca italiana della moka con l'omino coi baffi
BIANCANEVE,La fanciulla dei sette nani
BIANCANEVE,La principessa dei sette nani
BIANCHETTO,Il novellame di pesce azzurro
BIANCO,Colore che sulla pagina aspetta parole
BIANCO,Il vino chiaro da pesce
BIANCO,Lo spazio non scritto: lasciare in...
BIANCOSPINO,Arbusto spinoso dai fiori bianchi
BIASCICO,Pronuncio le parole a fatica
BIATHLON,Disciplina di sci di fondo e tiro
BIBERON,Bottiglietta col ciuccio per neonati
BIBITA,Bevanda rinfrescante
BIBLIOMANIA,La passione smodata per i libri
BIBLIOTECA,Custodisce scaffali di libri in silenzio
BIBLIOTECA,Raccolta di libri da consultare
BIBLIOTECARIO,Custodisce e presta i libri
BIBLO,Antica città fenicia da cui deriva la Bibbia
BIC,Marca della penna usa e getta
BIC,"Marca di penne, accendini e rasoi usa e getta"
BICA,Il mucchio di covoni nel campo
BICCHIERE,Recipiente per bere
BICCHIERI,Si alzano per brindare
BICE,L’amata di Dante in forma familiare
BICI,Per andarci si pedala
BICICLETTA,Si pedala su due ruote
BIDET,Sanitario basso del bagno
BIDONE,Grosso recipiente cilindrico
BIDONE,Il contenitore dei rifiuti
BIDONE,"La fregatura, l'imbroglio"
BIEBER,La popstar canadese di Baby
BIECA,Può esserlo una cosa torva e minacciosa
BIECHE,Possono esserlo cose torve e minacciose
BIECHI,Possono esserlo oggetti torvi e minacciosi
BIECO,Può esserlo un oggetto torvo e minaccioso
BIENNALE,La grande mostra d'arte di Venezia
BIFOLCO,Il contadino che ara con i buoi
BIFORA,Finestra medievale divisa in due
BIGA,Carro antico a due cavalli
BIGIO,Di un grigio scuro tendente al cenere
BIGLIA,La sfera di vetro con cui giocano i bambini
BIGLIA,Pallina di vetro da gioco
BIGLIE,Rotolano nei giochi dei bambini
BIGNE,Pasticcino ripieno di crema
BIGODINO,Cilindretto per arricciare i capelli
BIGODINO,Tiene in piega una ciocca
BILANCIA,Misura il peso o segno zodiacale
BILANCIA,"Pesa mele, valigie e coscienze"
BILANCIA,Strumento per pesare o segno zodiacale
BILBO,Lo hobbit protagonista del romanzo Lo Hobbit
BILE,Amarezza organica e figurata
BILE,"La collera, la stizza repressa"
BILES,La ginnasta americana dai tanti ori
BILIA,Pallina da tavolo verde e umore antico
BILIARDO,Gioco con stecca e bilie
BILICO,Equilibrio che non rassicura
BILIOSO,Irritabile come chi ha troppa bile
BILL,"Il conto al ristorante, in inglese"
BILL,Il nome del fondatore di Microsoft Gates
BILLIE,Il nome della giovane cantante Eilish
BIMBO,Bambino detto con tenerezza
BINARIO,"A due soli valori, come il codice dei computer"
BINARIO,Guida di ferro per treni
BINARIO,I due ferri su cui corre il treno
BINARIO,Lo segue il treno
BINDA,Il martinetto per sollevare pesi
BINDA,Storico campione del ciclismo italiano
BINGO,La tombola da sala
BINOCOLI,Avvicinano ciò che è lontano
BINOCOLO,Avvicina ciò che è lontano
BINOCOLO,Fa vedere lontano con due occhi
BIO,"La biografia, abbreviata"
