soluzione,definizione
DONAZIONE,Vale anche «contributo»
DONCHISCIOTTE,Combatte mulini scambiandoli per giganti
DONCIC,Il cestista sloveno fenomeno dei Mavericks
DONIZETTI,Il Gaetano della Lucia di Lammermoor
DONKEYKONG,Il gorilla dei videogiochi Nintendo
DONNA,Figura femminile: nei romanzi spesso protagonista
DONNA,La regina nel mazzo di carte
DONNA,Tra i suoi significati: «signora»
DONNARUMMA,"Gigio, portiere eroe di Euro 2020"
DONNIE,Il nome del Darko del film
DONNOLA,Piccolo agile carnivoro dei campi
DONO,Do senza prezzo
DONO,Il...di natura: il talento innato
DONO,Vale anche «presente»
DONUT,La ciambella americana glassata
DOP,Il marchio di qualità di molti formaggi
DOP,Marchio alimentare protetto
DOPAMINA,Neurotrasmettitore legato alla ricompensa
DOPO,Avverbio che prende tempo
DOPO,Vale anche «successivamente»
DOPO,"In una sua accezione, «posteriormente»"
DOPOBARBA,Profumo da mettere dopo la rasatura
DOPPIO,"Due volte tanto, o la partita di tennis in coppia"
DOPPIOFONDO,Nascondiglio sotto un piano finto
DOPPIOGIOCO,Tradimento fatto da finto alleato
DORA,L'esploratrice dei cartoni
DORA,Nome di fiumi piemontesi alpini
DORADO,Costellazione australe del Pesce dorato
DORADO,El...: il leggendario regno dell'oro
DORAEMON,Il gatto robot blu del manga giapponese
DORAI,Passato remoto: Rendere color oro
DORATO,Participio: Rendere color oro
DORATORE,Riveste oggetti con foglia d'oro
DORIAN,Il nome del Gray di Wilde
DORME,Prende sonno
DORMIRE,Prendere sonno
DORMIRE,Può significare «riposare»
DORMIRE,Può significare «riposarsi»
DORMITO,Preso sonno
DORMITORIO,Il locale comune per dormire
DORMITORIO,Vale anche «camerata»
DORMIVEGLIA,Confine morbido tra sonno e attenzione
DORMO,Prendo sonno
DOROTHY,Il nome della protagonista del Mago di Oz
DORSALE,Catena montuosa o linea della schiena
DORSALE,Un possibile significato è «catena»
DORSO,La schiena o il retro di un libro
DORSO,Lo stile di nuoto a pancia in su
DORSO,Schiena o parte del libro
DORSO,Vale anche «schiena»
DORY,Il nome della pesciolina smemorata di Nemo
DOS,"Due, in spagnolo"
DOS,Vecchio sistema prima delle finestre
DOSA,Misura le quantità
DOSAGGIO,"In una sua accezione, «dose»"
DOSAI,Passato remoto: Misurare la quantità
DOSARE,Misurare le quantità
DOSATO,Misurato le quantità
DOSATORE,Misura le quantità da versare
DOSE,La misura che può curare o nuocere
DOSE,Rincarare la...: esagerare ancora
DOSE,Vale anche «quantità»
DOSO,Misuro le quantità
DOSSIER,Fascicolo che promette rivelazioni
DOSSIER,Tra i suoi significati: «pratica»
DOSSIER,Tra i suoi significati: «fascicolo»
DOSSO,Rialzo della strada o del terreno
DOSSO,Può significare «poggio»
DOSTOEVSKIJ,Il Fedor dei Fratelli Karamazov
DOSTOEVSKIJ,"Scrittore di colpe, castighi e fratelli inquieti"
DOTATO,Un possibile significato è «fornito»
DOTATO,Può significare «provveduto»
DOTAZIONE,Tra i suoi significati: «materiale»
DOTAZIONE,Un possibile significato è «attrezzo»
DOTE,La qualità naturale di una persona
DOTE,Qualità innata o corredo nuziale
DOTE,Può significare «talento»
DOTTO,Vale anche «canale»
DOTTO,Tra i suoi significati: «studente»
DOTTORE,Un possibile significato è «medico»
DOTTORE,Può significare «sanitario»
DOTTORESSA,"In una sua accezione, «medico»"
DOTTORESSA,Un possibile significato è «sanitario»
DOTTRINA,Tra i suoi significati: «sapere»
DOTTRINA,Tra i suoi significati: «cultura»
DOUGLAS,Il nome del generale americano MacArthur
DOURO,Fiume iberico del porto
DOVERE,Il... e l'avere nei conti
DOVERE,Vale anche «servizio»
DOVERE,Può significare «responsabilità»
DOVIZIOSO,Il pilota azzurro della MotoGP
DOVUNQUE,"In una sua accezione, «ovunque»"
DOVUNQUE,Tra i suoi significati: «dappertutto»
DOZZINA,Un possibile significato è «dodici»
DRACMA,Moneta greca prima dell'euro
DRACULA,Il conte vampiro della Transilvania
DRAGHI,I mostri sputafuoco
DRAGHI,Il Mario economista ed ex premier
DRAGHI,Sputano fuoco nelle fiabe
DRAGO,"Il...di Komodo, il grande varano"
DRAGO,Mostro favoloso che sputa fuoco
DRAGO,Mostro sputafuoco di fiabe e stemmi
DRAGONCELLO,Erba aromatica dal gusto fine e pungente
DRAGONCELLO,Erba aromatica dal sapore deciso
DRAGONE,Il grande drago delle leggende orientali
DRAGONE,Il soldato di cavalleria d'altri tempi
DRAGONE,Mostro araldico da fuoco
DRAKE,Corsaro inglese circumnavigatore
DRAKE,Il rapper canadese di Hotline Bling
DRAKKAR,La nave dei vichinghi
DRAMMA,"La disgrazia, oltre all'opera teatrale seria"
DRAMMA,Un possibile significato è «tragedia»
DRAMMA,Un possibile significato è «disastro»
DRAMMATICO,"In una sua accezione, «spettacolare»"
DRAPPO,Il telo di stoffa pregiata e drappeggiata
DRAPPO,Panno ampio da bandiere e cerimonie
DRAPPO,Panno ricco e scenografico
DRAVIDA,Popoli dell'India meridionale
DRENAI,Passato remoto: Far defluire liquidi
DRENATO,Participio: Far defluire liquidi
DRESDA,Città sassone ricostruita dopo i bombardamenti
DRESSAGE,Disciplina equestre dell'eleganza
DREW,Il nome dell'attrice Barrymore
DRIADI,Le ninfe dei boschi
DRIBBLING,Finta per superare l'avversario
DRITTA,Può esserlo una linea non curva
DRITTA,Una...: un suggerimento utile
DRITTA,Tra i suoi significati: «destra»
DRITTE,Possono esserlo linee non curve
DRITTI,Possono esserlo profili non curvi
DRITTO,Il colpo di diritto a tennis
DRITTO,"Il furbacchione, lo scaltro"
DRITTO,Può esserlo un profilo non curvo
DRITTO,Un possibile significato è «diritto»
DROGA,Tra i suoi significati: «aroma»
DROGATO,Può significare «tossico»
DROGATO,Può significare «tossicodipendente»
DROGBA,"Didier, ariete ivoriano del Chelsea"
DROGHIERE,Vende generi alimentari e coloniali
DROLERIA,Bizzarria che fa sorridere
DROMEDARI,Portano una sola gobba
DROMEDARIO,Camelide con una sola gobba
DROMEDARIO,Ha una gobba e molta pazienza desertica
DROMEDARIO,Ha una sola gobba per il deserto
DROMONE,Nave da guerra bizantina
DRONE,Velivolo senza pilota a bordo
DRUMANDBASS,Genere elettronico dai ritmi spezzati
DRUSI,Comunità religiosa del Levante
DS,"Il direttore sportivo, in sigla"
DS,Iniziali dell'attore Sutherland
DUALIPA,La popstar britannica di Levitating
DUB,Genere giamaicano strumentale ed echeggiante
DUB,"Il doppiaggio, in gergo"
DUBAI,Emirato dei grattacieli
DUBBIO,Può significare «forse»
DUBBIO,Vale anche «incertezza»
DUBBIOSA,Può esserlo una donna incerta nel giudizio
DUBBIOSE,Possono esserlo donne incerte nel giudizio
DUBBIOSI,Possono esserlo uomini incerti nel giudizio
DUBBIOSO,Può esserlo un uomo incerto nel giudizio
DUBBIOSO,Può significare «incerto»
DUBBIOSO,Tra i suoi significati: «insicuro»
DUBITA,Non è sicuro
DUBITAI,Passato remoto: Non essere certo
DUBITARE,Non essere sicuro
DUBITATO,Incerto
DUBITO,Non sono sicuro
DUBLINO,Capitale irlandese sul Liffey
DUBLINO,Città di Joyce e dei pub irlandesi
DUCA,Nobile che sta sotto il principe
DUCA,"Nobile sotto il principe, sopra il marchese"
DUCATI,Antiche monete d'oro
DUCATI,La casa motociclistica di Borgo Panigale
DUCATO,Il furgone Fiat per il trasporto
DUCATO,Il territorio governato dal duca
DUCATO,L'antica moneta d'oro veneziana
DUCCIO,Artista senese della Maestà
DUCCIO,Pittore senese della Maestà
DUCHAMP,L'artista dell'orinatoio come opera d'arte
DUE,"Basta per fare coppia, non folla"
DUE,Il numero che segue l'uno
DUELLO,Scontro a due per onore o rivalità
DUERO,Fiume iberico
DUETTO,Il brano cantato a due voci
DUKE,"Il duca, in inglese"
DUKE,Il nome del jazzista Ellington
DULBECCO,Il Renato Nobel per la medicina
DUMAS,L'Alexandre dei Tre moschettieri
DUMBLEDORE,Il preside di Hogwarts in Harry Potter
DUMBO,L'elefantino Disney dalle grandi orecchie
DUNA,Collina mobile fatta di sabbia
DUNA,La collina di sabbia del deserto
DUNCAN,Il nome del re ucciso da Macbeth
DUO,Coppia che suona
DUO,Due artisti che si esibiscono insieme
DUO,Tra i suoi significati: «coppia»
DUODENO,Primo tratto dell'intestino tenue
DUOMO,Chiesa maggiore che dà nome alla piazza
DUOMO,Chiesa principale di una città
DUOMO,La cattedrale di Milano dalle guglie
DUOMO,"In una sua accezione, «cattedrale»"
DURA,"Lei persiste, si protrae nel tempo"
DURA,Resiste nel tempo
DURAI,Resistei nel tempo
DURARE,Resistere nel tempo
DURARE,Un possibile significato è «reggere»
DURATA,"In una sua accezione, «lunghezza»"
DURATO,Resistito nel tempo
DURATURO,"In una sua accezione, «permanente»"
DURATURO,Tra i suoi significati: «infinito»
DURBAN,Porto del Sudafrica
DURE,Resistenti alla pressione
DURENDA,Variante del nome della spada del paladino Orlando
DURER,Maestro tedesco dell'incisione
DUREVOLE,Può significare «permanente»
DUREVOLE,Un possibile significato è «infinito»
DUREZZA,Un possibile significato è «rigore»
DUREZZA,Può significare «gravità»
DURI,I... a morire: i tenaci che non si arrendono
DURI,Resistenti alla pressione
DURIAN,Il frutto tropicale dall'odore fortissimo
DURLINDANA,La celebre spada del paladino Orlando
DURO,"Resiste, o manca di tenerezza"
DURO,Tener...: resistere senza cedere
DURO,Un osso...: un'impresa difficile
DURO,Può significare «difficile»
DUSE,L'Eleonora grande attrice del teatro italiano
DUSHANBE,Capitale tagika
DUSTIN,Il nome dell'attore Hoffman
DUTTILE,Può esserlo un materiale facile da plasmare
DUTTILE,"In una sua accezione, «flessibile»"
DUTTILI,Possono esserlo materiali facile da plasmare
DUVALL,Il Robert del Padrino
DVORAK,L'autore ceco della Sinfonia dal Nuovo Mondo
DWAYNE,Il nome dell'attore The Rock Johnson
DWIGHT,Il nome del presidente americano Eisenhower
DY,Simbolo chimico del disprosio
DYBALA,"Paulo, la Joya argentina di Juve e Roma"
DYBBUK,Spirito maligno del folklore ebraico
DYLAN,"Bob..., il Nobel della canzone"
DYLAN,Il nome dell'investigatore dell'incubo Dog dei fumetti
DYLANDOG,L'indagatore dell'incubo dei fumetti italiani
DYSON,La marca britannica di aspirapolvere senza sacco
