soluzione,definizione
RA,Dio egizio del sole
RA,Iniziali dello showman Arbore
RA,Simbolo chimico del radio
RABARBARO,Pianta dai gambi usati per dolci e liquori
RABAT,Capitale marocchina sull'Atlantico
RABAT,La capitale del Marocco
RABBERCIO,Rimetto insieme alla meglio
RABBIA,Collera e malattia trasmessa da morsi
RABBIA,Fa vedere rosso
RABBIA,Può esplodere per un nonnulla
RABBONISCO,Faccio tornare la calma
RABBRIVIDISCO,Tremo per il freddo o la paura
RABBUFFO,L'aspro rimprovero
RABDOMANTE,Cerca acqua con la bacchetta
RABELAIS,Autore di Gargantua e Pantagruel
RABELAIS,Scrittore di Gargantua e Pantagruel
RACCAPEZZO,Il venire a capo a fatica
RACCAPRICCIO,Il brivido d'orrore
RACCHETTA,Attrezzo da campo con corde tese
RACCHETTA,Colpisce palline su campi divisi da una rete
RACCHETTA,Serve nel tennis
RACCHETTE,Colpiscono la palla oltre la rete
RACCOGLIERE,Mettere insieme ciò che è sparso
RACCOGLIERE,"Portare a sé frutti, dati o consensi"
RACCOGLITORE,Cartella ad anelli per documenti
RACCOGLITORE,Tiene in ordine fogli forati
RACCOLSE,Mise insieme
RACCOLTA,Insieme ordinato di oggetti o testi
RACCOLTA,"Può essere di fondi, firme o rifiuti"
RACCOLTO,Frutto del lavoro nei campi
RACCOLTO,Si miete o si vendemmia
RACCOMANDAZIONE,Consiglio espresso con particolare insistenza
RACCOMANDAZIONE,Può favorire qualcuno senza merito
RACCONTA,Mette fatti in parole
RACCONTAI,Misi fatti in parole
RACCONTARE,Dare forma verbale agli avvenimenti
RACCONTARE,Mettere fatti in parole
RACCONTARE,Tenere qualcuno col fiato sospeso
RACCONTATO,Messo in parole
RACCONTO,Metto in parole i fatti
RACCONTO,Può avere un finale a sorpresa
RACCONTO,Una storia breve in prosa
RACCORDO,Collegamento tra elementi separati
RACCORDO,Unisce tubi o tratti stradali
RACEMO,Infiorescenza a grappolo
RACIMOLO,Il piccolo grappolo
RACINE,Tragediografo francese del Seicento
RACLETTE,Formaggio svizzero da fondere e raschiare
RADA,Poco fitta
RADA,Poco fitta: una barba...
RADAMANTO,Giudice dei morti del mondo antico
RADAR,Scopre oggetti con onde radio
RADE,Lui si fa la barba
RADE,Poco fitte
RADI,Poco fitti
RADI,Tu ti fai la barba
RADIANTE,Unità angolare naturale della circonferenza
RADIATA,Espulsa ufficialmente da un albo o da un elenco
RADIATA,Sottoposta all'azione di raggi o radiazioni
RADIATE,Espulse ufficialmente da albi o elenchi
RADIATE,Sottoposte all'azione di raggi o radiazioni
RADIATI,Espulsi ufficialmente da albi o elenchi
RADIATI,Sottoposti all'azione di raggi o radiazioni
RADIATORE,Scalda il motore o la stanza
RADIAZIONE,Emissione di energia nello spazio
RADIAZIONE,L'esclusione formale da un albo
RADICALE,Gruppo chimico o segno di radice
RADICALMENTE,Dalle fondamenta
RADICALMENTE,Senza lasciare nulla a metà
RADICCHIO,Verdura amara spesso rossa
RADICE,"...quadrata, in matematica"
RADICE,Ancora la pianta al terreno
RADICE,L'origine profonda di un fenomeno
RADICE,Parte sotterranea della pianta
RADICI,Tengono salde le piante
RADIO,L'apparecchio che trasmette musica e notizie
RADIO,L'osso dell'avambraccio
RADIO,Parla e suona nell'etere
RADIO,Parla senza farsi vedere
RADIOGRAFIA,Mostra ciò che la pelle nasconde
RADIOHEAD,La band britannica di Creep
RADIOLINA,Piccolo apparecchio da ascolto portatile
RADIOLOGIA,La diagnostica per immagini
RADO,Poco fitto
RADUNARE,Chiamare più persone nello stesso luogo
RADUNARE,Riunire persone o cose disperse
RADUNI,Concentrazioni di persone unite da un interesse comune
RADUNI,Incontri organizzati con molti partecipanti
RADURA,Apertura luminosa nel bosco
RADURA,Spazio aperto fra gli alberi
RADURE,Spazi aperti all'interno dei boschi
RADURE,Zone senza alberi circondate dalla vegetazione
RAFAEL,Il nome del tennista spagnolo Nadal
RAFANO,Radice piccante
RAFFAELE,L'arcangelo guaritore
RAFFAELLO,Il Sanzio delle Stanze vaticane
RAFFAELLO,Pittore urbinate delle Madonne armoniose
RAFFAZZONO,Metto insieme alla buona
RAFFICA,"Arriva breve, intensa e ripetuta"
RAFFICA,Serie improvvisa di colpi o folate
RAFFIGURAZIONE,Immagine che riproduce un soggetto
RAFFINATEZZA,Eleganza curata senza ostentazione
RAFFINATEZZA,Si nota nei modi e nei dettagli
RAFFORZAMENTO,Aggiunta che rende più solida una struttura
RAFFORZARE,Consolidare una posizione o una struttura
RAFFORZARE,Rendere più resistente o convincente
RAFFREDDA,Rende freddo
RAFFREDDARE,Rendere freddo
RAFFREDDATO,Reso freddo
RAFFREDDO,Rendo freddo
RAFIA,Fibra vegetale per intrecci
RAFTING,La discesa di torrenti su gommone
RAGA,"Gli amici, nel gergo giovanile"
RAGANELLA,Piccola rana o strumento rumoroso
RAGANELLA,Piccola rana verde
RAGANELLA,Piccolo anfibio verde
RAGAZZA,Giovane donna
RAGAZZA,Può essere la fidanzata
RAGAZZE,Giovani donne non ancora adulte
RAGAZZE,Le componenti femminili di un gruppo giovanile
RAGAZZI,Giovani non ancora adulti
RAGAZZI,I componenti più giovani di una compagnia
RAGAZZINA,Giovane ancora vicina all'infanzia
RAGAZZINA,"Non è più bambina, ma quasi"
RAGAZZINO,Bambino ormai grandicello
RAGAZZINO,Maschio ancora vicino all'infanzia
RAGAZZINO,Un giovane ancora in età scolare
RAGAZZO,Giovane di sesso maschile
RAGAZZO,Giovane non ancora adulto
RAGAZZO,Può essere il fidanzato
RAGGI,Fasci sottili di luce
RAGGI,Segmenti che uniscono il centro di un cerchio alla circonferenza
RAGGIERA,Disposizione a raggi
RAGGIO,Il...d'azione entro cui ci si muove
RAGGIO,Linea di luce o segmento del cerchio
RAGGIO,Quello che parte dal mozzo della ruota
RAGGIO,Una colonna di luce
RAGGIRO,Fa cadere in trappola senza usare la forza
RAGGIRO,Inganno costruito con astuzia
RAGGIRO,Trappola costruita con parole o apparenze
RAGGIUNGERE,Arrivare alla meta o allo scopo
RAGGIUNGERE,Conseguire un obiettivo
RAGGIUNGIMENTO,Corona uno sforzo ben riuscito
RAGGIUNGIMENTO,L'arrivo a un obiettivo
RAGGIUNSE,Arrivò alla meta
RAGGRINZITO,Pieno di grinze
RAGGRUPPAMENTO,Insieme formato riunendo elementi simili
RAGGRUPPAMENTO,"Può riunire persone, oggetti o dati"
RAGGUAGLIO,L'informazione dettagliata
RAGIA,Resina che profuma di bosco
RAGIONA,Segue un filo logico
RAGIONAI,Seguii un filo logico
RAGIONAMENTO,Catena di idee che porta a una conclusione
RAGIONARE,Seguire un filo logico
RAGIONATO,Frutto di una scelta ponderata
RAGIONATO,Seguito un filo logico
RAGIONATO,Studiato con intenzione
RAGIONE,Il motivo per cui qualcosa accade
RAGIONE,La facoltà di pensare logicamente
RAGIONERIA,Tiene conti e registri amministrativi
RAGIONEVOLE,Conforme al buon senso
RAGIONEVOLMENTE,Con buon senso e senza eccessi
RAGIONEVOLMENTE,In misura accettabile
RAGIONI,Argomenti portati a sostegno di una tesi
RAGIONI,Motivi che spiegano una scelta
RAGIONIERE,Lavora fra registri e bilanci
RAGIONIERE,Professionista dei conti
RAGIONIERE,Tiene la contabilità
RAGIONO,Seguo un filo logico
RAGLI,Suoni forti e sgraziati emessi dagli equini dalle lunghe orecchie
RAGLI,Versi tipici degli asini
RAGLIO,Il verso dell'asino
RAGNAR,Il nome del vichingo Lothbrok della serie
RAGNAROK,Il crepuscolo degli dei nordici
RAGNATELA,La costruisce il ragno
RAGNATELA,Opera geometrica del ragno
RAGNATELA,Trappola sottile tesa negli angoli
RAGNATELE,Trappole sottili negli angoli
RAGNI,Tessono trappole per insetti
RAGNO,Animale a otto zampe
RAGNO,Non cavare un... dal buco: non concludere nulla
RAGNO,Tesse la tela
RAGOUT,Spezzatino di carne in umido
RAGTIME,Genere pianistico sincopato di inizio Novecento
RAGU,Sugo che richiede pazienza
RAGUSA,Città siciliana dal doppio volto barocco
RAI,"I raggi luminosi, in poesia"
RAI,Tre lettere davanti al canone
RAID,Attacco lampo condotto da aria o terra
RAID,Incursione improvvisa contro un obiettivo
RAIKKONEN,Il pilota finlandese Iceman di F1
RAKSHASA,Demone della mitologia indiana
RALLENTA,Diminuisce la velocità
RALLENTAI,Diminuii la velocità
RALLENTANDO,Indicazione musicale che riduce gradualmente il tempo
RALLENTARE,Diminuire la velocità
RALLENTARE,Togliere velocità
RALLENTATO,Reso meno veloce
RALLENTO,Diminuisco la velocità
RALPH,Il nome dello stilista Lauren
RAMA,Eroe e avatara del dio Vishnu
RAMA,Sposo di Sita nell’epica indiana
RAMAIOLO,Mestolo a coppa per il brodo
RAMARRO,Lucertolone verde
RAMARRO,Lucertolone verde dei muretti assolati
RAMATE,Dal colore simile al metallo rossastro
RAMATE,Trattate con prodotti a base di rame
RAMATI,Dal colore simile al metallo rossastro
RAMATI,Trattati con prodotti a base di rame
RAMAZZOTTI,"Il cantante di Terra promessa, Eros"
RAMBO,Il reduce del Vietnam interpretato da Stallone
RAME,Il metallo rossastro dei fili elettrici
RAME,Metallo rosso dei fili e dei paioli
RAMEN,Zuppa giapponese da sorbire
RAMI,Portano foglie e frutti
RAMINGO,Va senza casa né meta sicura
RAMINO,Gioco di carte delle combinazioni
RAMMARICO,Dispiacere per ciò che è accaduto
RAMMARICO,Lascia l'amaro per un'occasione perduta
RAMMENDO,Riparo uno strappo cucendo
RAMO,Braccio d'albero o di famiglia
RAMO,Il settore di attività di un'azienda
RAMO,Linea laterale di una famiglia
RAMONES,La band punk americana di Blitzkrieg Bop
RAMOS,"Sergio, difensore spagnolo campione del mondo 2010"
RAMPA,La...di scale tra due piani
RAMPA,Piano inclinato per salire
RAMPA,Quella di lancio del razzo
RAMPANTE,Detto del leone eretto sullo stemma
RAMPANTE,Il barone...di Calvino
RAMPANTI,Che si arrampicano su sostegni o pareti
RAMPANTI,Molto ambiziosi e desiderosi di successo
RAMPE,Piani inclinati che collegano livelli diversi
RAMPE,"Salite usate per accedere a garage, ponti o autostrade"
RAMPINO,Gancio per aggrapparsi o recuperare
RAMPINO,Il gancio a più punte
RAMPOLLO,Erede di una stirpe importante
RAMPOLLO,Giovane discendente di famiglia importante
RAMPOLLO,Giovane discendente di una famiglia
RANA,Anfibio che salta e gracida
RANA,Anfibio saltatore
RANA,Dalla bocca larga nelle barzellette
RANA,Lo stile di nuoto a gambe divaricate
RANCH,Fattoria da immaginario western
RANCH,La fattoria americana di bestiame
RANCHERA,Genere tradizionale messicano
RANCIDO,Grasso guastato dall'aria
RANCIO,Il pasto in comune dei soldati
RANCORE,Non si spegne con il passare del tempo
RANCORE,Ostilità che dura nel tempo
RANCOROSO,Che cova rancore
RAND,"Ayn..., autrice de La rivolta di Atlante"
RAND,La valuta del Sudafrica
RANDA,Grande vela principale di molte barche
RANDA,La vela maggiore di poppa
RANE,Saltano e gracidano negli stagni
RANGERS,Club calcistico di Glasgow
RANGHI,File ordinate di persone o soldati
RANGHI,Posizioni occupate in una gerarchia
RANGO,Grado sociale o militare
RANGO,"Il grado, la posizione sociale"
RANGO,Posizione in una gerarchia
RANMA,Il ragazzo che diventa ragazza dei manga
RANNUVOLO,Mi faccio scuro in volto
RANOCCHI,Abitanti verdi degli stagni nelle fiabe
RANOCCHI,Piccoli anfibi saltatori
RANOCCHIO,Principe possibile sotto pelle verde
RANTOLARE,Il respirare con suono roco
RANTOLO,Il respiro affannoso e roco
RANUNCOLO,Fiore giallo dei prati umidi
RAP,"Bussare con colpi secchi, in inglese"
RAP,Rime su base battente
RAPA,Ortaggio dalla radice carnosa
RAPA,Radice da minestra povera
RAPA,Radice dell'orto
RAPA,Si trova sottoterra e finisce in minestra
RAPACE,Avido e ingordo di guadagni
RAPACE,Predatore con ali e artigli
RAPACI,Avidi e pronti ad approfittare degli altri
RAPACI,Uccelli predatori dal becco adunco
RAPANELLO,Piccolo ortaggio rosso e piccante
RAPE,Ortaggi tondeggianti coltivati sottoterra
RAPE,Radici commestibili dalla polpa chiara
RAPERONZOLO,La fanciulla della fiaba dai lunghi capelli
RAPHAEL,Il nome inglese del pittore urbinate Raffaello
RAPIDA,Veloce
RAPIDAMENTE,In poco tempo
RAPIDAMENTE,Senza perdere tempo
RAPIDE,Veloci
RAPIDI,Veloci
RAPIDO,Che impiega poco tempo
RAPIDO,Il treno...che salta le stazioni minori
RAPIDO,Veloce
RAPIMENTO,Può indicare anche uno stato di estasi
RAPIMENTO,Sequestro di una persona contro la sua volontà
RAPINATORE,Minaccia per impossessarsi dell'altrui
RAPINE,Assalti compiuti per impossessarsi di denaro o beni
RAPINE,Furti commessi con minaccia o violenza
RAPIRE,Affascinare completamente
RAPIRE,Portare via con la forza
RAPITI,Completamente affascinati e assorti
RAPITI,Portati via contro la propria volontà
RAPPORTO,Documento che espone fatti o risultati
RAPPORTO,Legame o confronto tra due elementi
RAPPRENDERE,Far diventare denso
RAPPRESAGLIA,Azione punitiva compiuta per vendetta
RAPPRESAGLIA,Risposta violenta a un'offesa subita
RAPPRESENTA,Raffigura o sostituisce
RAPPRESENTANTE,Agisce per conto di altri
RAPPRESENTANTE,Gira a vendere prodotti per ditte
RAPPRESENTANTE,Può vendere prodotti visitando i clienti
RAPPRESENTANZA,Facoltà di agire in nome di qualcuno
RAPPRESENTANZA,Gruppo incaricato di parlare per altri
RAPPRESENTARE,Portare in scena o simboleggiare
RAPPRESENTARE,Raffigurare o sostituire
RAPPRESENTARE,Rendere presente con parole o immagini
RAPPRESENTATIVO,Capace di esprimere bene un insieme
RAPPRESENTATIVO,Scelto come esempio caratteristico
RAPPRESENTATO,Raffigurato o sostituito
RAPPRESENTAZIONE,Messa in scena o immagine simbolica
RAPPRESENTAZIONE,Può concludersi con un finale a sorpresa
RAPPRESENTO,Raffiguro o sostituisco
RAPSODIA,...Bohemian dei Queen
RAPSODIA,Composizione libera e appassionata
RAPSODO,Cantore epico prima dei libri
RAPUNZEL,La fanciulla dai lunghissimi capelli
RARE,Poco fitte e distanziate
RARE,Poco frequenti o difficili da trovare
RAREFATTA,Poco densa
RAREFATTE,Poco dense
RAREFATTI,Poco densi
RAREFATTO,Poco denso
RARITA,Ciò che si incontra di rado
RARITA,Oggetto insolito e difficile da trovare
RARO,"Scarso, quindi ricercato"
RAS,Titolo etiopico divenuto sinonimo di potente locale
RAS,Titolo nobiliare dell'Etiopia
RASA,Taglia a filo
RASAI,Tagliai a filo
RASATO,Tagliato a filo
RASCHIA,Gratta una superficie
RASCHIARE,Grattare una superficie
RASCHIATO,Grattato una superficie
RASCHIETTO,L'attrezzo per raschiare
RASCHIETTO,Toglie incrostazioni e vernice
RASCHIO,Gratto una superficie
RASE,Spianate fino al livello del terreno
RASE,Tagliate molto corte
RASI,Privati completamente dei peli
RASI,Spianati fino al livello del terreno
RASO,Il tessuto liscio e lucente
RASO,Pieno fino all'orlo
RASO,Tessuto liscio o barba appena fatta
RASOI,Lame maneggiate con molta attenzione davanti allo specchio
RASOI,Strumenti affilati per eliminare barba e peli
RASOIO,Lama quotidiana da barba
RASOIO,Scivola sul viso per togliere la barba
RASOIO,Sul filo del...: in bilico tra due esiti
RASPA,La lima grossa per il legno
RASPA,Lima grossolana da falegname
RASPE,Attrezzi abrasivi usati per sgrossare una superficie
RASPE,Utensili dentati per consumare legno o metallo
RASSEGNA,Esame ordinato di più elementi
RASSEGNA,Serie di spettacoli o opere
RASSEGNAZIONE,L'accettare senza più reagire
RASTRELLIERA,Sostegno ordinato per bici o attrezzi
RASTRELLO,Attrezzo dai denti lunghi
RASTRELLO,Raccoglie foglie con denti di ferro
RASTRELLO,Raccoglie foglie e fieno
RATA,A...: pagando a poco a poco
RATA,Quota che torna ogni mese
RATIFICA,Approvazione formale di un accordo
RATTI,Grossi roditori dalla lunga coda
RATTI,"Molto rapidi, in un uso letterario"
RATTO,Il rapimento: il... delle Sabine
RATTO,Rapido come un gesto fulmineo
RATTO,"Rapimento o roditore, secondo contesto"
RATTOPPO,Metto una toppa
RATTOPPO,Pezza su uno strappo
RATTRISTATO,Ha perso il sorriso
RATZINGER,Il cognome di papa Benedetto XVI
RAUCEDINE,Voce resa ruvida
RAUCHE,"Aspre e poco limpide, dette di voci"
RAUCHE,Rese profonde da raffreddore o sforzo
RAUL,Il nome dell'attore Bova
RAUL,L'attaccante spagnolo soprannominato el Siete
RAVANELLO,Radice rossa dal morso piccante
RAVANELLO,Radice rossa e piccante da insalata
RAVEL,Compose un Bolero ostinato
RAVEL,Compositore del Bolero
RAVELLO,Borgo della Costiera con giardini sospesi
RAVELLO,Terrazza amalfitana amata da Wagner
RAVENNA,Città dei mosaici e di Dante
RAVIOLI,Pasta ripiena a forma di cuscinetto
RAVIOLI,Scrigni di pasta con ripieno
RAVIOLO,Pasta ripiena
RAVVEDIMENTO,Il ritorno a una condotta corretta
RAVVEDIMENTO,Il tornare sulla retta via
RAVVEDIMENTO,Può evitare conseguenze peggiori a chi si pente
RAY,"...-Ban, la celebre marca di occhiali da sole"
RAY,Il nome del musicista cieco Charles
RAY,"Un raggio, in inglese"
RAYBAN,La marca di occhiali da sole degli aviatori
RAYMOND,Il nome dello scrittore giallo Chandler
RAZIONALISMO,La dottrina che fonda il sapere sulla ragione
RAZZA,"La stirpe, il ceppo familiare"
RAZZA,Linea di discendenza animale selezionata
RAZZA,"Specie, stirpe o pesce piatto"
RAZZE,Categorie o stirpi considerate secondo l'origine
RAZZE,Gruppi animali con caratteri ereditari comuni
RAZZI,Fuochi artificiali che salgono rapidamente nel cielo
RAZZI,Veicoli spinti dalla reazione di gas
RAZZO,Sale con fuoco sotto
RAZZO,Velocissimo: partire come un...
RB,Iniziali dello scrittore Bradbury
RB,Simbolo chimico del rubidio
RC,Iniziali del cantante Charles
RC,Sigla automobilistica di Reggio Calabria
RE,Comanda sulla scacchiera
RE,Il sovrano sul trono
RE,Nota tra do e mi
REA,La madre di Romolo e Remo: ...Silvia
REA,Lo è una donna riconosciuta colpevole
REAGENTE,La sostanza che entra in una reazione
REAGIRE,Rispondere con un comportamento a uno stimolo
REAL,Il club calcistico di Madrid
REAL,La valuta del Brasile
REALE,Da re o autentico
REALE,"Del re, regio"
REALE,Non immaginario
REALE,Vero ed effettivo
REALI,Appartenenti a sovrani e dinastie
REALI,Effettivi e non immaginari
REALISMO,Aderenza concreta ai fatti
REALISMO,Nell'arte evita idealizzazioni
REALISTA,Guarda i fatti senza illusioni
REALIZZABILE,Che può essere portato a compimento
REALIZZABILE,Non resta soltanto sulla carta
REALIZZARE,Rendersi conto all'improvviso
REALIZZARE,Trasformare un progetto in realtà
REALIZZAZIONE,Opera portata a compimento
REALIZZAZIONE,Passaggio dall'idea al fatto
REALMENTE,Davvero
REALMENTE,"Nei fatti, non solo in apparenza"
REALTA,Ciò che esiste davvero
REALTA,Concretezza opposta all'illusione
REAME,Territorio governato da un sovrano
REATI,Comportamenti puniti dalla legge penale
REATI,Illeciti che possono portare a un processo
REATO,L'azione che la legge punisce
REATO,Può portare a processo
REATO,Violazione punita dalla legge
REATTIVO,In chimica tende a combinarsi facilmente
REATTORE,Motore a getto degli aerei
REATTORE,Produce spinta espellendo gas ad alta velocità
REATTORE,Quello nucleare della centrale
REAZIONE,"Può essere chimica, emotiva o politica"
REAZIONE,Risposta a uno stimolo o a un'azione
REBECCA,Il nome della protagonista del romanzo di du Maurier
REBECCA,La moglie di Isacco nella Bibbia
REBUS,Disegno che nasconde parole
REBUS,Enigma figurato
REBUS,Gioco da risolvere con immagini e lettere
RECA,Porta con sé in lingua formale
RECANO,"Causano un effetto, spesso un danno o un vantaggio"
RECANO,Portano qualcosa in un luogo
RECAPITI,Indirizzi e contatti per raggiungere qualcuno
RECAPITI,Informazioni utili per consegnare posta o messaggi
RECAPITO,Indirizzo al quale far giungere qualcosa
RECARE,Portare con sé
RECARE,Può causare danno o beneficio
RECATA,Portata in un determinato luogo
RECATA,"Prodotta o causata, al femminile"
RECATE,Portate in un determinato luogo
RECATE,"Prodotte o causate, al femminile plurale"
RECENSIONE,Giudizio scritto su libro o film
RECENSIONE,"Valuta un libro, un film o uno spettacolo"
RECENTEMENTE,Da poco tempo
RECENTEMENTE,Negli ultimi tempi
RECESSIONE,La fase di calo dell'economia
RECIFE,Città costiera del Brasile
RECINTI,"Aree delimitate per animali, persone o lavori"
RECINTI,"Spazi chiusi da reti, muri o steccati"
RECINTO,Spazio chiuso da staccionata
RECINTO,Spazio delimitato da una barriera
RECINTO,Tiene dentro animali o fuori curiosi
RECINZIONE,Manufatto che delimita un terreno
RECINZIONE,Separa e protegge un'area
RECIPIENTE,Contiene liquidi o materiali
RECIPROCO,Che vale dall'uno verso l'altro
RECIPROCO,Scambiato in entrambe le direzioni
RECISE,Tagliò di netto
RECISI,Espressi in modo fermo e senza esitazioni
RECISI,Tagliati con un gesto netto
RECITA,Dice una parte sulla scena
RECITA,Esibizione di attori o scolari
RECITAI,Dissi una parte sulla scena
RECITARE,Dire ad alta voce versi o preghiere
RECITARE,Dire una parte sulla scena
RECITARE,Interpretare un personaggio
RECITATIVO,Parte d'opera vicina al parlato
RECITATO,Interpretato sulla scena
RECITAZIONE,Arte di dare voce e gesto a un personaggio
RECITE,"Ripeti a memoria versi, preghiere o parti"
RECITE,Spettacoli teatrali messi in scena
RECITO,Dico una parte sulla scena
RECLAMARE,Chiedere con insistenza ciò che si ritiene dovuto
RECLAME,Pubblicità con profumo francese
RECLAMI,Proteste formali presentate a un venditore
RECLAMI,Richieste di correzione per un servizio insoddisfacente
RECLAMO,Contestazione presentata per iscritto
RECLAMO,Protesta formale rivolta a chi fornisce un servizio
RECLUSIONE,Pena che priva della libertà
RECLUSIONE,Vita forzata fra quattro mura
RECLUTAMENTO,Porta nuove forze in un'organizzazione
RECLUTAMENTO,Selezione e ingresso di nuove persone
RECLUTARE,Arruolare per un incarico o un servizio
RECLUTARE,Inserire nuove persone in un gruppo
RECONDITA,Nascosta e remota
RECONDITE,Nascoste e remote
RECONDITI,Nascosti e remoti
RECONDITO,Nascosto e remoto
RECORD,Il primato in una prestazione
RECUPERARE,Riprendere ciò che era stato perso
RECUPERARE,Tornare in possesso o in condizioni migliori
REDARGUISCO,Riprendo con severità
REDATTE,"Preparate in forma ufficiale, al femminile"
REDATTE,Scritte e formulate in modo ordinato
REDATTI,"Preparati in forma ufficiale, al maschile"
REDATTI,Scritti e formulati in modo ordinato
REDATTORE,Lavora nella preparazione editoriale
REDATTORE,Scrive e prepara testi per la pubblicazione
REDAZIONE,Gruppo che prepara giornali o testi
REDBULL,L'energy drink che mette le ali
REDDITIZIO,Capace di produrre guadagno
REDDITIZIO,Produce un utile
REDDITO,"Può provenire da lavoro, capitale o immobili"
REDDITO,Somma percepita in un periodo
REDFORD,Il Robert de La stangata
REDIGERE,Compilare in forma ordinata
REDIGERE,Scrivere un documento ufficiale
REDINE,Cinghia che guida il cavallo
REDINI,Le... del comando: la guida
REDISTRIBUZIONE,Nuova ripartizione di beni o risorse
REDIVIVO,Tornato in vita o alla ribalta
REFETTORIO,Sala da pranzo monastica o collegiale
REFETTORIO,Sala in cui mangia una comunità
REFOLO,Il soffio improvviso di vento
REFUSO,Errore tipografico sopravvissuto alla rilettura
REGALA,Dà in dono
REGALAI,Diedi in dono
REGALANO,Concedono con generosità
REGALANO,Offrono qualcosa senza chiedere pagamento
REGALARE,Dare in dono
REGALATA,Concessa con eccessiva facilità
REGALATA,Data senza chiedere pagamento
REGALATE,Concesse con eccessiva facilità
REGALATE,Date senza chiedere pagamento
REGALATI,Concessi con eccessiva facilità
REGALATI,Dati senza chiedere pagamento
REGALATO,Dato in dono
REGALI,Si scartano con sorpresa
REGALO,Do in dono
REGALO,Dono incartato
REGALO,In...: dato in omaggio
REGALO,Si offre senza chiedere pagamento
REGATA,Gara tra imbarcazioni
REGATA,La gara tra barche a vela
REGATE,Competizioni veliche disputate su un percorso segnato
REGATE,Gare tra imbarcazioni
REGESTO,Riassunto archivistico di un documento
REGGAE,Genere musicale giamaicano
REGGAE,Uno stile musicale giamaicano
REGGERE,Sostenere un peso o continuare a funzionare
REGGERE,Tenere senza lasciar cadere
REGGI,Governi o dirigi un'organizzazione
REGGI,Sostieni un peso senza farlo cadere
REGGIA,Casa enorme di re e regine
REGGIA,Palazzo di sovrani
REGGIMENTO,Reparto dell'esercito con più battaglioni
REGGIMENTO,Schiera soldati sotto una stessa insegna
REGIA,Direzione dietro le quinte
REGIA,La direzione artistica del film
REGIME,Può imporre limiti a tavola
REGIME,Sistema alimentare seguito con regolarità
REGINA,L'ape...che regna sull'alveare
REGINA,La pappa...delle api
REGINA,Pezzo potente degli scacchi
REGINA,Sulla scacchiera è il pezzo più potente
REGINE,Portano la corona
REGIONE,Area territoriale con confini propri
REGIONE,In Italia ha organi amministrativi eletti
REGISTA,Dirige attori e riprese
REGISTRA,Incide o annota
REGISTRARE,"Fissare su un supporto suoni, immagini o dati"
REGISTRARE,Incidere o annotare
REGISTRARE,Incidere una traccia sonora
REGISTRATO,Inciso o annotato
REGISTRATORE,Il...di cassa del negozio
REGISTRATORE,Registra suoni e voci
REGISTRAZIONE,Può fissare un evento o un dato
REGISTRAZIONE,Traccia conservata su un supporto
REGISTRO,Incido o annoto
REGISTRO,Libro o archivio di annotazioni ufficiali
REGNA,Porta una corona o domina
REGNAI,Portai una corona o dominai
REGNANTE,Chi siede sul trono
REGNANTE,Sovrano che esercita il potere
REGNARE,Esercitare il potere su un territorio
REGNARE,Essere dominante in un ambiente
REGNARE,Portare una corona o dominare
REGNATO,Esercitato il potere
REGNI,Grandi categorie in cui si classificano gli esseri viventi
REGNI,Stati governati da monarchi
REGNO,L'ambito: il... animale
REGNO,Stato retto da una monarchia
REGNO,Territorio di corona o natura
REGOLA,Indicazione che stabilisce ciò che si può fare
REGOLA,L'eccezione che conferma la...
REGOLA,"Norma, strumento e ciclo"
REGOLAMENTO,"Disciplina una gara, un ente o un'attività"
REGOLAMENTO,Insieme di norme operative
REGOLARE,Mettere a punto o disciplinare
REGOLARE,Saldare una pendenza o sistemare una questione
REGOLARI,Conformi alle norme previste
REGOLARI,Uniformi e senza anomalie
REGOLARITA,Conformità a norme o ritmi previsti
REGOLARITA,Costanza senza eccezioni
REGOLAZIONE,Intervento che stabilisce limiti e modalità
REGOLAZIONE,Messa a punto di un meccanismo
REGOLE,Criteri che stabiliscono come svolgere un gioco o un'attività
REGOLE,Norme da osservare
REIKI,Pratica giapponese basata sull'imposizione delle mani
RELATIVISMO,La dottrina che nega le verità assolute
RELATIVO,Che si riferisce a qualcosa
RELATIVO,Non assoluto
RELATORE,Espone un tema o segue una tesi
RELAX,Il riposo e la distensione
RELAZIONE,Esposizione scritta o orale su un argomento
RELAZIONE,"Legame tra persone, fatti o grandezze"
RELIGIONE,Organizza il rapporto con il divino
RELIGIONE,Sistema di credenze e pratiche sacre
RELIGIOSITA,Sentimento e pratica della fede
RELIGIOSO,Devoto e legato alla fede
RELIGIOSO,Può vivere in una comunità consacrata
RELIQUIA,Resti venerati di santi o del passato
RELIQUIA,Resto sacro custodito
RELIQUIARIO,Custodia per resti sacri
