soluzione,definizione
RELITTI,Ciò che rimane di strutture distrutte o abbandonate
RELITTI,Resti di navi affondate
RELITTO,Ciò che resta di una nave naufragata
RELITTO,I resti di una nave affondata
REM,Fase del sonno che muove gli occhi
REM,La band americana di Losing My Religion
REMA,Muove i remi
REMAI,Mossi l'imbarcazione coi remi
REMAKE,Film rifatto a partire da un precedente
REMAKE,Il rifacimento di un film
REMAKE,Nuova versione di un'opera già esistente
REMATE,Azioni che fanno avanzare un'imbarcazione senza motore
REMATE,Colpi dati all'acqua con le pale di una barca
REMATO,Mosso coi remi
REMBRANDT,Il maestro olandese della Ronda di notte
REMBRANDT,Pittore olandese dei chiaroscuri
REMI,Aste con pala usate per spingere una barca
REMI,Si appoggiano agli scalmi durante la vogata
REMIGANTE,Muove la barca con fatica ritmica
REMO,Fratello sconfitto nella leggenda di Roma
REMO,Il fratello gemello di Romolo
REMO,Spinge la barca a braccia
REMORA,Freno che impedisce di procedere
REMORA,Ostacolo che trattiene o rallenta
REMORA,Pesce che si attacca e freno morale
REMOTA,Lontana nel tempo
REMOTE,Lontane nel tempo
REMOTI,Lontani nel tempo
REMOTO,Lontano nel tempo
RENA,"Sabbia, con parola da lido antico"
RENA,È composto anche da silicio
RENDERE,Far diventare in un certo modo
RENDERE,Produrre un risultato o restituire
RENDEZVOUS,Appuntamento galante alla francese
RENDICONTO,"Documento che riepiloga entrate, uscite e risultati"
RENDIMENTO,Quanto produce un investimento o un terreno
RENDIMENTO,Rapporto tra risultato e mezzi impiegati
RENDITA,Entrata periodica senza corrispettivo immediato
RENDITA,Può derivare da immobili o titoli
RENE,Filtro naturale doppio
RENE,L'organo dei calcoli e della dialisi
RENGA,"Il cantante ex Timoria, Francesco"
RENIO,Elemento dal simbolo Re
RENNA,Tira la slitta nelle storie di Natale
RENO,Città del Nevada del gioco d'azzardo
RENO,Fiume d'Europa e fiume d'Emilia
RENO,Fiume europeo tra Alpi e Mare del Nord
RENOIR,Il Pierre-Auguste degli impressionisti
RENZOPIANO,L'architetto genovese del Beaubourg
REO,"Malvagio, perfido in poesia"
REO,Uno che il giudice non assolve
REOSTATO,Resistenza regolabile in un circuito
REPARTI,"Sezioni di ospedali, aziende o negozi"
REPARTI,Unità organizzate di un esercito o di un'istituzione
REPARTO,In ospedale riunisce cure della stessa specialità
REPARTO,Sezione interna di un'organizzazione
REPERIBILE,Che si può trovare o contattare
REPERIRE,Individuare e procurare
REPERIRE,Trovare ciò che si cercava
REPLICA,Nuova esecuzione o copia di un originale
REPLICA,Risposta pronta a un'affermazione
REPLICARE,Rispondere opponendo un argomento
REPLICHE,Nuove rappresentazioni dello stesso spettacolo
REPLICHE,Risposte pronte a un'obiezione
REPORTAGE,Servizio giornalistico realizzato sul posto
REPORTER,Giornalista inviato sul luogo dei fatti
REPRESSE,Tenne a freno
REPRIMERE,Fermare con la forza o trattenere un impulso
REPRIMERE,Soffocare una protesta o un impulso
REPROBA,Moralmente condannata
REPROBE,Moralmente condannate
REPROBI,Moralmente condannati
REPROBO,Malvagio respinto dalla morale
REPUBBLICA,Forma di Stato senza sovrano ereditario
REPUTAZIONE,Opinione che gli altri hanno di qualcuno
REPUTAZIONE,Si costruisce lentamente e si perde in fretta
REQUIEM,Messa funebre musicata
REQUIEM,Messa o composizione per i defunti
REQUISITO,Condizione necessaria per essere ammessi
RES,"Cosa, per i Latini"
RES,La cosa dei giuristi latini
RESA,Atto con cui si depongono le armi
RESA,Quantità ottenuta rispetto a quanto impiegato
RESIDENZA,Domicilio stabile indicato nei documenti
RESIDENZA,Indirizzo abituale di una persona
RESIDUI,Parti rimaste dopo un consumo o una lavorazione
RESIDUI,Quantità avanzate dopo una divisione o un calcolo
RESIDUO,Ciò che resta dopo un processo
RESIDUO,Parte non consumata
RESINA,La sostanza appiccicosa che cola dal pino
RESINE,Materiali sintetici usati per colle e rivestimenti
RESINE,Sostanze viscose prodotte da molte piante
RESISTENZA,Capacità di durare sotto sforzo
RESISTERE,Continuare nonostante la fatica
RESISTERE,Non cedere alla pressione
RESOCONTO,Esposizione ordinata di fatti e risultati
RESOCONTO,Registrazione ordinata di quanto avvenuto
RESORT,Complesso turistico attrezzato
RESPIGHI,L'Ottorino dei Pini di Roma
RESPINGERE,Mandare indietro o non accettare
RESPINGERE,Rifiutare una richiesta o un attacco
RESPIRA,Prende e manda aria
RESPIRARE,Immettere ed espellere aria
RESPIRARE,Prendere e mandare aria
RESPIRATO,Inspirato ed espirato
RESPIRO,Entra ed esce senza far rumore quando tutto va bene
RESPIRO,Pausa che dà sollievo
RESPIRO,Prendo e mando aria
RESPONSABILE,Chi risponde di decisioni o risultati
RESPONSABILE,Può guidare un ufficio o un progetto
RESPONSABILITA,Obbligo di rispondere delle proprie azioni
RESPONSABILITA,Peso che accompagna una scelta importante
RESPONSO,Risposta solenne di un'autorità o di un oracolo
RESPONSO,Verdetto o risposta autorevole
RESSA,Folla che si accalca
RESSA,La calca che preme e spinge
RESSE,Tenne in piedi
RESTA,Il filo che lega l'aglio: una... d'aglio
RESTA,Non va via
RESTA,Osso arcuato del torace
RESTAI,Non andai via
RESTANTE,Che rimane dopo una sottrazione
RESTANTE,Non ancora utilizzato
RESTARE,Continuare a trovarsi nello stesso posto
RESTARE,Fermarsi senza proseguire
RESTATO,Rimasto
RESTAURARE,Intervenire senza cancellare l'originale
RESTAURARE,Riportare un'opera o un edificio a condizioni migliori
RESTAURATORE,Ripristina opere d'arte e antichità
RESTAURI,Interventi che riportano opere e edifici a buone condizioni
RESTAURI,Lavori conservativi eseguiti su oggetti antichi
RESTI,Continui a trovarti nello stesso luogo
RESTI,Parti rimaste dopo una distruzione
RESTIA,Poco disposta
RESTIE,Poco disposte
RESTII,Poco disposti
RESTIO,Poco disposto
RESTITUZIONE,Riconsegna di ciò che era stato ricevuto
RESTO,Avanzo e spiccioli
RESTO,Ciò che rimane
RESTO,I soldi che il negoziante ridà
RESTRINGERE,Far diventare più stretto
RESTRINGERE,"Ridurre larghezza, spazio o possibilità"
RESTRIZIONE,Limite imposto a un comportamento
RESTRIZIONE,"Riduce libertà, accesso o quantità"
RESURREZIONE,Ritorno alla vita dopo la morte
RETABLO,Grande pala d'altare spagnola
RETAGGIO,Eredità culturale del passato
RETAGGIO,L'eredità del passato
RETAGGIO,Traccia lasciata da epoche precedenti
RETE,"Cattura pesci, gol e dati"
RETE,Il gol segnato in porta
RETE,La lancia il pescatore o la squadra segna
RETE,Quella che intrappola i pesci
RETI,Intrecci di fili usati per catturare o proteggere
RETI,"Sistemi di collegamenti tra computer, persone o trasporti"
RETICENTE,Tace proprio dove dovrebbe dire
RETICENTI,Che tacciono qualcosa
RETICOLO,Intreccio di linee
RETICOLO,Rete di linee incrociate
RETINA,La reticella che raccoglie i capelli
RETINA,Membrana sensibile dell'occhio
RETINA,Sacchetto a maglie
RETINO,Cattura farfalle o palline da ping pong
RETORICA,"Arte del persuadere, non solo enfasi"
RETRIBUZIONE,Compenso per il lavoro svolto
RETRIBUZIONE,Paga corrisposta per il lavoro
RETRO,La parte opposta al davanti
RETRO,Può essere il lato nascosto di un oggetto
RETROBOTTEGA,Stanza dietro il negozio
RETROCESSIONE,Arretramento di posizione o grado
RETROCESSIONE,Passaggio a una categoria inferiore
RETROSCENA,Ciò che avviene lontano dal pubblico
RETTA,Dare...: ascoltare
RETTA,Il pagamento del collegio o della pensione
RETTA,Linea senza esitazioni
RETTIFICA,Correzione di un dato o di una notizia
RETTILE,Animale a sangue freddo e pelle squamosa
RETTILI,"Animali come serpenti, lucertole e tartarughe"
RETTILI,Vertebrati a sangue freddo con pelle squamosa
RETTILINEO,Tratto di strada senza curve
RETTO,"L'angolo di novanta gradi, o chi è onesto"
RETTO,L'ultimo tratto dell'intestino
RETTO,Onesto e moralmente integro
RETTORE,Guida un'università
RETTORE,Può dirigere anche una chiesa o un collegio
REUMATOLOGIA,La medicina delle articolazioni
REUNION,Isola francese dell'Oceano Indiano
REUNION,La rimpatriata di una band o di amici
REVENANT,Defunto che torna tra i vivi
REVERENTE,Pieno di rispetto
REVERENTI,Pieni di rispetto
REVISIONE,Controllo con eventuali correzioni
REVIVAL,Ripresa di un'opera o tendenza dimenticata
REVIVAL,Ritorno di moda di uno stile del passato
REVOCARE,Annullare un provvedimento
REVOCARE,Togliere validità a una decisione
REX,Il cane poliziotto della serie tv
REX,Re in tre lettere da lapide romana
REX,Tyrannosaurus...: il temuto dinosauro carnivoro
REYKJAVIK,Capitale islandese
REYKJAVIK,Capitale islandese tra oceano e vulcani
RF,Iniziali del tennista Federer
RF,"La radiofrequenza, in sigla"
RG,Iniziali del fumettista Goscinny
RG,Sigla automobilistica di Ragusa
RH,Il fattore del sangue
RH,Iniziali dell'attore Harris
RHO,Greca della densità nei libri di fisica
RHO,Il comune dell'hinterland milanese
RI,Prefisso che indica ripetizione
RI,Sigla automobilistica di Rieti
RIABILITAZIONE,Percorso per recuperare capacità perdute
RIABILITAZIONE,Restituisce dignità o funzionalità
RIAD,Capitale dell'Arabia Saudita
RIAL,La valuta dell'Iran
RIALTO,Il ponte di pietra sul Canal Grande di Venezia
RIALZI,"Aumenti di prezzi, quote o livelli"
RIALZI,Parti costruite a un'altezza maggiore
RIALZO,Aumento di prezzo o livello
RIALZO,Può rendere più costoso un acquisto
RIANIMO,Riporto in sé chi è svenuto
RIAPRIRE,Rendere di nuovo accessibile
RIASSUMERE,Condensare un discorso nei punti essenziali
RIASSUMERE,Esporre in forma più breve
RIASSUNTO,Riduce un contenuto senza cambiarne il senso
RIASSUNTO,Testo che conserva solo i punti essenziali
RIAVERE,Ottenere di nuovo ciò che si possedeva
RIBALTA,Parte anteriore del palcoscenico
RIBALTARE,Capovolgere o cambiare completamente una situazione
RIBASSO,Calo di prezzo
RIBASSO,Diminuzione di prezzo o quota
RIBATTERE,Rispondere contestando un argomento
RIBELLARSI,Opporsi apertamente all'autorità
RIBELLARSI,Rifiutare di obbedire
RIBELLE,Chi si oppone apertamente a un potere
RIBELLE,Contrario all'autorità e poco disposto a obbedire
RIBELLI,Contrari all'autorità e poco disposti a obbedire
RIBELLI,Persone che si oppongono apertamente a un potere
RIBELLIONE,Insurrezione contro un potere
RIBELLIONE,Scontro aperto contro l'autorità
RIBERY,"Franck, fuoriclasse francese del Bayern"
RIBES,Piccolo frutto acidulo a grappoli
RIBOLLA,Vino friulano dal nome che fermenta
RIBOLLITA,La zuppa toscana di pane e verdure
RIBOSOMA,Organulo che assembla le proteine
RIBREZZO,Il senso di forte disgusto
RIBREZZO,Repulsione fisica o morale
RIBREZZO,Senso di disgusto che fa rabbrividire
RICADUTA,Ritorno di un problema dopo un miglioramento
RICAMA,Orna col filo
RICAMAI,Ornai col filo
RICAMARE,Ornare col filo
RICAMATO,Ornato col filo
RICAMATRICE,Decora i tessuti con l'ago
RICAMBIARE,Restituire un gesto o un favore
RICAMBIARE,Rispondere a un gesto con uno equivalente
RICAMBIO,Pezzo destinato a sostituirne uno usurato
RICAMBIO,Scambio reciproco di favori o saluti
RICAMI,Abbellimenti elaborati aggiunti a un racconto
RICAMI,Decorazioni ottenute con ago e filo
RICAMO,Disegno cucito su stoffa
RICAMO,Disegno fatto con ago e filo
RICARDO,Il nome del calciatore brasiliano Kakà
RICAVARE,Ottenere da una fonte o dedurre da dati
RICAVATO,Ciò che resta dopo aver incassato
RICAVATO,Somma ottenuta da una vendita
RICCHE,Abbondanti e piene di elementi
RICCHE,Dotate di molto denaro o beni
RICCHEZZA,Abbondanza che non è solo denaro
RICCHEZZA,Abbondanza di beni o risorse
RICCHEZZA,"Può essere economica, culturale o naturale"
RICCHI,Abbondanti e pieni di elementi
RICCHI,Dotati di molto denaro o beni
RICCI,Animali marini coperti di aculei
RICCI,Ciocche di capelli avvolte a spirale
RICCIARELLO,Il dolce senese alle mandorle
RICCIO,Animale spinoso o boccolo di capelli
RICCIO,Ha aculei o capelli arruffati
RICCIOLA,Grosso pesce azzurro predatore
RICCIOLO,Ciocca di capelli arricciata
RICCIUTO,Dai capelli a riccioli
RICCO,Abbondante e sostanzioso: un pasto...
RICCO,Abbondante o dotato di molti mezzi
RICCO,"Ha molto, non solo denaro"
RICERCA,Indagine sistematica per trovare o conoscere
RICERCA,Indagine svolta per trovare dati o risposte
RICERCARE,Cercare con particolare attenzione
RICERCATO,Elegante e non comune
RICERCATO,Scelto con particolare cura
RICERCATORE,Studia per produrre nuove conoscenze
RICETTA,Elenco di ingredienti e istruzioni
RICETTA,Formula di cucina o farmacia
RICETTA,Prescrizione medica o istruzione di cucina
RICETTACOLO,Parte del fiore che sostiene gli organi
RICETTE,Istruzioni per preparare piatti
RICETTE,Prescrizioni compilate da medici
RICEVENTE,Chi ottiene un messaggio o un bene
RICEVERE,Accogliere ciò che viene inviato o offerto
RICEVERE,Entrare in possesso o accogliere
RICEVIMENTO,Evento organizzato per gli ospiti
RICEVIMENTO,Occasione formale con ospiti
RICEVITORE,Capta e amplifica segnali
RICEVUTA,Documento che prova un pagamento
RICEVUTA,Prova scritta di un pagamento
RICEZIONE,Atto di accogliere o captare
RICEZIONE,Spazio d'ingresso di un albergo
RICHARD,Il nome dell'attore Gere
RICHIAMARE,Ammonire qualcuno per un errore
RICHIAMARE,Convocare di nuovo o attirare attenzione
RICHIAMO,Ammonimento che invita a correggersi
RICHIAMO,Forza capace di attirare
RICHIEDENTE,Aspetta una risposta dall'ufficio competente
RICHIEDENTE,Chi presenta una domanda
RICHIEDERE,Domandare come necessario o dovuto
RICHIEDERE,Esigere come condizione necessaria
RICHIESTA,Domanda espressa formalmente
RICHIESTA,Domanda rivolta a qualcuno
RICHIESTO,Domandato esplicitamente
RICHIESTO,Gradito o desiderato
RICICLARE,Dare nuovo uso a materiali già impiegati
RICK,Il nome del protagonista di Casablanca Blaine
RICOGNIZIONE,Esame sul posto prima di agire
RICOMPENSA,Arriva dopo un'impresa riuscita
RICOMPENSA,Il premio per un buon lavoro
RICOMPENSA,Premio per un merito o un servizio
RICONCILIAZIONE,Accordo che chiude un contrasto
RICONCILIAZIONE,Ristabilisce rapporti pacifici
RICONOBBE,Identificò senza errore
RICONOSCENTE,Grato per quanto ricevuto
RICONOSCENZA,Gratitudine per un beneficio ricevuto
RICONOSCENZA,La gratitudine verso chi ci aiuta
RICONOSCERE,Avere coscienza di qualcosa
RICONOSCERE,Identificare qualcosa già noto
RICONQUISTARE,Riprendere ciò che era stato perduto
RICOPERTA,Nascosta sotto uno strato
RICOPERTA,Rivestita da uno strato esterno
RICOPERTO,Interamente coperto da qualcosa
RICOPRIRE,Coprire interamente o svolgere un incarico
RICOPRIRE,Rivestire o occupare una carica
RICORDARE,Celebrare una persona o un evento del passato
RICORDARE,Conservare o richiamare alla mente
RICORDARSI,Far tornare alla mente
RICORDO,Immagine del passato conservata nella mente
RICORDO,Rievocazione mentale di un fatto
RICORRENZA,Data che ritorna ogni anno
RICORRENZA,Occasione celebrata periodicamente
RICORRERE,Accadere con regolarità
RICORRERE,Rivolgersi a un'autorità o a un rimedio
RICORSO,Atto con cui si chiede di riesaminare una decisione
RICOTTA,Latticino morbido da cannoli e torte salate
RICOTTA,Latticino ottenuto dal siero
RICOVERO,"Luogo protetto per persone, animali o mezzi"
RICOVERO,Permanenza in una struttura sanitaria
RICREARE,Divertire e dare sollievo
RICREAZIONE,La pausa a scuola
RIDA,Che se la goda con una bella risata
RIDAI,Tu dai di nuovo
RIDARE,Consegnare nuovamente o restituire
RIDATO,Dato nuovamente
RIDE,"Un passaggio in auto, in inglese"
RIDERE,"...sotto i baffi, di nascosto"
RIDICOLO,Che provoca il riso per goffaggine
RIDICOLO,Può far ridere involontariamente
RIDIRE,Dire ancora una volta
RIDO,Do di nuovo
RIDOTTA,Opera fortificata di dimensioni contenute
RIDOTTO,Piccolo locale appartato
RIDOTTO,Vano secondario di dimensioni contenute
RIDUSSE,Rese più piccolo
RIDUTTIVO,Che semplifica troppo e limita il significato
RIDUZIONE,"Diminuzione di quantità, prezzo o dimensione"
RIDUZIONE,Diminuzione rispetto al valore iniziale
RIEDUCAZIONE,Percorso per apprendere di nuovo capacità o comportamenti
RIENTRARE,Tornare dentro o nei limiti
RIENTRARE,Tornare nel luogo da cui si era usciti
RIEPILOGO,Sintesi finale dei punti principali
RIESLING,Il vitigno bianco tedesco e alsaziano
RIETI,Città laziale nella conca velina
RIEVOCAZIONE,Messa in scena di un evento passato
RIEVOCAZIONE,Ricostruzione di un fatto del passato
RIFACIMENTO,Nuova esecuzione di qualcosa già fatto
RIFACIMENTO,Può trasformare un locale o un'opera
RIFAI,Tu fai di nuovo
RIFATTO,Participio passato di rifare
RIFERIMENTO,Punto usato per orientarsi o confrontare
RIFERIMENTO,Richiamo a una fonte o a un elemento
RIFERIRE,Comunicare un fatto a qualcuno
RIFERIRE,Dare comunicazione a scopo informativo
RIFERIRSI,Alludere o fare riferimento
RIFERIRSI,Avere come oggetto o destinatario
RIFINIRE,Dare l'ultimo tocco
RIFINISCE,Dà l'ultimo tocco
RIFINISCO,Do l'ultimo tocco
RIFINISCONO,Danno l'ultimo tocco
RIFINITO,Dato l'ultimo tocco
RIFIUTA,Dice di no
RIFIUTAI,Dissi di no
RIFIUTARE,Dire di no
RIFIUTARE,Non accettare ciò che viene offerto
RIFIUTARE,Respingere una proposta o un oggetto
RIFIUTATO,Detto di no
RIFIUTI,Dinieghi opposti a richieste o proposte
RIFIUTI,Materiali scartati e destinati allo smaltimento
RIFIUTO,Dico di no
RIFIUTO,Diniego o materiale da scartare
RIFIUTO,Materiale destinato allo smaltimento
RIFLESSI,Immagini restituite da superfici lucide
RIFLESSI,Reazioni automatiche e involontarie del corpo
RIFLESSIONE,Considerazione formulata dopo aver pensato
RIFLESSIONE,Il rimbalzo della luce su una superficie
RIFLESSIONE,Pensiero ponderato su un argomento
RIFLESSO,Immagine di ritorno o reazione rapida
RIFLESSO,Risposta involontaria o immagine restituita
RIFLETTERE,Restituire luce o immagini
RIFLETTORE,Concentra luce su palco o cantiere
RIFLETTORE,Proietta un fascio di luce
RIFONDAZIONE,Nuova costituzione su basi diverse
RIFONDAZIONE,Ricostruzione di un ente su nuove basi
RIFORMATO,Appartenente a una confessione protestante
RIFORMISTA,Sostiene cambiamenti graduali senza rivoluzione
RIFORNIMENTI,"Arrivano a truppe, negozi o veicoli"
RIFORNIMENTI,Scorte necessarie a proseguire un'attività
RIFORNIMENTO,Operazione che rinnova una scorta
RIFORNIMENTO,Può riempire un serbatoio
RIFRAZIONE,La deviazione della luce che cambia mezzo
RIFUGI,Luoghi sicuri in cui ripararsi
RIFUGI,Strutture montane che ospitano escursionisti
RIFUGIARSI,Cercare protezione in un luogo sicuro
RIFUGIARSI,Mettersi al sicuro
RIFUGIATO,Persona costretta a lasciare il proprio Paese
RIFUGIO,Dà riparo a chi sale in montagna
RIFUGIO,Luogo che offre protezione
RIFUGIO,Riparo in montagna o altrove
RIFUGIO,Riparo sicuro
RIFULSE,Brillò di luce
RIGA,Capitale lettone sul Baltico
RIGA,La capitale della Lettonia
RIGA,La linea tracciata sul foglio
RIGA,Successione orizzontale di caratteri
RIGAGNOLO,Piccolo corso d'acqua tra i sassi
RIGAI,Tracciai linee
RIGATO,Segnato da linee
RIGATONE,Pasta che trattiene il sugo
RIGATONE,Pasta corta e scanalata
RIGATONI,Pasta corta rigata
RIGEL,Stella azzurra di Orione
RIGHE,"File orizzontali di parole, numeri o persone"
RIGHE,Linee tracciate su carta o tessuti
RIGHELLO,Misura e traccia linee dritte
RIGIDI,Duri e difficili da piegare
RIGIDI,Severi e poco disponibili a eccezioni
RIGIDO,"Inflessibile e severo, o il clima d'inverno"
RIGO,Andare a...: andare a capo
RIGO,Linea del pentagramma o di un testo
RIGO,Traccio linee
RIGOGOLO,Uccello dal piumaggio giallo vivo
RIGOLETTO,L'opera di Verdi del buffone di corte
RIGORE,Calcio dagli undici metri
RIGORE,"La severità, l'austerità della disciplina"
RIGORE,Severità e precisione senza concessioni
RIGORE,Tiro dagli undici metri
RIGOROSAMENTE,Con severità e precisione
RIGOROSO,Non ammette approssimazioni
RIGOROSO,Preciso e severo nell'applicare criteri
RIGUARDARE,Avere attinenza con un argomento
RIGUARDARE,Osservare di nuovo
RIGUARDO,Aspetto preso in considerazione
RIGUARDO,Attenzione rispettosa verso qualcuno
RIHANNA,La cantante delle Barbados di Umbrella
RIJKAARD,"Frank, centrocampista olandese campione d'Europa 1988"
RILASCIARE,Lasciare libero o consegnare
RILASCIARE,Pubblicare ufficialmente un documento o un software
RILASSA,Scioglie la tensione
RILASSAI,Sciolsi la tensione
RILASSARE,Sciogliere la tensione
RILASSATO,Liberato dalla tensione
RILASSATO,Privo di tensione
RILASSERO,Scioglierò la tensione
RILASSO,Sciolgo la tensione
RILEGATORE,Cuce e copre i libri
RILEVAMENTO,Misurazione o individuazione sul campo
RILEVAMENTO,Serve a raccogliere dati su territorio o fenomeni
RILEVANTE,Che emerge per peso o valore
RILEVANTE,Importante ai fini della questione
RILEVANZA,Importanza ai fini di una valutazione
RILEVANZA,Peso attribuito a un elemento
RILEVARE,Mettere in evidenza o accertare
RILEVARE,Registrare dati o mettere in evidenza
RILEVAZIONE,Individua una presenza o misura un valore
RILEVAZIONE,Raccolta sistematica di dati
RILIEVO,Importanza attribuita a un fatto
RILIEVO,Misurazione accurata di forme e distanze
RILIEVO,"Sporgenza, importanza o mappa del terreno"
RILKE,Autore di versi delle Elegie duinesi
RILKE,Poeta delle Elegie duinesi
RILUTTANTE,Poco disposto
RILUTTANTI,Poco disposti
RIMA,Accordo di suoni alla fine dei versi
RIMA,La consonanza finale tra due versi
RIMA,Uguaglianza di suono a fine verso
RIMAI,Feci versi con suoni uguali
RIMANDARE,Non svolgere ora ciò che era previsto
RIMANDARE,Spostare a un momento successivo
RIMANDO,Allusione o rinvio a un'altra fonte
RIMANDO,Richiamo a un'altra fonte o rinvio nel tempo
RIMANENTE,Ciò che non è stato consumato o usato
RIMANENTE,Parte ancora disponibile
RIMANERE,Continuare a trovarsi nello stesso luogo o stato
RIMANERE,Non cambiare luogo o condizione
RIMARCARE,Mettere in particolare evidenza
RIMARCARE,Sottolineare con particolare enfasi
RIMARIO,Libro per trovare parole in rima
RIMATO,Scritto con suoni uguali in finale
RIMBALZO,Ritorno elastico di palla o notizia
RIMBAUD,Autore di versi francese delle Illuminazioni
RIMBAUD,Poeta francese delle Illuminazioni
RIMBORSARE,Restituire una somma spesa
RIMBORSO,Compensa una spesa documentata
RIMBORSO,Restituzione di denaro anticipato
RIME,Componimenti poetici caratterizzati da richiami fonici
RIME,Uguaglianze di suono alla fine dei versi
RIMEDI,Mezzi usati per curare un disturbo
RIMEDI,Soluzioni adottate per correggere un problema
RIMEDIA,Pone riparo
RIMEDIAI,Posi riparo
RIMEDIARE,Porre riparo
RIMEDIARE,Porre riparo a un errore
RIMEDIARE,Trovare una soluzione in extremis
RIMEDIATO,Posto riparo
RIMEDIO,Mezzo usato per curare o correggere
RIMEDIO,Soluzione a un inconveniente
RIMEDIO,Soluzione pratica al malanno
RIMEMBRANZA,Il dolce ricordo del passato
RIMESSA,Consegna di denaro o locale per veicoli
RIMESSA,Garage o deposito
RIMESSA,"Locale per auto, attrezzi o barche"
RIMETTERE,Collocare di nuovo al proprio posto
RIMETTERE,Porre di nuovo o affidare
RIMETTERSI,Recuperare salute o forze
RIMINI,Città romagnola di Fellini
RIMO,Faccio versi con suoni uguali
RIMORCHIARE,Trainare un mezzo con un altro
RIMORCHIATORE,Nave che traina altre imbarcazioni
RIMORCHIO,Segue il veicolo che lo traina
RIMOSSE,Tolse di mezzo
RIMOSTRANZA,La protesta formale
RIMOZIONE,Allontanamento da un incarico
RIMOZIONE,Eliminazione di un ostacolo o di un ricordo
RIMPIANTO,Il dispiacere per ciò che non è stato
RIMPIANTO,Nostalgia dolorosa per una scelta mancata
RIMPIANTO,Pesa per ciò che non si è fatto
RIMPIAZZARE,Sostituire con un altro elemento
RIMPOLPO,Rendo più sostanzioso
RIMPROVERARE,Biasimare apertamente per un errore
RIMPROVERARE,Rivolgere un richiamo severo
RIMPROVERARE,Sgridare chi ha sbagliato
RIMPROVERO,Muovo un biasimo
RIMPROVERO,Può essere aspro ma non è una condanna
RIMPROVERO,Richiamo espresso per una colpa
RIMUOVERE,Eliminare un ostacolo o un incaricato
RIMUOVERE,Togliere dalla posizione occupata
RINALDO,Paladino di Carlo Magno
RINASCERE,Tornare a vivere o prosperare
RINASCITA,Nuovo periodo di vita o sviluppo
RINASCITA,Ripresa dopo una crisi
RINCHIUSO,Chiuso dentro senza libertà di uscire
RINCHIUSO,Tenuto in uno spazio dal quale non può uscire
RINCORRERE,Correre dietro per raggiungere
RINCORRERE,Inseguire chi fugge
RINCUORO,Restituisco il coraggio
RINFORZA,Rende più forte
RINFORZARE,Aggiungere sostegno o consistenza
RINFORZARE,Rendere più forte
RINFORZARE,Rendere più solido o resistente
RINFORZATO,Reso più forte
RINFORZO,Aiuto aggiuntivo che aumenta le forze
RINFORZO,Elemento che consolida una struttura
RINFORZO,Rendo più forte
RINFRANCO,Ridò coraggio
RINGHIERA,Il parapetto delle scale
RINGHIERA,Protegge scale e balconi
RINGHIERA,Protezione lungo scale e balconi
RINGHIOSO,Pronto a digrignare i denti
RINGRAZIA,Dice grazie
RINGRAZIAMENTO,Espressione di gratitudine
RINGRAZIARE,Dire grazie
RINGRAZIATO,Detto grazie
RINGRAZIO,Dico grazie
RINNEGARE,Disconoscere idee o legami precedenti
RINNEGARE,Ritrattare ciò che si era affermato
RINNOVAMENTO,Cambiamento che porta nuova vitalità
RINNOVI,Prolungamenti di contratti o abbonamenti
RINNOVI,Sostituzioni che rendono qualcosa più moderno
RINNOVO,Proroga o sostituzione alla scadenza
RINO,"Gattuso, il Ringhio del calcio"
RINO,Il Gaetano di Ma il cielo è sempre più blu
RINOCERONTE,Grande animale col corno sul naso
RINOCERONTE,Grande erbivoro con corno sul muso
RINOCERONTE,Grande mammifero col corno
RINOMATO,Celebre per qualità o prestigio
RINOMATO,Conosciuto e stimato da molti
RINSAVIRE,Tornare assennati
RINSECCHITO,Secco e indurito
RINTOCCO,Il singolo colpo di campana
RINTRACCIARE,Localizzare ciò che sembrava perduto
RINTRACCIARE,Trovare seguendo indizi o dati
RINUNCIARE,Abbandonare volontariamente un diritto o un progetto
RINUNCIARE,Cedere volontariamente a qualcosa
RINVIARE,Mandare nuovamente o rimandare indietro
RINVIARE,Spostare un impegno nel tempo
RINVIGORISCO,Restituisco vigore
RINVIO,Sospensione con nuova data
RINVIO,Spostamento a una data successiva
RIO,Corso d'acqua o città brasiliana abbreviata
RIO,La città del Cristo Redentore
RIO,"Malvagio, in poesia"
RIO,Piccolo corso d'acqua
RIODEJANEIRO,La città brasiliana del Carnevale
RIONE,Il quartiere storico della città
RIONE,Quartiere con identità propria
RIONE,Zona interna di una città
RIORDINARE,Disporre secondo un nuovo criterio
RIORDINARE,Rimettere ogni cosa al suo posto
RIORDINO,Nuova sistemazione di elementi o uffici
RIORDINO,Ripristino dell'ordine
