soluzione,definizione
RUBRICHE,Elenchi ordinati di nomi e contatti
RUBRICHE,Sezioni periodiche di giornali e programmi
RUCOLA,Insalata dal gusto piccante
RUDE,Ruvido nei modi
RUDOLF,Il nome del ballerino Nureyev
RUDOLPH,Il nome della renna dal naso rosso
RUGA,La piega che gli anni lasciano sulla pelle
RUGA,Segno del tempo sul volto
RUGA,Solco che il tempo lascia sulla pelle
RUGBY,Sport con palla ovale
RUGGERI,"Il cantante di Mistero, Enrico"
RUGGINE,Bruno rossastro dell'ossido di ferro
RUGGINE,Vecchia...: un rancore di lunga data
RUGGITO,Fa tremare la savana
RUGGITO,Richiamo profondo dei grandi felini
RUGGITO,Verso profondo di un grande felino
RUGHE,Linee sottili lasciate dall'età o dalle espressioni
RUGHE,Pieghe che compaiono sulla pelle con il tempo
RUGIADA,Gocce del mattino sull'erba
RUGIADE,Goccioline che si depositano al mattino
RUGIADE,Umidità notturne visibili su foglie e prati
RULLANO,Producono un suono lungo e vibrante
RULLANO,Scorrono o comprimono usando cilindri
RULLATA,Compressa o spianata con un cilindro
RULLATA,Seguita da un rapido susseguirsi di colpi di tamburo
RULLATE,Compresse o spianate con cilindri
RULLATE,Seguite da rapidi susseguirsi di colpi di tamburo
RULLATI,Avvolti o lavorati facendoli scorrere
RULLATI,Compressi o spianati con cilindri
RULLI,Cilindri che fanno scorrere o comprimono materiali
RULLI,"Supporti avvolgibili per carta, pellicola o tessuti"
RULLO,Cilindro che comprime o fa rumore
RULLO,Cilindro che schiaccia o dipinge
RULLO,Quello di tamburi prima dell'annuncio
RUM,Caraibico nel bicchiere
RUM,Il distillato del mojito e del daiquiri
RUMBA,Ballo latino-americano cubano
RUMENA,Appartenente a un popolo dell'Europa orientale
RUMENA,Originaria dello Stato con capitale Bucarest
RUMENE,Appartenenti a un popolo dell'Europa orientale
RUMENE,Originarie dello Stato con capitale Bucarest
RUMENI,Appartenenti a un popolo dell'Europa orientale
RUMENI,Originari dello Stato con capitale Bucarest
RUMENO,Relativo alla Romania
RUMORE,"Molto...per nulla, commedia di Shakespeare"
RUMORE,Suono non desiderato
RUMORE,Suono senza discrezione
RUMORI,Suoni sgradevoli o confusi
RUMORI,Voci non confermate che circolano tra la gente
RUMOROSO,Che produce suoni forti e molesti
RUNA,Lettera nordica da magia antica
RUNE,Segni degli antichi alfabeti germanici
RUNE,Simboli incisi su pietre e oggetti nordici
RUNNER,Blade...: il film con i replicanti
RUNNER,Striscia decorativa per la tavola
RUOLI,Funzioni assegnate in un gruppo o in uno spettacolo
RUOLI,Registri ufficiali contenenti nomi e posizioni
RUOLO,Funzione svolta in un gruppo o in una vicenda
RUOLO,La parte recitata dall'attore
RUOLO,Parte assegnata a teatro e nella vita
RUOTA,Gira sotto il veicolo
RUOTA,La...di scorta dell'auto
RUOTA,Quella della fortuna che gira
RUOTAI,Girai su un asse
RUOTATO,Girato su un asse
RUOTE,Organi circolari che permettono il movimento dei veicoli
RUOTE,Turni di servizio svolti a rotazione
RUOTO,Giro su un asse
RUPE,Parete rocciosa ripida
RUPE,Roccia alta e scoscesa
RUPE,Salto roccioso molto ripido
RUPERT,Il nome del magnate dei media Murdoch
RUPI,Pareti rocciose alte e scoscese
RUPI,Scarpate verticali che dominano valli e coste
RUPIA,La valuta dell'India
RUPPE,Mandò in frantumi
RURALE,Che riguarda la campagna
RURALE,Legato alla vita dei campi
RURALI,Lontani dai grandi centri urbani
RURALI,Relativi alla campagna
RUSCELLO,Acqua piccola ma in cammino
RUSCELLO,Piccolo corso d'acqua
RUSCELLO,Piccolo corso d'acqua che canta tra i sassi
RUSCELLO,Piccolo torrente
RUSHDIE,Lo scrittore dei Versi satanici
RUSPA,Macchina che spiana e sposta
RUSPA,Macchina che spiana il terreno
RUSPE,Macchine cingolate che spostano terra e macerie
RUSPE,Mezzi da cantiere con grande lama anteriore
RUSSA,Appartenente al più vasto paese del mondo
RUSSA,Originaria dello Stato con capitale Mosca
RUSSE,Appartenenti al più vasto paese del mondo
RUSSE,Originarie dello Stato con capitale Mosca
RUSSELL,Il nome dell'attore Crowe
RUSSI,Appartenenti al più vasto paese del mondo
RUSSI,Originari dello Stato con capitale Mosca
RUSSO,Emetto rumore nel sonno
RUSSO,Originario del Paese di Mosca
RUSTICA,Semplice e poco raffinata
RUSTICA,Tipica della campagna
RUSTICHE,Semplici e poco raffinate
RUSTICHE,Tipiche della campagna
RUSTICI,Edifici accessori usati per attività agricole
RUSTICI,Semplici e poco raffinati
RUSTICO,Semplice e non rifinito
RUT,La moabita fedele alla suocera
RUT,Un libro dell'Antico Testamento
RUTH,"Babe..., leggenda del baseball"
RUTH,Il nome della giudice americana Bader Ginsburg
RUTHERFORD,Il fisico del nucleo atomico
RUTILANTE,Splendente con eccesso quasi rosso
RUTTO,L'eruttazione rumorosa
RUVIDA,Aspra al tatto
RUVIDE,Aspre al tatto
RUVIDI,Aspri al tatto
RUVIDO,Aspro al tatto
RUVIDO,Brusco e sgarbato nei modi
