soluzione,definizione
SA,Lui conosce la risposta
SA,Sigla automobilistica di Salerno
SABA,Autore di versi del Canzoniere triestino
SABA,La regina che andò da Salomone
SABA,Poeta del Canzoniere triestino
SABATO,Quello del villaggio cantato da Leopardi
SABBIA,Granelli che riempiono spiagge e clessidre
SABBIA,Granelli della spiaggia
SABBIA,Può contenere silicio
SABBIE,Le... mobili che inghiottono
SABINI,Popolo italico delle origini di Roma
SABOTAI,Passato remoto: Danneggiare di nascosto
SABOTARE,Può rientrare nell’idea di minare
SABOTARE,Una particolare maniera di boicottare
SABRINA,"...vita da strega, la serie tv"
SABRINA,Il nome dell'attrice Ferilli
SACALINA,Isola russa a nord del Giappone
SACCA,Rientra nel campo di acqua
SACCA,Una variante di acqua
SACCENTE,Presuntuoso nel sapere
SACCENTE,Completa la frase: «non sopporto chi parla in tono …»
SACCENTI,Presuntuosi nel sapere
SACCHETTO,Piccola borsa di carta o plastica
SACCHI,"Il tecnico del grande Milan, Arrigo"
SACCHI,Si riempiono e si legano
SACCO,Contenitore di tela o carta
SACCO,"Contiene farina, lettere o sonno"
SACCO,Il saccheggio: il... di Roma
SACCO,Una gran quantità: un... di soldi
SACELLO,Piccolo recinto sacro
SACERDOTALE,Può assumere la sfumatura di episcopale
SACERDOTALE,Può assumere la sfumatura di vescovile
SACERDOTE,Una manifestazione di ecclesiastico
SACHER,La torta al cioccolato viennese
SACRAMENTO,Il rito sacro come il battesimo o la cresima
SACRAMENTO,La capitale della California
SACRARIO,Luogo della memoria solenne
SACRESTIA,Il locale della chiesa per gli arredi sacri
SACRESTIA,Stanza accanto all'altare
SACRESTIA,Stanza della chiesa per paramenti e preparativi
SACRESTIA,Locale dove il sacerdote indossa i paramenti
SACRO,Con un significato vicino a santo
SACRO,"Religioso, secondo il contesto"
SAETTA,"...McQueen, l'auto rossa di Cars"
SAETTA,Fulmine o freccia veloce
SAETTA,Lampo improvviso nel cielo o nella corsa
SAETTA,Veloce come una...: rapidissimo
SAETTONE,Serpente innocuo lungo e veloce
SAFFO,La poetessa di Lesbo
SAGA,Il ciclo di film come Star Wars
SAGA,Racconto lungo di stirpi e destini
SAGACE,Capisce prima di farsi spiegare
SAGACI,Acuti nel capire
SAGAN,Il Carl divulgatore del cosmo
SAGAN,"Peter..., velocista del ciclismo"
SAGGE,Prudenti e sapienti
SAGGEZZA,Fa parlare poco e scegliere meglio
SAGGEZZA,Appartiene alla categoria di tratto
SAGGI,Prudenti e sapienti
SAGGIA,Prudente e sapiente
SAGGIO,Scritto argomentativo o persona prudente
SAGGIO,Un tipo particolare di mente
SAGGIO,Un caso particolare di mente
SAGITTA,"La Freccia, piccola costellazione boreale"
SAGITTARIO,Costellazione e segno dell'arciere
SAGOMA,Che...!: che tipo simpatico e originale
SAGOMA,Contorno riconoscibile senza dettagli
SAGOMA,Completa la frase: «quel ragazzo è una …»
SAGRA,Festa di paese con profumo di cucina
SAGRA,Un caso particolare di festività
SAGRA,Una manifestazione di festività
SAGRATO,Spazio davanti alla chiesa
SAGRATO,Nel lessico si avvicina a cimitero
SAGRESTANO,Si occupa della chiesa e degli arredi sacri
SAGRO,Lancio improperi
SAHARA,Deserto di dune e pietra del Nord Africa
SAHARA,Il grande deserto africano
SAIGON,Antico nome di Ho Chi Minh City
SAILORMOON,La guerriera anime in nome della Luna
SAIO,Veste ruvida da frate
SAKE,Il vino di riso giapponese
SALA,"Ambiente ampio, da cinema o palazzo"
SALA,La stanza ampia per ricevere
SALA,Una stanza dove le persone possono sedersi e parlare
SALACE,Arguto e pungente
SALACI,Arguti e pungenti
SALACITA,Arguzia che scivola nel piccante
SALADINO,Il sultano che riconquistò Gerusalemme
SALAH,"Mohamed, attaccante egiziano detto il Faraone"
SALAI,Passato remoto: Mettere sale
SALAMANDRA,Anfibio legato per mito al fuoco
SALAMANDRA,Anfibio maculato amico dei boschi umidi
SALAME,Insaccato e ingenuo in gergo
SALAME,"Lo sciocco, il citrullo"
SALAME,"Sciocco, in un’accezione meno immediata"
SALARIO,In certi usi corrisponde a paga
SALARIO,Può rimandare all’idea di stipendio
SALASSO,"Prelievo di sangue, anche economico"
SALATO,Participio: Mettere sale
SALATO,Detto di ciò che richiama l’idea di caro
SALATO,Con un significato vicino a costoso
SALDA,Stabile e robusta
SALDAI,Passato remoto: Unire con metallo fuso
SALDAMENTE,Con una sfumatura che richiama fermamente
SALDARE,Azione riconducibile al significato di liquidare
SALDARE,Può essere una maniera di liquidare
SALDATO,Participio: Unire con metallo fuso
SALDATORE,Unisce i metalli con il calore
SALDATURA,Un esempio riconducibile a articolazione
SALDE,Stabili e robuste
SALDI,Stabili e robusti
SALDO,"Fermo e solido, ben piantato"
SALDO,Lo sconto di fine stagione
SALDO,Pagamento finale o sconto stagionale
SALDO,Un caso particolare di circostanza
SALE,Il senno: avere... in zucca
SALE,Insaporisce e conserva
SALE,"Lui ascende, va verso l'alto"
SALE,Quello in zucca è il buon senso
SALICE,Albero dai rami pendenti
SALICE,Albero dai rami penduli sulle rive
SALICE,L'albero piangente chino sul fiume
SALICORNIA,Pianta carnosa delle saline
SALIERA,Recipiente per il sale da tavola
SALINA,Isola delle Eolie a due monti
SALINA,Isola eoliana e vasca dove nasce il sale
SALINA,La vasca dove evapora l'acqua per il sale
SALINGER,Autore del Giovane Holden
SALINGER,Scrittore del Giovane Holden
SALIRE,"...al potere, arrampicarsi in alto"
SALIRE,Un modo particolare di svilupparsi
SALIRE,Rientra tra i modi di svilupparsi
SALISCENDI,Asta che blocca porte e finestre
SALISCENDI,Il chiavistello che si alza e abbassa
SALISCENDI,Il continuo alternarsi di alti e bassi
SALITA,La strada in ripida ascesa
SALITA,Un caso particolare di spostamento
SALITA,Un esempio riconducibile a ascesa
SALIVA,Quella che fa venire l'acquolina
SALIVA,Un caso particolare di secrezione
SALLY,Il nome della prima astronauta americana Ride
SALMA,Corpo da cui la vita è assente
SALMA,Il corpo del defunto
SALMA,Rientra nel campo di cadavere
SALMASTRO,Lo è il sapore del mare
SALMASTRO,Sa di mare e di vento sulle labbra
SALMERINO,Pesce d'acqua fredda da torrente
SALMO,Canto biblico numerato
SALMO,Il rapper di 90min
SALMONE,Pesce rosato che risale i fiumi
SALMONE,Rosa tendente all'arancio
SALMONI,Risalendo i fiumi sfidano la corrente
SALO,Cittadina sul lago di Garda
SALO,Metto sale
SALOME,Chiese la testa del Battista
SALOMONE,Il re famoso per la sua saggezza
SALOMONE,Le Isole...nel Pacifico
SALONE,Quello di bellezza del parrucchiere
SALONE,"Sala grande, spesso da esposizione"
SALONICCO,Grande città greca della Macedonia
SALOTTO,Stanza di conversazione e televisore
SALOTTO,Stanza di divani e conversazioni
SALOTTO,Stanza per ricevere ospiti
SALOTTO,Una stanza dove le persone possono sedersi e parlare
SALPA,Parte dal porto
SALPARE,Partire dal porto
SALPATO,Partito dal porto
SALPO,Parto dal porto
SALSA,Condimento e ritmo latino
SALSA,Il ritmo latino da ballare
SALSA,In certi usi corrisponde a sugo
SALSEDINE,Sale che resta sulla pelle dopo il mare
SALSICCIA,Insaccato da griglia o padella
SALSIERA,Recipiente da tavola per le salse
SALTA,Si stacca da terra
SALTAI,Mi staccai da terra
SALTARE,Staccarsi da terra
SALTARE,Un modo non sempre letterale di esplodere
SALTARE,Una particolare maniera di scoppiare
SALTARELLO,Antica danza saltellata italiana
SALTATO,Staccato da terra
SALTERIO,Strumento antico e libro biblico
SALTIMBANCO,Acrobata da fiera e da piazza
SALTIMBOCCA,Fettina con prosciutto e salvia
SALTO,Interruzione o balzo
SALTO,Quello in alto con l'asticella
SALTO,Una forma specifica di transizione
SALUBRE,Che giova alla salute
SALUMIERE,Vende salumi e formaggi
SALUTA,Dà il segno dell'incontro o dell'addio
SALUTAI,Diedi il segno dell'incontro o dell'addio
SALUTARE,Dare il segno dell'incontro o dell'addio
SALUTARE,Rientra tra i modi di avvicinare
SALUTARE,Detto di ciò che richiama l’idea di vantaggioso
SALUTATO,Dato il segno dell'incontro o dell'addio
SALUTE,"Il benessere del corpo, da conservare"
SALUTE,L'augurio rivolto a chi starnutisce
SALUTE,Un esempio riconducibile a benessere
SALUTO,Gesto che apre o chiude un incontro
SALUTO,Il gesto militare con la mano alla fronte
SALUTO,Una nozione collegata a augurio
SALVA,La...di cannone sparata a salve
SALVA,Sana e...: incolume
SALVA,Sottrae al pericolo
SALVA,Una variante di fuoco
SALVADANAI,Custodiscono monete con una fessura
SALVADANAIO,Custodisce monete risparmiate
SALVADANAIO,Inghiotte monete per un desiderio futuro
SALVADOR,Storica città del Brasile
SALVAGENTE,Aiuta a restare a galla
SALVAGENTE,Anello che aiuta a galleggiare
SALVAGENTE,Tiene a galla chi non nuota
SALVAGENTE,In certi usi corrisponde a isola
SALVAGUARDIA,Rientra nel campo di protezione
SALVAI,Sottrassi al pericolo
SALVARE,Sottrarre al pericolo
SALVATO,Sottratto al pericolo
SALVIA,Erba aromatica e officinale
SALVIA,L'erba aromatica del burro e...
SALVIETTA,Panno da tavola o da bagno
SALVO,Sottraggo al pericolo
SALVO,"Tranne, eccetto"
SAM,Il nome dello zio simbolo degli Stati Uniti
SAM,L'hobbit amico di Frodo
SAMARCANDA,Città uzbeka sulla Via della seta
SAMARIA,Antica regione e città della Palestina
SAMBA,Ritmo brasiliano da carnevale
SAMBUCO,Arbusto da fiori per sciroppi
SAMI,Popolo della Lapponia
SAMO,Isola greca di Pitagora
SAMOA,Arcipelago polinesiano
SAMOIEDO,Il cane bianco siberiano dal sorriso
SAMOSA,Fagottino fritto indiano speziato
SAMOVAR,Recipiente russo per il tè
SAMPAN,Barca asiatica di fiumi e porti
SAMPAN,Piccola imbarcazione asiatica
SAMUEL,Il nome dell'attore Jackson
SAMUEL,Il profeta biblico che unse Davide
SAMUELE,Il profeta che unse i primi re
SAMURAI,Il guerriero al servizio del signore feudale giapponese
SAN,"...Bernardo, il cane da soccorso alpino"
SAN,Titolo davanti a molti nomi sacri
SANA,La capitale dello Yemen
SANA,In buona salute
SANAA,Capitale yemenita storica
SANAI,Passato remoto: Rendere sano
SANARE,Comporta necessariamente il fatto di assistere
SANARE,Presuppone anche di assistere
SANATO,"Guarito, o rimesso in sesto come un conto"
SANCIO,Scudiero più terra terra del suo padrone
SANDALO,Scarpa aperta estiva
SANDALO,Scarpa aperta o legno profumato
SANDRA,"...Mondaini, di Casa Vianello"
SANDRA,Il nome dell'attrice Bullock
SANDRELLI,La Stefania di Divorzio all'italiana
SANDWICH,Due fette e qualcosa in mezzo
SANDWICH,Panino imbottito all'inglese
SANDY,Il nome della protagonista di Grease
SANE,In buona salute
SANFRANCISCO,La città del Golden Gate
SANGALLO,Famiglia di architetti rinascimentali
SANGIOVANNI,Il cantante emerso dal talent «Amici»
SANGIOVESE,Il vitigno del Chianti
SANGUE,Buon...non mente
SANGUE,Liquido rosso nelle vene
SANGUE,"Non è acqua, nel proverbio"
SANGUIGNA,Matita rossa da disegno
SANI,In buona salute
SANITA,Una variante di benessere
SANITARIO,Una persona abilitata all’esercizio della professione medica
SANITARIO,In certi usi corrisponde a dottore
SANJOSE,"Capitale costaricana, ma anche città californiana"
SANMARTIN,Liberatore dell'Argentina e del Cile
SANNITI,Popolo italico avversario di Roma
SANO,Integro nel corpo o nel giudizio
SANPIETROBURGO,Città russa degli zar sulla Neva
SANSA,Il residuo della spremitura delle olive
SANSCRITO,Antica lingua sacra dell'India
SANSIRO,Lo stadio di Milan e Inter
SANSONE,Forte come...: fortissimo
SANSONE,Perse la forza con i capelli
SANSOVINO,Architetto della libreria di Venezia
SANTA,Il nome del Claus che porta i doni
SANTA,Quella proclamata dalla Chiesa
SANTANA,"Il chitarrista messicano di Oye como va, Carlos"
SANTIAGO,Capitale cilena ai piedi delle Ande
SANTO,Può assumere la sfumatura di benedetto
SANTO,Detto di ciò che richiama l’idea di sacro
SANTOLINA,Arbusto argenteo aromatico
SANTONE,"Guida spirituale, talvolta sospetta"
SANTOREGGIA,Erba aromatica dal nome devozionale
SANTORINI,Isola greca bianca sopra una caldera
SANTORINI,Isola greca dalle case bianche sulla caldera
SANTOS,Il club brasiliano dove giocò Pelé
SANTUARIO,Il luogo sacro meta di pellegrinaggi
SANZIONARE,Un modo particolare di autorizzare
SANZIONARE,Una forma specifica dell’autorizzare
SAPERE,Non...che pesci pigliare
SAPERE,Avere la capacità
SAPERE,Completa la frase: «il … rende l’uomo libero»
SAPIENTE,Ricco di sapere
SAPIENTE,Può assumere la sfumatura di dotto
SAPIENTE,"Erudito, secondo il contesto"
SAPIENTI,Ricchi di sapere
SAPIENZA,La...: l'università di Roma
SAPIENZA,Sapere con peso morale
SAPIENZA,Una manifestazione di tratto
SAPONE,La bolla di...che vola e scoppia
SAPONE,Lava facendo schiuma
SAPORE,"...di sale, la canzone di Gino Paoli"
SAPORE,Giudizio della lingua e della memoria
SAPORE,"Gusto, in un’accezione meno immediata"
SAPPORO,Città dell'isola di Hokkaido
SARABANDA,Lenta danza barocca
SARACENO,Arabo medievale nelle cronache cristiane
SARACENO,Un caso particolare di persona religiosa
SARACINESCA,Serranda avvolgibile
SARAGAT,Il Giuseppe presidente socialista
SARAGO,Pesce di scoglio striato
SARAH,Il nome dell'attrice francese Bernhardt
SARAJEVO,Capitale bosniaca dal nome storico
SARAMAGO,Scrittore portoghese premio Nobel
SARASVATI,La dea indù del sapere
SARCASMO,Appartiene alla categoria di intelligenza
SARCASMO,Una variante di intelligenza
SARCASTICO,Detto di ciò che richiama l’idea di velenoso
SARCHIAPONE,Creatura immaginaria resa famosa da una gag
SARCHIO,L'attrezzo per smuovere il terreno fra le piante
SARCOFAGO,Cassa di pietra per sepolture antiche
SARCOFAGO,Pietra che custodisce il corpo
SARCOFAGO,Una manifestazione di cassa da morto
SARDEGNA,Grande isola italiana dal mare smeraldo
SARDEGNA,Isola dei nuraghi e del maestrale
SARDI,Antica capitale della Lidia
SARDINA,Pesce piccolo e argenteo in scatola o in mare
SARDINA,Piccolo pesce azzurro
SARDINA,Piccolo pesce da scatola e banco
SARDINE,Nuotano in branchi fittissimi
SARDINE,Stretti come...: pigiati
SARDONICO,Riso amaro e quasi crudele
SARGASSO,Mare famoso per alghe galleggianti
SARI,Abito femminile indiano
SARMATI,Antico popolo nomade delle steppe
SARMENTO,Ramo lungo della vite
SARONNO,Città lombarda nota per gli amaretti
SARTA,Cuce gli abiti su misura
SARTIAME,L'insieme delle funi di sostegno degli alberi
SARTO,Costruisce abiti su corpi reali
SARTO,Cuce abiti su misura
SARTO,Mette le misure addosso alla stoffa
SARTORIA,Officina elegante di aghi e stoffe
SARTORIA,Un caso particolare di professione
SARTRE,Filosofo e scrittore della Nausea
SARUMAN,Lo stregone bianco traditore del Signore degli Anelli
SASHIMI,Pesce crudo giapponese a fette
SASQUATCH,Il bigfoot delle foreste americane
SASSARI,Città sarda del nord dell'isola
SASSO,Piccola pietra
SASSO,Restare di...: ammutolire dallo stupore
SASSO,Un tipo particolare di oggetto naturale
SASSOFONO,Strumento a fiato del jazz
SASSOFONO,Strumento jazz dal corpo dorato
SASSOFONO,Nel lessico si avvicina a sax
SASSONI,Popolo germanico stanziato in Britannia
SATIRA,La pungente presa in giro dei potenti
SATIRA,Una manifestazione di intelligenza
SATIRA,Un esempio riconducibile a intelligenza
SATIRESCO,"Da satiro, quindi lascivo o beffardo"
SATIRO,Creatura boschiva metà uomo e metà capra
SATIRO,Figura boschiva con corna e zoccoli
SATIRO,L'uomo morboso e lascivo
SATRAPO,Governatore persiano o despota locale
SATURNO,Dio antico del tempo e dei raccolti
SATURNO,Il dio romano del tempo
SATURNO,Il pianeta dei grandi anelli
SAUL,"Better Call..., spin-off di Breaking Bad"
SAUL,Il primo re d'Israele
SAUNA,Caldo secco preso per benessere
SAURON,L'oscuro signore di Mordor
SAUVIGNON,Il vitigno bianco aromatico
SAVANA,"Erba alta, acacie e grandi animali africani"
SAVANA,La distesa erbosa dei leoni africani
SAVANA,Prateria tropicale con alberi sparsi
SAVERIO,Il gesuita missionario in Oriente
SAVIANO,"L'autore di Gomorra, Roberto"
SAVIO,Un tipo particolare di mente
SAVIO,Qualità che si avvicina a accorto
SAVOIARDO,Biscotto del tiramisù
SAVOIRFAIRE,L'abilità nel comportarsi a modo
SAVONA,Città ligure della torretta sul porto
SAZIO,"Pieno, che ha mangiato a sufficienza"
SB,Il metallo dal nome latino stibium
SB,Simbolo chimico dell'antimonio
SBADIGLIO,L'atto di chi ha sonno o noia
SBAGLIA,Prende la via errata
SBAGLIAI,Presi la via errata
SBAGLIARE,Prendere la via errata
SBAGLIARE,Può essere una maniera di fallire
SBAGLIARE,Un modo particolare di abortire
SBAGLIATO,Preso la via errata
SBAGLIATO,"Errato, secondo il contesto"
SBAGLIATO,Può assumere la sfumatura di scorretto
SBAGLIO,Prendo la via errata
SBAGLIO,Nel lessico si avvicina a colpa
SBAGLIO,Può rimandare all’idea di errore
SBALLO,Una variante di allucinazione
SBALORDIMENTO,La meraviglia che lascia di stucco
SBALORDISCO,Lascio a bocca aperta
SBALZO,Tecnica che fa emergere il metallo
SBALZO,Un tipo particolare di riflesso
SBALZO,Un esempio riconducibile a riflesso
SBARCAI,Passato remoto: Scendere da nave o aereo
SBARCARE,Rientra tra i modi di uscire
SBARCO,Quello in Normandia del D-Day
SBARRA,"L'asta che blocca il passaggio, o quella della prigione"
SBARRA,Un caso particolare di leva
SBARRAMENTO,Una variante di impedimento
SBARRAMENTO,"Diga, in un’accezione meno immediata"
SBATTERE,Azione vicina al significato di lavorare
SBATTERE,Si avvicina all’azione di scopare
SBATTITORE,Elettrodomestico per montare
SBATTUTO,"Abbattuto, secondo il contesto"
SBATTUTO,Con un significato vicino a depresso
SBERLA,Lo schiaffo dato a mano aperta
SBERLA,Una nozione collegata a schiaffo
SBERLA,Una nozione collegata a pacca
SBIADITA,Poco vivace nel colore
SBIADITE,Poco vivaci nel colore
SBIADITI,Poco vivaci nel colore
SBIADITO,Poco vivace nel colore
SBIECO,Il taglio in diagonale della stoffa
SBIGOTTIMENTO,Lo stupore misto a sgomento
SBOCCO,"Punto in cui un fiume si immette in mare, in un lago o in un altro fiume"
SBOCCO,In certi usi corrisponde a foce
SBOLLIRE,Calmarsi dopo l'ira
SBORDAI,Passato remoto: Uscire oltre il bordo
SBORRA,Può rimandare all’idea di seme
SBORRA,Nel lessico si avvicina a sperma
SBOZZO,Sgrosso la prima forma
SBRAITO,Grido in modo concitato
SBRANAI,Passato remoto: Fare a pezzi con violenza
SBRINDELLATO,Ridotto a brandelli
SBUFFO,Soffio per l'impazienza
SC,Iniziali dell'attore Connery
SC,Simbolo chimico dello scandio
SCABRA,Ruvida o difficile
SCABRE,Ruvide o difficili
SCABRI,Ruvidi o difficili
SCABRO,Ruvido al tatto o allo stile
SCABROSA,Difficile e delicata
SCABROSE,Difficili e delicate
SCABROSI,Difficili e delicati
SCABROSO,Difficile e delicato
SCACCHI,"Gioco con re, regine e alfieri"
SCACCHIERA,Ha caselle bianche e nere per re e regine
SCACCIARE,Una forma specifica del muoversi
SCACCIARE,Può essere una maniera di muoversi
SCACCO,...matto: la fine della partita a scacchi
SCACCO,Minaccia al re sulla tavola a quadretti
SCACCO,Mossa contro il re
SCACCO,Una scacchiera ha sessantaquattro caselle
SCACCOMATTO,La mossa che chiude la partita a scacchi
SCADENZA,Un caso particolare di punto
SCADENZA,Si può classificare come data
SCAFANDRO,La tuta dell'astronauta
SCAFANDRO,Tuta del palombaro
SCAFATO,Smaliziato dall'esperienza
SCAFFALE,Il ripiano della libreria
SCAFFALE,"Tiene libri, scatole e polvere in ordine"
SCAFFALE,Appartiene alla categoria di supporto
SCAFO,Il corpo di un'imbarcazione
SCAGLIA,Una forma specifica di frammento
SCAGLIA,Una variante di pezzettino
SCALA,Il celebre teatro lirico di Milano
SCALA,La sequenza di carte dello stesso seme
SCALA,Serie di gradini o note
SCALA,Una nozione collegata a ampiezza
SCALAMOBILE,Le scale che salgono da sole
SCALARE,Salire una parete o una classifica
SCALARE,Una forma specifica del calcolare
SCALARE,Rientra tra i modi di calcolare
SCALATA,Fa salire pareti e classifiche
SCALATA,Una manifestazione di ascesa
SCALATA,Si può classificare come salita
SCALATO,Salito una parete o una classifica
SCALDA,Rende più caldo
SCALDABAGNO,Riscalda l'acqua di casa
SCALDAI,Resi più caldo
SCALDAPANE,Tosta fette a colazione
SCALDARE,Rendere più caldo
SCALDATO,Reso più caldo
SCALDAVIVANDE,Apparecchio per tenere caldo il cibo
SCALDO,Rendo più caldo
SCALENO,Triangolo senza lati uguali
SCALETTA,Un caso particolare di progetto
SCALETTA,Un esempio riconducibile a progetto
SCALFARO,L'Oscar Luigi presidente piemontese
SCALFITTURA,Il graffio superficiale
SCALINO,Gradino singolo
SCALINO,Invita a salire un passo alla volta
SCALINO,Un gradino quando si fa quotidiano
SCALINO,Comprende anche alzata
SCALMO,Sostegno del remo sulla barca
SCALO,Fermata di viaggio o porto secondario
SCALO,La sosta intermedia del volo
SCALO,Ha tra le sue parti pontile
SCALOGNO,Bulbo aromatico più gentile della cipolla
SCALOPPINA,Fetta di carne sottile in padella
SCALOPPINA,Fettina al limone o al vino
SCALPELLINO,Lavora la pietra con lo scalpello
SCALPELLO,Attrezzo dello scultore
SCALPELLO,Toglie schegge alla pietra dello scultore
SCALPELLO,Utensile tagliente usato da scultori e muratori
SCALTRA,Astuta e pratica
SCALTRE,Astute e pratiche
SCALTRI,Astuti e pratici
SCALTRO,Astuto e pratico
SCAMACCA,"Gianluca, attaccante azzurro dell'Atalanta"
SCAMARCIO,Il Riccardo attore pugliese
SCAMBIA,Dà in cambio
SCAMBIARE,Dare in cambio
SCAMBIARE,Una forma specifica dell’interpretare
SCAMBIATO,Dato in cambio
SCAMBIO,Do in cambio
SCAMBIO,Un tipo particolare di atto collettivo
SCAMORZA,Formaggio filante spesso affumicato
SCAMPAGNATA,Gita all'aperto con pani e prati
SCAMPAGNATA,Gita in campagna con merenda
SCAMPANIO,Il suono festoso delle campane
SCAMPO,Crostaceo dalle chele sottili
SCAMPO,Crostaceo pregiato dal sapore delicato
SCAMPO,Non c'è...: non c'è via d'uscita
SCAMPO,Nel lessico si avvicina a gambero
SCAMPOLO,Resto di stoffa o di occasione
SCANALATURA,Solco verticale della colonna
SCANDALO,Rumore morale e pubblico
SCANDINAVIA,Regione del nord Europa
SCANSAFATICHE,Chi sfugge ogni lavoro
SCANTINATO,Il piano sotto il livello stradale
SCANTINATO,Un tipo particolare di piano
SCANTINATO,Si può classificare come piano
SCAPITO,Si può classificare come avaria
SCAPITO,Danno o svantaggio
SCAPOLA,Osso piatto della spalla
SCAPOLO,Rientra nel campo di uomo
SCAPOLO,Con un significato vicino a nubile
SCAPPA,Fugge
SCAPPARE,Fuggire
SCAPPARE,Un modo particolare di partire
SCAPPATO,Fuggito
SCAPPO,Fuggo
SCAR,"La cicatrice, in inglese"
SCAR,Lo zio cattivo del Re Leone
SCARABEO,Il gioco delle parole sul tabellone
SCARABEO,Insetto sacro agli Egizi
SCARAMANZIA,Difesa irrazionale dalla sfortuna
SCARICA,Toglie un carico
SCARICA,Appartiene alla categoria di fuoco
SCARICA,Una manifestazione di monte
SCARICARE,Togliere un carico
SCARICARE,"Lasciare qualcuno all’improvviso, in gergo"
SCARICATO,Tolto un carico
SCARICHERA,Toglierà un carico
SCARICO,"Vuoto, stanco o tubo d'uscita"
SCARICO,Si può classificare come condotto
SCARICO,Una forma specifica di appezzamento
SCARLATINA,Malattia infantile dal nome rosso
SCARLATTI,Il Domenico delle sonate per clavicembalo
SCARLATTO,Rosso vivo e teatrale
SCARNO,"Ridotto all'osso, essenziale"
SCARNO,Con un significato vicino a magro
SCARNO,Con un significato vicino a meschino
SCAROLA,Insalata riccia da zuppe e pizze ripiene
SCAROLA,Varietà di insalata dalle foglie larghe
SCARPA,Calza a chi se la sente dire
SCARPA,"Calzata, sta sotto al piede"
SCARPA,Protegge il piede
SCARPATA,Pendio ripido ai lati di strade o binari
SCARPATA,Si può classificare come roccia
SCARPATA,Una manifestazione di roccia
SCARPE,Fare le... a qualcuno: tradirlo
SCARPE,Portano i piedi per strada
SCARPIERA,Mobile per riporre le scarpe
SCARPONE,Calzatura che non teme sentieri
SCARSA,Insufficiente
SCARSAFATICA,Evita il lavoro con arte pigra
SCARSE,Insufficienti
SCARSI,Insufficienti
SCARSITA,Rientra nel campo di bisogno
SCARSITA,Un esempio riconducibile a bisogno
SCARSO,Insufficiente
SCARSO,Può assumere la sfumatura di magro
SCARSO,Detto di ciò che richiama l’idea di meschino
SCARTA,Mette da parte
SCARTAMENTO,La distanza tra i due binari
SCARTARE,Mettere da parte
SCARTARE,Azione vicina al significato di respingere
SCARTATO,Messo da parte
SCARTO,Lo...di vincita: il margine sul secondo
SCARTO,Metto da parte
SCATENARE,Talvolta causa il fatto di muoversi
SCATENARE,Può avere come effetto succedere
SCATOLA,Contenitore che promette sorpresa
SCATOLA,Contenitore di cartone
SCATOLA,Può includere coperchio tra i suoi elementi
SCATOLE,Rompere le...: dare fastidio
SCATTA,Parte di colpo o fa una foto
SCATTAI,Partii di colpo o feci una foto
SCATTARE,Partire di colpo o fare una foto
SCATTATO,Partito di colpo o fotografato
SCATTO,"Balzo, foto o aumento improvviso"
SCATTO,Quello d'ira improvviso
SCATTO,Una manifestazione di manifestazione
SCAVA,Toglie terra facendo vuoto
SCAVAI,Tolsi terra facendo vuoto
SCAVARE,Togliere terra facendo vuoto
SCAVATO,Tolto terra facendo vuoto
SCAVATORE,Mezzo che rimuove la terra
SCAVO,Tolgo terra facendo vuoto
SCEGLIERE,"Selezionare, in un uso particolare"
SCELSE,Operò una scelta
SCELTA,Di prima...: di qualità ottima
SCELTA,La decisione tra più possibilità
SCELTA,Un esempio riconducibile a selezione
SCELTO,Selezionato perché ritenuto fra i migliori
SCELTO,Di qualità superiore e selezionato con cura
SCEMA,"Lei cala, diminuisce a poco a poco"
SCEMAI,Passato remoto: Diminuire
SCEMATO,Participio: Diminuire
SCEMO,"Lo sciocco, lo stupido"
SCEMO,In certi usi corrisponde a stupido
SCEMO,Nel lessico si avvicina a idiota
SCEMPIO,La devastazione crudele
SCEMPIO,Un caso particolare di omicidio
SCEMPIO,Una manifestazione di omicidio
SCENA,Il palcoscenico
SCENA,La sceneggiata: fare una...
SCENA,Parte del teatro e della vita
SCENA,Ciò che appare davanti agli occhi
SCENARIO,In certi usi corrisponde a sfondo
SCENARIO,Può rimandare all’idea di fondale
SCENDERE,Può rappresentare un modo di spostarsi
