soluzione,definizione
VR,"La realtà virtuale, in sigla"
VR,Sigla automobilistica di Verona
VT,Sigla automobilistica di Viterbo
VT,Volt senza lettere interne
VULCANI,Possono restare dormienti per secoli
VULCANO,Dio romano del fuoco e delle fucine
VULCANO,"In senso figurato, persona piena di energia"
VULCANO,Rilievo da cui possono uscire lava e gas
VULGATA,Traduzione latina della Bibbia attribuita a san Girolamo
VULPECULA,Nome latino della costellazione della Volpetta
VUOI,Desideri ottenere o fare qualcosa
VUOI,Esprimi una volontà o una richiesta
VUOTA,Priva di contenuto
VUOTE,Prive di contenuto
VUOTI,Privi di contenuto
VUOTO,Assegno senza copertura
VUOTO,Privo di contenuto
VUOTO,Quello d’aria fa sobbalzare un aereo
VV,Iniziali del matematico Volterra
VV,Sigla automobilistica di Vibo Valentia
