soluzione,definizione
VA,...bene!: l'espressione d'assenso
VA,"Lui procede, cammina"
VA,Sigla automobilistica di Varese
VACANZA,Periodo libero dal lavoro o dalla scuola
VACCARO,Chi accudisce le vacche
VACCINO,Il preparato che stimola le difese immunitarie
VACILLO,Barcollo perdendo l'equilibrio
VACUA,Può esserlo una cosa priva di sostanza
VACUE,Possono esserlo cose prive di sostanza
VACUI,Possono esserlo oggetti privi di sostanza
VACUO,Vuoto anche di pensiero
VADER,"Il signore oscuro di Star Wars, Darth..."
VAGA,Gironzola senza meta
VAGA,Può esserlo una cosa imprecisa o leggiadra
VAGAI,Passato remoto: Andare senza meta
VAGATO,Participio: Andare senza meta
VAGHE,Possono esserlo cose imprecise o leggiadre
VAGHEZZA,Indeterminatezza o grazia antica
VAGHI,Possono esserlo oggetti imprecisi o leggiadri
VAGLIA,Esamina con cura
VAGLIAI,Passato remoto: Esaminare con cura
VAGLIO,Setaccio o esame accurato
VAGO,Il nervo...del sistema nervoso
VAGO,Impreciso o errante
VAGONE,La carrozza che il treno si tira dietro
VAGONE,Stanza mobile su rotaie
VAI,Invito a muoversi senza indugio
VAIO,La linea di computer della Sony
VAIO,Malattia scomparsa dai calendari vaccinali comuni
VAL,"Conta, in forma troncata"
VALANGA,Massa di neve che precipita
VALANGHE,Precipitano dai pendii innevati
VALCHIRIA,Guerriera mitica del Nord
VALCHIRIE,Le guerriere del Valhalla
VALCO,Passaggio fra monti
VALE,"Conta, costa"
VALE,Il saluto d'addio degli antichi Romani
VALENCIA,Città spagnola della paella
VALENTINO,Il Rossi delle due ruote
VALENTINO,Lo stilista della moda romana
VALENZA,La capacità di legame di un atomo
VALERIA,Il nome dell'attrice Golino
VALERIANA,Pianta associata al sonno
VALERIE,Il nome del brano portato al successo da Amy Winehouse
VALHALLA,Il paradiso dei guerrieri norreni
VALICO,Il passo che fa scavalcare i monti
VALICO,Passaggio tra montagne
VALIDA,Può esserlo una storia efficace o fondata
VALIDE,Possono esserlo storie efficaci o fondate
VALIDI,Possono esserlo dati efficaci o fondati
VALIDO,Può esserlo un dato efficace o fondato
VALIGIA,Contiene il necessario per viaggiare
VALIGIA,Contiene abiti in viaggio
VALIGIE,Seguono i viaggiatori
VALLE,La conca tra due catene di monti
VALLE,Territorio tra monti
VALLE,Si apre tra due monti
VALLETTA,L'assistente del presentatore in tv
VALLETTA,La capitale di Malta
VALORE,Il coraggio del soldato in battaglia
VALORE,"Il prezzo, ciò che una cosa vale"
VALORE,"Prezzo, coraggio o numero"
VALPARAISO,Porto del Cile
VALUTA,"Lei stima, soppesa il valore"
VALUTARE,Stimare il valore
VALUTATO,Stimato il valore
VALUTO,Stimo il valore
VALZER,Danza di coppia in tre quarti
VALZER,Ballo in tre tempi
VAMPA,"La fiammata ardente, o l'ondata di calore"
VAMPIRI,"Temono aglio, sole e paletti"
VAMPIRO,Non morto assetato di sangue
VAMPIRO,Mostro che teme la luce del sole
VAN,"...Gogh, il pittore dei girasoli"
VAN,"Mezzo chiuso, spesso da trasloco"
VANBASTEN,"Marco, cigno olandese bomber del Milan"
VANCOUVER,La città canadese sul Pacifico
VANDALI,Popolo germanico saccheggiatore
VANDALO,Devastatore e popolo germanico
VANDYCK,Ritrattista fiammingo delle corti
VANEGGIO,Dico cose senza senso
VANESI,Possono esserlo uomini pieni di vanità
VANESIA,Può esserlo una donna piena di vanità
VANESIE,Possono esserlo donne piene di vanità
VANESIO,Può esserlo un uomo pieno di vanità
VANGA,Attrezzo che entra nella terra
VANGA,L'attrezzo per dissodare l'orto
VANGA,Attrezzo per rivoltare la terra
VANGOGH,Il Vincent dei girasoli
VANI,Stanze o inutili
VANIGLIA,Aroma dolce da orchidea
VANO,"Inutile, senza esito"
VANO,Stanza o tentativo inutile
VANTO,Darsi il...: vantarsi
VANTO,"Il motivo d'orgoglio, il fiore all'occhiello"
VANUATU,Arcipelago melanesiano
VAPORE,Acqua diventata aria
VAPORE,La nave a...d'altri tempi
VAPORE,Acqua trasformata in gas
VAPORETTO,Il battello del trasporto pubblico veneziano
VARA,Mette in acqua una nave
VARAI,Passato remoto: Mettere in acqua una nave
VARANASI,Città sacra indiana sul Gange
VARANO,"Il grande sauro carnivoro, di Komodo il più grande"
VARATO,Participio: Mettere in acqua una nave
VARCO,Apertura che consente il passaggio
VARENNA,Borgo panoramico sul lago di Como
VARIAGHI,Vichinghi che fondarono la Rus'
VARIO,Non uguale a sé stesso
VARO,Il generale romano disfatto a Teutoburgo
VARO,Primo contatto della nave con l'acqua
VARSAVIA,Capitale della Polonia
VARSAVIA,Il Patto di...del blocco sovietico
VARUNA,Il dio indù delle acque
VASAIO,Artigiano che modella vasi al tornio
VASARI,Il Giorgio delle Vite degli artisti
VASCA,Recipiente grande per bagno o pesci
VASCELLO,Grande nave d'altri tempi
VASCHE,Si riempiono per il bagno
VASCO,"...de Gama, il navigatore portoghese"
VASCO,"Il rocker di Zocca, Blasco"
VASETTO,Piccolo recipiente di vetro
VASI,Recipienti o canali del corpo
VASO,"Il...di Pandora, l'origine di tutti i mali"
VASO,Quello sanguigno che porta il sangue
VASO,Sta sul davanzale o nel corpo
VASO,Contiene fiori o conserva ceneri
VASSOIO,Porta bicchieri senza bere
VASTA,Può esserlo una linea molto ampia
VASTE,Possono esserlo linee molto ampie
VASTI,Possono esserlo profili molto ampi
VASTO,Può esserlo un profilo molto ampio
VATE,Poeta con tono profetico
VATICANO,Lo Stato del Papa
VATICINIO,Profezia con tono solenne
VB,Iniziali del giurista Bachelet
VB,Sigla automobilistica del Verbano-Cusio-Ossola
VC,Iniziali del poeta Cardarelli
VC,Sigla automobilistica di Vercelli
VE,Pronome: ...lo avevo detto
VE,Sigla automobilistica di Venezia
VECCHIO,Il ponte di Firenze con le botteghe orafe
VECCHIO,Avanzato negli anni
VECCHIONI,"Il cantautore professore di Samarcanda, Roberto"
VEDETTA,Sorveglia da lontano
VEDETTA,Fa la guardia da un punto alto
VEDOVA,Donna dopo la perdita del marito
VEDOVA,"La...nera, il ragno velenoso"
VEEMENTE,Impulsivo e vigoroso
VEEMENTI,Impulsivo e acceso
VEGA,La stella più brillante della Lira
VEGA,"Vincent..., il sicario di Pulp Fiction"
VEGAS,La città americana del gioco d'azzardo nel deserto
VEGETA,Il principe dei saiyan in Dragon Ball
VEGLIA,Resta sveglio
VEGLIA,Il contrario del sonno
VEGLIAI,Passato remoto: Restare sveglio
VELA,Il telo che cattura il vento e spinge la barca
VELA,Lo sport che sfrutta il vento in barca
VELA,Prende il vento sulla barca
VELARIO,Grande tenda dei teatri o anfiteatri
VELAZQUEZ,Il Diego delle Meninas
VELE,Prendono il vento in mare
VELENO,Sostanza che nuoce già in piccole dosi
VELENO,Sputare...: dire cattiverie
VELENO,Sostanza che nuoce o uccide
VELIA,Nome antico e città della Magna Grecia
VELIERO,Nave che obbedisce al vento
VELLEITARI,Possono esserlo oggetti pieni di ambizioni vane
VELLEITARIA,Può esserlo una cosa piena di ambizioni vane
VELLEITARIE,Possono esserlo cose piene di ambizioni vane
VELLEITARIO,Può esserlo un oggetto pieno di ambizioni vane
VELLUTO,Stoffa che invita la mano
VELLUTO,Tessuto morbido al tatto
VELO,Copre senza nascondere del tutto
VELO,Quello che copre il volto della sposa
VELO,Un... di malinconia: un'ombra leggera
VELOCE,"Rapido, ma non sempre frettoloso"
VELOCIRAPTOR,Il piccolo e agile dinosauro predatore
VELOUTE,Vellutata salsa o crema
VENA,Il filone del minerale nella roccia
VENA,L'ispirazione: essere in... creativa
VENA,Strada del sangue e dell'ispirazione
VENA,Porta il sangue al cuore
VENATURA,Linea naturale in legno o marmo
VENDE,Cede per denaro
VENDEMMIA,La raccolta dell'uva
VENDEMMIATORE,Chi raccoglie l'uva
VENDERE,Cedere per denaro
VENDETTA,"Giustizia privata, spesso peggiore del torto"
VENDITTI,L'Antonello di Roma capoccia
VENDO,Cedo per denaro
VENERE,"Dea, pianeta e canone di bellezza"
VENERE,Il pianeta che brilla all'alba e al tramonto
VENETI,Antico popolo dell'Italia nord-orientale
VENEZIA,Città lagunare di San Marco
VENEZUELA,Paese dell'Orinoco
VENIALE,Può esserlo un oggetto di poco conto
VENIALI,Possono esserlo oggetti di poco conti
VENIER,"La zia della domenica in tv, Mara"
VENIRE,...al dunque: arrivare al punto
VENOM,Il simbionte nero nemico di Spider-Man
VENTAGLI,Muovono aria con un gesto
VENTAGLIO,Fa aria con stecche e carta
VENTAGLIO,Un'ampia gamma di possibilità
VENTAGLIO,Fa aria con un gesto
VENTILATORE,Muove l'aria nelle giornate calde
VENTO,Aria in movimento
VENTO,Avere il...in poppa: essere in piena fortuna
VENTO,Chi lo semina raccoglie tempesta
VENTOSA,Aderisce per aspirazione
VERA,"Autentica, non contraffatta"
VERA,"L'anello nuziale, la fede"
VERA,Può esserlo una storia non falsa
VERACE,"Il napoletano...: autentico, doc"
VERACE,Può esserlo un dato sincero e autentico
VERACI,Possono esserlo dati sinceri e autentici
VERANDA,Ambiente chiuso da vetri o portico coperto
VERBENA,Pianta odorosa da giardino e infusi
VERBO,"Il...divino, la Parola di Dio"
VERBO,Parola che porta l'azione
VERCINGETORIGE,Il capo gallico che resistette a Cesare
VERDE,"Colore di erba, speranza e semaforo"
VERDE,Essere al...: restare senza un soldo
VERDE,Il semaforo che dà via libera
VERDERAME,Patina verde del rame
VERDI,Il Giuseppe del Nabucco
VERDONE,"L'attore e regista romano di tante commedie, Carlo"
VERE,Gli anelli nuziali
VERE,Non falso
VERGA,"Bastone, ramo o scrittore siciliano"
VERGAI,Passato remoto: Scrivere con cura
VERGATO,Participio: Scrivere con cura
VERGINE,Foresta...: quella incontaminata
VERGINE,L'olio extra...d'oliva
VERGINE,Segno zodiacale con la stella Spica
VERGO,Scrivo con cura
VERI,Non falsi
VERITA,L'ora della...: il momento decisivo
VERITA,"Quella che, prima o poi, viene a galla"
VERLAINE,Poeta francese simbolista
VERME,Abitante del terreno e del dubbio
VERME,Il piccolo animale che striscia senza zampe
VERMEER,Il pittore della Ragazza con l'orecchino
VERMEIL,Argento dorato per gioielli
VERMENTINO,Il bianco sardo e ligure
VERMIGLI,Possono esserlo colori rossi accesi
VERMIGLIA,Può esserlo una tinta rossa accesa
VERMIGLIE,Possono esserlo tinte rosse accese
VERMIGLIO,Rosso vivo da pittura
VERMIGLIONE,Rosso vivo da pigmento
VERMONT,Lo Stato americano dello sciroppo d'acero
VERMUT,Aperitivo aromatizzato da Torino
VERNACOLO,Lingua locale e popolare
VERNE,Il Jules di Ventimila leghe sotto i mari
VERNICE,Riveste e colora le superfici
VERNICE,Una...di cultura: superficiale e di facciata
VERO,Ciò che corrisponde alla realtà
VERO,"Non finto, ma spesso da provare"
VERON,"Juan, regista argentino di Lazio e Inter"
VERONA,Città dell'Arena e di Giulietta
VERONE,L'antico balcone aperto
VERONESE,Il Paolo delle Nozze di Cana
VERONESE,L'abitante di Verona
VERONICA,Fiorellino azzurro spontaneo
VERRATTI,"Marco, regista azzurro del PSG"
VERRI,Il Pietro illuminista milanese
VERRICELLO,Argano di piccola taglia
VERROCCHIO,Lo scultore maestro di Leonardo
VERSA,Fa uscire un liquido
VERSACE,Il Gianni della moda italiana
VERSAILLES,La reggia del Re Sole
VERSANTE,Fianco di monte o parte in causa
VERSARE,Far uscire un liquido
VERSATO,Fatto uscire un liquido
VERSO,"Quello dell'animale, come il raglio dell'asino"
VERSO,"Riga poetica, direzione o grido animale"
VERSO,Riga di poesia o voce animale
VERSTAPPEN,Il pilota olandese più volte iridato di F1
VERTEBRA,Ciascun osso della colonna
VERTIGINE,Capogiro davanti al vuoto
VERZA,Il cavolo dalle foglie increspate
VESCICA,Organo che raccoglie l'urina
VESCOVO,Pastore di diocesi e pezzo degli scacchi
VESPA,Lo scooter italiano della Piaggio
VESPA,"Punge, ronza o corre su due ruote"
VESPUCCI,Navigatore che diede il nome all'America
VESSILLO,Bandiera solenne
VESTE,"Abito, ma anche funzione"
VESTE,"L'abito, l'indumento"
VESTIBOLO,Ambiente d'ingresso
VESUVIO,Vulcano che domina Napoli
VETERINARIO,Il medico degli animali
VETO,"Il divieto, l'opposizione netta"
VETO,No con forza istituzionale
VETRAIO,Artigiano che lavora il vetro
VETRATA,Grande finestra colorata o trasparente
VETRINA,Mostra merce senza venderla ancora
VETRINA,Mostra la merce ai passanti
VETRIOLO,"Antico nome di solfati, poi acidità verbale"
VETRO,Materiale trasparente e fragile
VETTA,Cima che non concede oltre
VETTA,La cima più alta del monte
VETTEL,Il pilota tedesco quattro volte iridato di F1
VETTORE,"Grandezza con modulo, direzione e verso"
VETUSTA,Può esserlo una usanza molto antica
VETUSTE,Possono esserlo usanze molto antiche
VETUSTI,Possono esserlo riti molto antichi
VETUSTO,Antico fino alla polvere
VEZZALI,La Valentina fiorettista olimpica
VI,Avverbio di luogo: ...si respira pace
VI,Sigla automobilistica di Vicenza
VIA,Il segnale della partenza
VIA,Lontano: andare...
VIA,Strada o ordine di partenza
VIADOTTO,Ponte lungo su valle o strada
VIAGGERA,Andrà da un luogo a un altro
VIAGGIA,Va da un luogo a un altro
VIAGGIARE,Andare da un luogo a un altro
VIAGGIATO,Andato da un luogo a un altro
VIAGGIO,Movimento nello spazio e nella mente
VIALE,Il largo corso alberato
VIALE,Strada con alberi e passeggio
VIALLI,L'attaccante della Sampdoria scudettata
VIANDANTE,Camminatore da strade antiche
VIATICO,Aiuto per il viaggio o sacramento finale
VIBRAFONO,Strumento a percussione dal suono vibrato
VIBRAI,Passato remoto: Tremare rapidamente
VIBRATO,Oscillazione espressiva del suono
VIBRISSA,Baffo sensibile di molti animali
VICCHIO,Paese natale di Giotto nel Mugello
VICENZA,Città veneta di Palladio
VICHINGHI,Navigatori e guerrieri scandinavi
VICINO,Prossimo nello spazio o nella casa accanto
VICOLO,Quello cieco non porta da nessuna parte
VICOLO,Strada stretta di paese
VICTOR,Il...Frankenstein del romanzo
VICTOR,Il nome dello scrittore Hugo
VICTORIA,Il nome della regina inglese dell'Ottocento
VIDEO,"Immagine in movimento, non per forza film"
VIDEO,Lo schermo del computer e della tv
VIDEOGIOCO,Si gioca col joystick o col mouse
VIE,Le...del Signore sono infinite
VIE,Strade cittadine
VIEIRA,"Patrick, mediano francese di Juve e Arsenal"
VIENNA,Capitale austriaca sul Danubio
VIERI,"Christian, bomber Bobo di Inter e Lazio"
VIETNAM,Paese lungo la costa indocinese
VIGILE,Sorveglia o dirige il traffico
VIGILIA,Attesa prima della festa o della prova
VIGNA,Filari da vendemmia
VIGNA,Il filare dove cresce l'uva
VIGNA,Campo di viti
VIGNAIOLO,Coltiva la vite e produce vino
VIGNETO,Vigna organizzata in filari
VIGORE,Entrare in...: diventare legge operante
VIGORE,Forza piena e vitale
VIKINGS,La serie sui guerrieri scandinavi
VILE,Basso di prezzo o d'animo
VILE,"Il codardo, il vigliacco"
VILIPENDIO,Offesa pubblica a ciò che si dovrebbe rispettare
VILLA,Casa signorile fuori dal rumore
VILLA,La grande casa signorile col giardino
VILLEGGIATURA,Il soggiorno di vacanza
VILLENEUVE,"Il pilota canadese di F1, Gilles"
VILNIUS,Capitale della Lituania
VILUPPO,Intrico difficile da sciogliere
VIMINALE,Fatto di vimini o colle romano
VIMINI,Rami flessibili da intreccio
VINACCIA,Residuo dell'uva dopo la pigiatura
VINCA,Pianta ornamentale dai fiori azzurri
VINCE,Supera gli avversari
VINCENT,Il nome del pittore van Gogh
VINCENZO,Il nome del compositore Bellini
VINCERE,Superare gli avversari
VINCO,Supero gli avversari
VINO,"Il nettare di Bacco, rosso o bianco"
VINO,Nasce dall'uva e migliora racconti
VINSE,Ebbe la meglio
VIOLA,Il fiore profumato di marzo
VIOLA,"La squadra di Firenze, la Fiorentina"
VIOLA,Lo strumento ad arco più grave del violino
VIOLA,"Fiore, colore e strumento musicale"
VIOLETTA,Piccolo fiore viola
VIOLINO,Fare il secondo...: avere un ruolo subordinato
VIOLINO,Strumento ad arco acuto
VIOLONCELLO,Strumento ad arco da suonare seduti
VIP,Persona importante per acronimo
VIPERA,Lingua di...: persona maldicente
VIPERA,Serpente velenoso europeo
VIPERE,Serpenti dal morso velenoso
VIRACOCHA,Il dio creatore degli Inca
VIRAI,Passato remoto: Cambiare direzione
VIRATO,Participio: Cambiare direzione
VIRGILIO,Il poeta dell'Eneide
VIRGILIO,La guida di Dante nell'Inferno
VIRGINIA,Lo Stato americano dei primi coloni inglesi
VIRGO,Costellazione zodiacale latina
VIRGULTO,Giovane ramo flessibile
VIROLOGIA,Lo studio dei virus
VIRTUOSA,Può esserlo una donna abile o morale
VIRTUOSE,Possono esserlo donne abili o morali
VIRTUOSI,Possono esserlo uomini abili o morali
VIRTUOSO,Può esserlo un uomo abile o morale
VIRUS,Minuscolo invasore di cellule e computer
VISA,"Carta o visto, secondo la lingua"
VISCERA,"Interiora, ma anche profondità emotive"
VISCHIO,Pianta natalizia parassita
VISCHIOSO,Appiccicoso e tenace
VISCIDA,Può esserlo una cosa scivolosa o melliflua
VISCIDE,Possono esserlo cose scivolose o melliflue
VISCIDI,Possono esserlo oggetti scivolosi o melliflui
VISCIDO,Scivoloso e poco leale
VISCONTI,Il Luchino del Gattopardo
VISCOSITA,La resistenza di un fluido allo scorrere
VISHNU,Il dio conservatore della trimurti indù
VISIERA,La parte mobile dell'elmo davanti al viso
VISIGOTI,Popolo germanico che fondò un regno in Spagna
VISITA,Far...: andare a trovare qualcuno
VISITA,Va a vedere o trova
VISITARE,Andare a vedere o trovare
VISITATO,Andato a vedere o trovato
VISITO,Vado a vedere o trovo
VISNU,Il dio conservatore dell'induismo
VISO,"Il volto, la faccia"
VISO,Parte che tradisce emozioni
VISO,"Aperto, ispira fiducia"
VISO,Volto della persona
VISONE,Il mustelide dalla pregiata pelliccia
VISTA,"A prima...: al primo sguardo, subito"
VISTA,Il senso degli occhi
VISTA,Senso e panorama
VISTOLA,Fiume di Cracovia e Varsavia
VITA,"Biografia, esistenza o filettatura"
VITA,Il punto più stretto del busto
VITALISMO,La dottrina di un principio vitale irriducibile
VITE,Giro di...: una stretta più severa
VITE,Pianta dell'uva o piccolo elemento filettato
VITELLO,Giovane bovino
VITELLOTONNATO,Il piatto piemontese di vitello in salsa di tonno
VITICCIO,Ricciolo con cui la vite si aggrappa
VITILIGINE,Macchie bianche sulla pelle
VITRUVIO,L'architetto romano del trattato De architectura
VITTI,La Monica musa di Antonioni
VITTORIA,Il maggiore lago dell'Africa
VITTORIA,"Il trionfo, il successo"
VITTORIA,Successo in gara o battaglia
VITTORINI,Autore di Conversazione in Sicilia
VITUPERIO,Biasimo aspro e sonoro
VIVACE,Andamento musicale brioso
VIVAIO,"Dove crescono le piantine, o il serbatoio di giovani talenti"
VIVALDI,L'Antonio delle Quattro stagioni
VIVO,"Acceso, presente o non morto"
VIVO,Vivace e brillante: un colore...
VIZIO,Abitudine cattiva o difetto giuridico
VIZIO,Il difetto opposto alla virtù
VIZZA,Può esserlo una cosa appassita e raggrinzita
VIZZE,Possono esserlo cose appassite e raggrinzite
VIZZI,Possono esserlo oggetti appassiti e raggrinziti
VIZZO,Può esserlo un oggetto appassito e raggrinzito
VLADIMIR,Il nome dello scrittore Nabokov
VOCATIVO,Caso di chi chiama
VOCE,La diceria che gira
VOCE,La parola registrata nel vocabolario
VOCE,"Suono umano, o lemma di elenco"
VOCE,Corre più veloce dei fatti
VOCI,Elementi d'elenco o suoni umani
VOCIO,Il confuso parlare di molti
VODKA,Il distillato russo incolore
VOGA,La moda: essere di gran...
VOGA,Remo in movimento e moda passeggera
VOGLIA,"Il desiderio improvviso, o la macchia di nascita"
VOI,Dare del...: l'antica forma di cortesia
VOL,Abbrevia tomo in biblioteca
VOL,"Il volo, in francese"
VOLA,Il tempo...: passa in fretta
VOLA,Si muove nell'aria
VOLANO,Ruota pesante o oggetto del badminton
VOLANS,Il Pesce volante dei cieli australi
VOLARE,La celebre canzone di Modugno
VOLARE,Muoversi nell'aria
VOLATA,La...finale che decide la corsa
VOLATA,Sprint finale di una corsa ciclistica
VOLATO,Librato in aria
VOLDEMORT,Il mago oscuro nemico di Harry Potter
VOLERE,Chi troppo...nulla stringe
VOLGA,Grande fiume russo verso il Caspio
VOLITIVO,Governato dalla volontà
VOLKSWAGEN,La casa tedesca del Maggiolino
VOLO,Prendere al...: afferrare al primo istante
VOLO,Viaggio senza toccare terra
VOLPE,Il furbo carnivoro dalla coda folta
VOLPE,Vecchia...: persona scaltra
VOLPE,Animale simbolo di furbizia
VOLPE,Perde il pelo ma non il vizio
VOLPETTA,Piccola costellazione presso il Cigno
VOLPI,Animali proverbiali per furbizia
VOLSCI,Popolo italico nemico di Roma
VOLT,L'unità di misura della tensione elettrica
VOLTA,C'era una...: l'inizio classico delle fiabe
VOLTA,L'Alessandro della pila elettrica
VOLTAIRE,Filosofo illuminista del Candide
VOLTO,Faccia che si legge
VOLTO,"La faccia, il viso"
VOLTRON,Il robot gigante formato da cinque leoni
VOLUBILE,Può esserlo un oggetto facile a cambiare ideo
VOLUBILI,Possono esserlo oggetti facili a cambiare idei
VOLUBILIS,Sito romano nel Marocco
VOLUME,"Il libro, o l'intensità del suono da regolare"
VOMERE,La lama dell'aratro che fende il suolo
VONGOLA,Mollusco bivalve per gli spaghetti
VORTICE,Mulinello d'acqua o d'aria
VORTICE,Giro rapido d'acqua o vento
VOTA,Esprime una scelta
VOTARE,Esprimere una scelta
VOTATO,Espresso una scelta
VOTO,"Quello scolastico, dall'uno al dieci"
VOTO,Scelta in cabina o promessa religiosa
VOYAGER,La sonda spaziale ai confini del Sistema Solare
VR,Iniziali del rocker Rossi
VR,"La realtà virtuale, in sigla"
VR,Sigla automobilistica di Verona
VT,Sigla automobilistica di Viterbo
VT,Volt senza lettere interne
VULCANI,Dormono finché non eruttano
VULCANO,Il dio romano del fuoco e delle fucine
VULCANO,Montagna che respira fuoco
VULCANO,Monte che può eruttare lava
VULGATA,Versione latina della Bibbia
VULPECULA,Nome latino della Volpetta
VUOTA,Può esserlo una cosa senza contenuto
VUOTE,Possono esserlo cose senza contenuto
VUOTI,Possono esserlo oggetti senza contenuto
VUOTO,Assegno a...: senza copertura
VUOTO,Il...d'aria che fa sobbalzare l'aereo
VUOTO,Può esserlo un oggetto senza contenuto
VV,Iniziali del matematico Volterra
VV,Sigla automobilistica di Vibo Valentia
